fic_id,chapter_id,para_id,text,text_tokenized
pride_28,1,129,But do not deceive yourself into a belief that I will ever recede . ,But do not deceive yourself into a belief that I will ever recede . 
pride_28,1,130,I shall not go away till you have given me the assurance I require . ” “ And I certainly _ never _ shall give it . ,I shall not go away till you have given me the assurance I require . ” “ And I certainly _ never _ shall give it . 
pride_28,1,131,I am not to be intimidated into anything so wholly unreasonable . ,I am not to be intimidated into anything so wholly unreasonable . 
pride_28,1,132,Your Ladyship wants Mr. Darcy to marry your daughter ; but would my giving you the wished - for promise make _ their _ marriage at all more probable ? ,Your Ladyship wants Mr. Darcy to marry your daughter ; but would my giving you the wished - for promise make _ their _ marriage at all more probable ? 
pride_28,1,133,"Supposing him to be attached to me , would _ my _ refusing to accept his hand make him wish to bestow it on his cousin ? ","Supposing him to be attached to me , would _ my _ refusing to accept his hand make him wish to bestow it on his cousin ? "
pride_28,1,134,"Allow me to say , Lady Catherine , that the arguments with which you have supported this extraordinary application have been as frivolous as the application was ill - judged . ","Allow me to say , Lady Catherine , that the arguments with which you have supported this extraordinary application have been as frivolous as the application was ill - judged . "
pride_28,1,135,"You have widely mistaken my character , if you think I can be worked on by such persuasions as these . ","You have widely mistaken my character , if you think I can be worked on by such persuasions as these . "
pride_28,1,136,"How far your nephew might approve of your interference in _ his _ affairs , I can not tell ; but you have certainly no right to concern yourself in mine . ","How far your nephew might approve of your interference in _ his _ affairs , I can not tell ; but you have certainly no right to concern yourself in mine . "
pride_28,1,137,"I must beg , therefore , to be importuned no further on the subject . ” “ Not so hasty , if you please . I have by no means done . ","I must beg , therefore , to be importuned no further on the subject . ” “ Not so hasty , if you please . I have by no means done . "
pride_28,1,138,To all the objections I have already urged I have still another to add . ,To all the objections I have already urged I have still another to add . 
pride_28,1,139,I am no stranger to the particulars of your youngest sister ’s infamous elopement . ,I am no stranger to the particulars of your youngest sister ’s infamous elopement . 
pride_28,1,140,"I know it all ; that the young man ’s marrying her was a patched - up business , at the expense of your father and uncle . ","I know it all ; that the young man ’s marrying her was a patched - up business , at the expense of your father and uncle . "
pride_28,1,141,And is _ such _ a girl to be my nephew ’s sister ? ,And is _ such _ a girl to be my nephew ’s sister ? 
pride_28,1,142,"Is _ her _ husband , who is the son of his late father ’s steward , to be his brother ? ","Is _ her _ husband , who is the son of his late father ’s steward , to be his brother ? "
pride_28,1,143,Heaven and earth!--of what are you thinking ? ,Heaven and earth!--of what are you thinking ? 
pride_28,1,144,Are the shades of Pemberley to be thus polluted ? ,Are the shades of Pemberley to be thus polluted ? 
pride_28,1,145,” ,” 
pride_28,1,146,"“ You can _ now _ have nothing further to say , ” she resentfully answered . ","“ You can _ now _ have nothing further to say , ” she resentfully answered . "
pride_28,1,147,"“ You have insulted me , in every possible method . ","“ You have insulted me , in every possible method . "
pride_28,1,148,I must beg to return to the house . ” And she rose as she spoke . ,I must beg to return to the house . ” And she rose as she spoke . 
pride_28,1,149,"Lady Catherine rose also , and they turned back . ","Lady Catherine rose also , and they turned back . "
pride_28,1,150,Her Ladyship was highly incensed . ,Her Ladyship was highly incensed . 
pride_28,1,151,"“ You have no regard , then , for the honour and credit of my nephew ! ","“ You have no regard , then , for the honour and credit of my nephew ! "
pride_28,1,152,"Unfeeling , selfish girl ! Do you not consider that a connection with you must disgrace him in the eyes of everybody ? ” ","Unfeeling , selfish girl ! Do you not consider that a connection with you must disgrace him in the eyes of everybody ? ” "
pride_28,1,153,"“ Lady Catherine , I have nothing further to say . ","“ Lady Catherine , I have nothing further to say . "
pride_28,1,154,You know my sentiments . ” ,You know my sentiments . ” 
pride_28,1,155,“ You are then resolved to have him ? ” ,“ You are then resolved to have him ? ” 
pride_28,1,156,“ I have said no such thing . ,“ I have said no such thing . 
pride_28,1,157,"I am only resolved to act in that manner , which will , in my own opinion , constitute my happiness , without reference to _ you _ , or to any person so wholly unconnected with me . ” ","I am only resolved to act in that manner , which will , in my own opinion , constitute my happiness , without reference to _ you _ , or to any person so wholly unconnected with me . ” "
pride_28,1,158,“ It is well . ,“ It is well . 
pride_28,1,159,"You refuse , then , to oblige me . ","You refuse , then , to oblige me . "
pride_28,1,160,"You refuse to obey the claims of duty , honour , and gratitude . ","You refuse to obey the claims of duty , honour , and gratitude . "
pride_28,1,161,"You are determined to ruin him in the opinion of all his friends , and make him the contempt of the world . ” ","You are determined to ruin him in the opinion of all his friends , and make him the contempt of the world . ” "
pride_28,1,162,"“ Neither duty , nor honour , nor gratitude , ” replied Elizabeth , “ has any possible claim on me , in the present instance . ","“ Neither duty , nor honour , nor gratitude , ” replied Elizabeth , “ has any possible claim on me , in the present instance . "
pride_28,1,163,No principle of either would be violated by my marriage with Mr. Darcy . ,No principle of either would be violated by my marriage with Mr. Darcy . 
pride_28,1,164,"And with regard to the resentment of his family , or the indignation of the world , if the former _ were _ excited by his marrying me , it would not give me one moment ’s concern -- and the world in general would have too much sense to join in the scorn . ","And with regard to the resentment of his family , or the indignation of the world , if the former _ were _ excited by his marrying me , it would not give me one moment ’s concern -- and the world in general would have too much sense to join in the scorn . "
pride_28,1,165,” ,” 
pride_28,1,166,“ And this is your real opinion ! ,“ And this is your real opinion ! 
pride_28,1,167,This is your final resolve ! ,This is your final resolve ! 
pride_28,1,168,Very well . ,Very well . 
pride_28,1,169,I shall now know how to act . ,I shall now know how to act . 
pride_28,1,170,"Do not imagine , Miss Bennet , that your ambition will ever be gratified . ","Do not imagine , Miss Bennet , that your ambition will ever be gratified . "
pride_28,1,171,I came to try you . ,I came to try you . 
pride_28,1,172,I hoped to find you reasonable ; but depend upon it I will carry my point . ” ,I hoped to find you reasonable ; but depend upon it I will carry my point . ” 
pride_28,1,173,"In this manner Lady Catherine talked on till they were at the door of the carriage , when , turning hastily round , she added,-- “ I take no leave of you , Miss Bennet . ","In this manner Lady Catherine talked on till they were at the door of the carriage , when , turning hastily round , she added,-- “ I take no leave of you , Miss Bennet . "
pride_28,1,174,I send no compliments to your mother . ,I send no compliments to your mother . 
pride_28,1,175,You deserve no such attention . ,You deserve no such attention . 
pride_28,1,176,I am most seriously displeased . ” ,I am most seriously displeased . ” 
pride_28,1,177,"Elizabeth made no answer ; and without attempting to persuade her Ladyship to return into the house , walked quietly into it herself . ","Elizabeth made no answer ; and without attempting to persuade her Ladyship to return into the house , walked quietly into it herself . "
pride_28,1,178,She heard the carriage drive away as she proceeded upstairs . ,She heard the carriage drive away as she proceeded upstairs . 
pride_28,1,179,"Her mother impatiently met her at the door of her dressing - room , to ask why Lady Catherine would not come in again and rest herself . ","Her mother impatiently met her at the door of her dressing - room , to ask why Lady Catherine would not come in again and rest herself . "
pride_28,1,180,"“ She did not choose it , ” said her daughter ; “ she would go . ” ","“ She did not choose it , ” said her daughter ; “ she would go . ” "
pride_28,1,181,“ She is a very fine - looking woman ! ,“ She is a very fine - looking woman ! 
pride_28,1,182,and her calling here was prodigiously civil ! ,and her calling here was prodigiously civil ! 
pride_28,1,183,"for she only came , I suppose , to tell us the Collinses were well . ","for she only came , I suppose , to tell us the Collinses were well . "
pride_28,1,184,"She is on her road somewhere , I dare say ; and so , passing through Meryton , thought she might as well call on you . I suppose she had nothing particular to say to you , Lizzy ? ” ","She is on her road somewhere , I dare say ; and so , passing through Meryton , thought she might as well call on you . I suppose she had nothing particular to say to you , Lizzy ? ” "
pride_28,1,185,Elizabeth was forced to give in to a little falsehood here ; for to acknowledge the substance of their conversation was impossible . ,Elizabeth was forced to give in to a little falsehood here ; for to acknowledge the substance of their conversation was impossible . 
pride_28,2,1, LVII . , LVII . 
pride_28,2,2,The discomposure of spirits which this extraordinary visit threw Elizabeth into could not be easily overcome ; nor could she for many hours learn to think of it less than incessantly . ,The discomposure of spirits which this extraordinary visit threw Elizabeth into could not be easily overcome ; nor could she for many hours learn to think of it less than incessantly . 
pride_28,2,3,"Lady Catherine , it appeared , had actually taken the trouble of this journey from Rosings for the sole purpose of breaking off her supposed engagement with Mr. Darcy . ","Lady Catherine , it appeared , had actually taken the trouble of this journey from Rosings for the sole purpose of breaking off her supposed engagement with Mr. Darcy . "
pride_28,2,4,"It was a rational scheme , to be sure ! ","It was a rational scheme , to be sure ! "
pride_28,2,5,"but from what the report of their engagement could originate , Elizabeth was at a loss to imagine ; till she recollected that _ his _ being the intimate friend of Bingley , and _ her _ being the sister of Jane , was enough , at a time when the expectation of one wedding made everybody eager for another , to supply the idea . ","but from what the report of their engagement could originate , Elizabeth was at a loss to imagine ; till she recollected that _ his _ being the intimate friend of Bingley , and _ her _ being the sister of Jane , was enough , at a time when the expectation of one wedding made everybody eager for another , to supply the idea . "
pride_28,2,6,She had not herself forgotten to feel that the marriage of her sister must bring them more frequently together . ,She had not herself forgotten to feel that the marriage of her sister must bring them more frequently together . 
pride_28,2,7,"And her neighbours at Lucas Lodge , therefore , ( for through their communication with the Collinses , the report , she concluded , had reached Lady Catherine , ) had only set _ that _ down as almost certain and immediate which _ she _ had looked forward to as possible at some future time . ","And her neighbours at Lucas Lodge , therefore , ( for through their communication with the Collinses , the report , she concluded , had reached Lady Catherine , ) had only set _ that _ down as almost certain and immediate which _ she _ had looked forward to as possible at some future time . "
pride_28,2,8,"In revolving Lady Catherine ’s expressions , however , she could not help feeling some uneasiness as to the possible consequence of her persisting in this interference . ","In revolving Lady Catherine ’s expressions , however , she could not help feeling some uneasiness as to the possible consequence of her persisting in this interference . "
pride_28,2,9,"From what she had said of her resolution to prevent the marriage , it occurred to Elizabeth that she must meditate an application to her nephew ; and how he might take a similar representation of the evils attached to a connection with her she dared not pronounce . ","From what she had said of her resolution to prevent the marriage , it occurred to Elizabeth that she must meditate an application to her nephew ; and how he might take a similar representation of the evils attached to a connection with her she dared not pronounce . "
pride_28,2,10,"She knew not the exact degree of his affection for his aunt , or his dependence on her judgment , but it was natural to suppose that he thought much higher of her Ladyship than _ she _ could do ; and it was certain , that in enumerating the miseries of a marriage with _ one _ whose immediate connections were so unequal to his own , his aunt would address him on his weakest side . ","She knew not the exact degree of his affection for his aunt , or his dependence on her judgment , but it was natural to suppose that he thought much higher of her Ladyship than _ she _ could do ; and it was certain , that in enumerating the miseries of a marriage with _ one _ whose immediate connections were so unequal to his own , his aunt would address him on his weakest side . "
pride_28,2,11,"With his notions of dignity , he would probably feel that the arguments , which to Elizabeth had appeared weak and ridiculous , contained much good sense and solid reasoning . ","With his notions of dignity , he would probably feel that the arguments , which to Elizabeth had appeared weak and ridiculous , contained much good sense and solid reasoning . "
pride_28,2,12,"If he had been wavering before , as to what he should do , which had often seemed likely , the advice and entreaty of so near a relation might settle every doubt , and determine him at once to be as happy as dignity unblemished could make him . ","If he had been wavering before , as to what he should do , which had often seemed likely , the advice and entreaty of so near a relation might settle every doubt , and determine him at once to be as happy as dignity unblemished could make him . "
pride_28,2,13,In that case he would return no more . ,In that case he would return no more . 
pride_28,2,14,Lady Catherine might see him in her way through town ; and his engagement to Bingley of coming again to Netherfield must give way . ,Lady Catherine might see him in her way through town ; and his engagement to Bingley of coming again to Netherfield must give way . 
pride_28,2,15,"“ If , therefore , an excuse for not keeping his promise should come to his friend within a few days , ” she added , “ I shall know how to understand it . ","“ If , therefore , an excuse for not keeping his promise should come to his friend within a few days , ” she added , “ I shall know how to understand it . "
pride_28,2,16,"I shall then give over every expectation , every wish of his constancy . ","I shall then give over every expectation , every wish of his constancy . "
pride_28,2,17,"If he is satisfied with only regretting me , when he might have obtained my affections and hand , I shall soon cease to regret him at all . ” The surprise of the rest of the family , on hearing who their visitor had been , was very great : but they obligingly satisfied it with the same kind of supposition which had appeased Mrs. Bennet ’s curiosity ; and Elizabeth was spared from much teasing on the subject . The next morning , as she was going down stairs , she was met by her father , who came out of his library with a letter in his hand . ","If he is satisfied with only regretting me , when he might have obtained my affections and hand , I shall soon cease to regret him at all . ” The surprise of the rest of the family , on hearing who their visitor had been , was very great : but they obligingly satisfied it with the same kind of supposition which had appeased Mrs. Bennet ’s curiosity ; and Elizabeth was spared from much teasing on the subject . The next morning , as she was going down stairs , she was met by her father , who came out of his library with a letter in his hand . "
pride_28,2,18,"“ Lizzy , ” said he , “ I was going to look for you : come into my room . ” She followed him thither ; and her curiosity to know what he had to tell her was heightened by the supposition of its being in some manner connected with the letter he held . ","“ Lizzy , ” said he , “ I was going to look for you : come into my room . ” She followed him thither ; and her curiosity to know what he had to tell her was heightened by the supposition of its being in some manner connected with the letter he held . "
pride_28,2,19,"It suddenly struck her that it might be from Lady Catherine , and she anticipated with dismay all the consequent explanations . ","It suddenly struck her that it might be from Lady Catherine , and she anticipated with dismay all the consequent explanations . "
pride_28,2,20,"She followed her father to the fireplace , and they both sat down . ","She followed her father to the fireplace , and they both sat down . "
pride_28,2,21,"He then said,-- “ I have received a letter this morning that has astonished me exceedingly . ","He then said,-- “ I have received a letter this morning that has astonished me exceedingly . "
pride_28,2,22,"As it principally concerns yourself , you ought to know its contents . ","As it principally concerns yourself , you ought to know its contents . "
pride_28,2,23,I did not know before that I had _ two _ daughters on the brink of matrimony . ,I did not know before that I had _ two _ daughters on the brink of matrimony . 
pride_28,2,24,Let me congratulate you on a very important conquest . ,Let me congratulate you on a very important conquest . 
pride_28,2,25,” ,” 
pride_28,2,26,"The colour now rushed into Elizabeth ’s cheeks in the instantaneous conviction of its being a letter from the nephew , instead of the aunt ; and she was undetermined whether most to be pleased that he explained himself at all , or offended that his letter was not rather addressed to herself , when her father continued,-- “ You look conscious . ","The colour now rushed into Elizabeth ’s cheeks in the instantaneous conviction of its being a letter from the nephew , instead of the aunt ; and she was undetermined whether most to be pleased that he explained himself at all , or offended that his letter was not rather addressed to herself , when her father continued,-- “ You look conscious . "
pride_28,2,27,Young ladies have great penetration in such matters as these ; but I think I may defy even _ your _ sagacity to discover the name of your admirer . ,Young ladies have great penetration in such matters as these ; but I think I may defy even _ your _ sagacity to discover the name of your admirer . 
pride_28,2,28,This letter is from Mr. Collins . ” ,This letter is from Mr. Collins . ” 
pride_28,2,29,“ From Mr. Collins ! ,“ From Mr. Collins ! 
pride_28,2,30,"and what can _ he _ have to say ? ” “ Something very much to the purpose , of course . ","and what can _ he _ have to say ? ” “ Something very much to the purpose , of course . "
pride_28,2,31,"He begins with congratulations on the approaching nuptials of my eldest daughter , of which , it seems , he has been told by some of the good - natured , gossiping Lucases . ","He begins with congratulations on the approaching nuptials of my eldest daughter , of which , it seems , he has been told by some of the good - natured , gossiping Lucases . "
pride_28,2,32,I shall not sport with your impatience by reading what he says on that point . ,I shall not sport with your impatience by reading what he says on that point . 
pride_28,2,33,"What relates to yourself is as follows:--‘Having thus offered you the sincere congratulations of Mrs. Collins and myself on this happy event , let me now add a short hint on the subject of another , of which we have been advertised by the same authority . ","What relates to yourself is as follows:--‘Having thus offered you the sincere congratulations of Mrs. Collins and myself on this happy event , let me now add a short hint on the subject of another , of which we have been advertised by the same authority . "
pride_28,2,34,Your daughter Elizabeth ,Your daughter Elizabeth 
pride_28,2,35,", it is presumed , will not long bear the name of Bennet , after her eldest sister has resigned it ; and the chosen partner of her fate may be reasonably looked up to as one of the most illustrious personages in this land . ’ ",", it is presumed , will not long bear the name of Bennet , after her eldest sister has resigned it ; and the chosen partner of her fate may be reasonably looked up to as one of the most illustrious personages in this land . ’ "
pride_28,2,36,"Can you possibly guess , Lizzy , who is meant by this ? ","Can you possibly guess , Lizzy , who is meant by this ? "
pride_28,2,37,"‘ This young gentleman is blessed , in a peculiar way , with everything the heart of mortal can most desire,--splendid property , noble kindred , and extensive patronage . ","‘ This young gentleman is blessed , in a peculiar way , with everything the heart of mortal can most desire,--splendid property , noble kindred , and extensive patronage . "
pride_28,2,38,"Yet , in spite of all these temptations , let me warn my cousin Elizabeth , and yourself , of what evils you may incur by a precipitate closure with this gentleman ’s proposals , which , of course , you will be inclined to take immediate advantage of . ’ ","Yet , in spite of all these temptations , let me warn my cousin Elizabeth , and yourself , of what evils you may incur by a precipitate closure with this gentleman ’s proposals , which , of course , you will be inclined to take immediate advantage of . ’ "
pride_28,2,39,"Have you any idea , Lizzy , who this gentleman is ? ","Have you any idea , Lizzy , who this gentleman is ? "
pride_28,2,40,But now it comes out . ,But now it comes out . 
pride_28,2,41,"‘ My motive for cautioning you is as follows:--We have reason to imagine that his aunt , Lady Catherine de Bourgh , does not look on the match with a friendly eye . ’ ","‘ My motive for cautioning you is as follows:--We have reason to imagine that his aunt , Lady Catherine de Bourgh , does not look on the match with a friendly eye . ’ "
pride_28,2,42,"_ Mr. Darcy _ , you see , is the man ! ","_ Mr. Darcy _ , you see , is the man ! "
pride_28,2,43,"Now , Lizzy , I think I _ have _ surprised you . ","Now , Lizzy , I think I _ have _ surprised you . "
pride_28,2,44,"Could he , or the Lucases , have pitched on any man , within the circle of our acquaintance , whose name would have given the lie more effectually to what they related ? ","Could he , or the Lucases , have pitched on any man , within the circle of our acquaintance , whose name would have given the lie more effectually to what they related ? "
pride_28,2,45,"Mr. Darcy , who never looks at any woman but to see a blemish , and who probably never looked at _ you _ in his life ! ","Mr. Darcy , who never looks at any woman but to see a blemish , and who probably never looked at _ you _ in his life ! "
pride_28,2,46,It is admirable ! ” ,It is admirable ! ” 
pride_28,2,47,"Elizabeth tried to join in her father ’s pleasantry , but could only force one most reluctant smile . ","Elizabeth tried to join in her father ’s pleasantry , but could only force one most reluctant smile . "
pride_28,2,48,Never had his wit been directed in a manner so little agreeable to her . “ Are you not diverted ? ” ,Never had his wit been directed in a manner so little agreeable to her . “ Are you not diverted ? ” 
pride_28,2,49,"“ Oh , yes . ","“ Oh , yes . "
pride_28,2,50,Pray read on . ” ,Pray read on . ” 
pride_28,2,51,"“ ‘ After mentioning the likelihood of this marriage to her Ladyship last night , she immediately , with her usual condescension , expressed what she felt on the occasion ; when it became apparent , that , on the score of some family objections on the part of my cousin , she would never give her consent to what she termed so disgraceful a match . ","“ ‘ After mentioning the likelihood of this marriage to her Ladyship last night , she immediately , with her usual condescension , expressed what she felt on the occasion ; when it became apparent , that , on the score of some family objections on the part of my cousin , she would never give her consent to what she termed so disgraceful a match . "
