fic_id,chapter_id,para_id,text,text_tokenized
pride_20,2,28,"A resemblance in good - humour and good spirits had recommended her and Lydia to each other , and out of their _ three _ months ’ acquaintance they had been intimate _ two _ . ","A resemblance in good - humour and good spirits had recommended her and Lydia to each other , and out of their _ three _ months ’ acquaintance they had been intimate _ two _ . "
pride_20,2,29,"The rapture of Lydia on this occasion , her adoration of Mrs. Forster , the delight of Mrs. Bennet , and the mortification of Kitty , are scarcely to be described . ","The rapture of Lydia on this occasion , her adoration of Mrs. Forster , the delight of Mrs. Bennet , and the mortification of Kitty , are scarcely to be described . "
pride_20,2,30,"Wholly inattentive to her sister ’s feelings , Lydia flew about the house in restless ecstasy , calling for everyone ’s congratulations , and laughing and talking with more violence than ever ; whilst the luckless Kitty continued in the parlour repining at her fate in terms as unreasonable as her accent was peevish . “ I can not see why Mrs. Forster should not ask _ me _ as well as Lydia , ” said she , “ though I am _ not _ her particular friend . ","Wholly inattentive to her sister ’s feelings , Lydia flew about the house in restless ecstasy , calling for everyone ’s congratulations , and laughing and talking with more violence than ever ; whilst the luckless Kitty continued in the parlour repining at her fate in terms as unreasonable as her accent was peevish . “ I can not see why Mrs. Forster should not ask _ me _ as well as Lydia , ” said she , “ though I am _ not _ her particular friend . "
pride_20,2,31,"I have just as much right to be asked as she has , and more too , for I am two years older . ” ","I have just as much right to be asked as she has , and more too , for I am two years older . ” "
pride_20,2,32,"In vain did Elizabeth attempt to make her reasonable , and Jane to make her resigned . ","In vain did Elizabeth attempt to make her reasonable , and Jane to make her resigned . "
pride_20,2,33,"As for Elizabeth herself , this invitation was so far from exciting in her the same feelings as in her mother and Lydia , that she considered it as the death - warrant of all possibility of common sense for the latter ; and detestable as such a step must make her , were it known , she could not help secretly advising her father not to let her go . ","As for Elizabeth herself , this invitation was so far from exciting in her the same feelings as in her mother and Lydia , that she considered it as the death - warrant of all possibility of common sense for the latter ; and detestable as such a step must make her , were it known , she could not help secretly advising her father not to let her go . "
pride_20,2,34,"She represented to him all the improprieties of Lydia ’s general behaviour , the little advantage she could derive from the friendship of such a woman as Mrs. Forster , and the probability of her being yet more imprudent with such a companion at Brighton , where the temptations must be greater than at home . ","She represented to him all the improprieties of Lydia ’s general behaviour , the little advantage she could derive from the friendship of such a woman as Mrs. Forster , and the probability of her being yet more imprudent with such a companion at Brighton , where the temptations must be greater than at home . "
pride_20,2,35,"He heard her attentively , and then said,-- “ Lydia will never be easy till she has exposed herself in some public place or other , and we can never expect her to do it with so little expense or inconvenience to her family as under the present circumstances . ” ","He heard her attentively , and then said,-- “ Lydia will never be easy till she has exposed herself in some public place or other , and we can never expect her to do it with so little expense or inconvenience to her family as under the present circumstances . ” "
pride_20,2,36,"“ If you were aware , ” said Elizabeth , “ of the very great disadvantage to us all , which must arise from the public notice of Lydia ’s unguarded and imprudent manner , nay , which has already arisen from it , I am sure you would judge differently in the affair . ” “ Already arisen ! ” repeated Mr. Bennet . ","“ If you were aware , ” said Elizabeth , “ of the very great disadvantage to us all , which must arise from the public notice of Lydia ’s unguarded and imprudent manner , nay , which has already arisen from it , I am sure you would judge differently in the affair . ” “ Already arisen ! ” repeated Mr. Bennet . "
pride_20,2,37,“ What ! has she frightened away some of your lovers ? ,“ What ! has she frightened away some of your lovers ? 
pride_20,2,38,Poor little Lizzy ! ,Poor little Lizzy ! 
pride_20,2,39,But do not be cast down . ,But do not be cast down . 
pride_20,2,40,Such squeamish youths as can not bear to be connected with a little absurdity are not worth a regret . ,Such squeamish youths as can not bear to be connected with a little absurdity are not worth a regret . 
pride_20,2,41,"Come , let me see the list of the pitiful fellows who have been kept aloof by Lydia ’s folly . ” ","Come , let me see the list of the pitiful fellows who have been kept aloof by Lydia ’s folly . ” "
pride_20,2,42,"“ Indeed , you are mistaken . ","“ Indeed , you are mistaken . "
pride_20,2,43,I have no such injuries to resent . ,I have no such injuries to resent . 
pride_20,2,44,"It is not of peculiar , but of general evils , which I am now complaining . ","It is not of peculiar , but of general evils , which I am now complaining . "
pride_20,2,45,"Our importance , our respectability in the world , must be affected by the wild volatility , the assurance and disdain of all restraint which mark Lydia ’s character . ","Our importance , our respectability in the world , must be affected by the wild volatility , the assurance and disdain of all restraint which mark Lydia ’s character . "
pride_20,2,46,"Excuse me,--for I must speak plainly . ","Excuse me,--for I must speak plainly . "
pride_20,2,47,"If you , my dear father , will not take the trouble of checking her exuberant spirits , and of teaching her that her present pursuits are not to be the business of her life , she will soon be beyond the reach of amendment . ","If you , my dear father , will not take the trouble of checking her exuberant spirits , and of teaching her that her present pursuits are not to be the business of her life , she will soon be beyond the reach of amendment . "
pride_20,2,48,"Her character will be fixed ; and she will , at sixteen , be the most determined flirt that ever made herself and her family ridiculous;--a flirt , too , in the worst and meanest degree of flirtation ; without any attraction beyond youth and a tolerable person ; and , from the ignorance and emptiness of her mind , wholly unable to ward off any portion of that universal contempt which her rage for admiration will excite . ","Her character will be fixed ; and she will , at sixteen , be the most determined flirt that ever made herself and her family ridiculous;--a flirt , too , in the worst and meanest degree of flirtation ; without any attraction beyond youth and a tolerable person ; and , from the ignorance and emptiness of her mind , wholly unable to ward off any portion of that universal contempt which her rage for admiration will excite . "
pride_20,2,49,In this danger Kitty is also comprehended . ,In this danger Kitty is also comprehended . 
pride_20,2,50,She will follow wherever Lydia leads . ,She will follow wherever Lydia leads . 
pride_20,2,51,"Vain , ignorant , idle , and absolutely uncontrolled ! ","Vain , ignorant , idle , and absolutely uncontrolled ! "
pride_20,2,52,"Oh , my dear father , can you suppose it possible that they will not be censured and despised wherever they are known , and that their sisters will not be often involved in the disgrace ? ","Oh , my dear father , can you suppose it possible that they will not be censured and despised wherever they are known , and that their sisters will not be often involved in the disgrace ? "
pride_20,2,53,"” Mr. Bennet saw that her whole heart was in the subject ; and , affectionately taking her hand , said , in reply,-- “ Do not make yourself uneasy , my love . ","” Mr. Bennet saw that her whole heart was in the subject ; and , affectionately taking her hand , said , in reply,-- “ Do not make yourself uneasy , my love . "
pride_20,2,54,"Wherever you and Jane are known , you must be respected and valued ; and you will not appear to less advantage for having a couple of -- or I may say , three -- very silly sisters . ","Wherever you and Jane are known , you must be respected and valued ; and you will not appear to less advantage for having a couple of -- or I may say , three -- very silly sisters . "
pride_20,2,55,We shall have no peace at Longbourn if Lydia does not go to Brighton . ,We shall have no peace at Longbourn if Lydia does not go to Brighton . 
pride_20,2,56,"Let her go , then . ","Let her go , then . "
pride_20,2,57,"Colonel Forster is a sensible man , and will keep her out of any real mischief ; and she is luckily too poor to be an object of prey to anybody . ","Colonel Forster is a sensible man , and will keep her out of any real mischief ; and she is luckily too poor to be an object of prey to anybody . "
pride_20,2,58,At Brighton she will be of less importance even as a common flirt than she has been here . ,At Brighton she will be of less importance even as a common flirt than she has been here . 
pride_20,2,59,The officers will find women better worth their notice . ,The officers will find women better worth their notice . 
pride_20,2,60,"Let us hope , therefore , that her being there may teach her her own insignificance . ","Let us hope , therefore , that her being there may teach her her own insignificance . "
pride_20,2,61,"At any rate , she can not grow many degrees worse , without authorizing us to lock her up for the rest of her life . ” With this answer Elizabeth was forced to be content ; but her own opinion continued the same , and she left him disappointed and sorry . ","At any rate , she can not grow many degrees worse , without authorizing us to lock her up for the rest of her life . ” With this answer Elizabeth was forced to be content ; but her own opinion continued the same , and she left him disappointed and sorry . "
pride_20,2,62,"It was not in her nature , however , to increase her vexations by dwelling on them . ","It was not in her nature , however , to increase her vexations by dwelling on them . "
pride_20,2,63,"She was confident of having performed her duty ; and to fret over unavoidable evils , or augment them by anxiety , was no part of her disposition . ","She was confident of having performed her duty ; and to fret over unavoidable evils , or augment them by anxiety , was no part of her disposition . "
pride_20,2,64,"Had Lydia and her mother known the substance of her conference with her father , their indignation would hardly have found expression in their united volubility . ","Had Lydia and her mother known the substance of her conference with her father , their indignation would hardly have found expression in their united volubility . "
pride_20,2,65,"In Lydia ’s imagination , a visit to Brighton comprised every possibility of earthly happiness . ","In Lydia ’s imagination , a visit to Brighton comprised every possibility of earthly happiness . "
pride_20,2,66,"She saw , with the creative eye of fancy , the streets of that gay bathing - place covered with officers . ","She saw , with the creative eye of fancy , the streets of that gay bathing - place covered with officers . "
pride_20,2,67,She saw herself the object of attention to tens and to scores of them at present unknown . ,She saw herself the object of attention to tens and to scores of them at present unknown . 
pride_20,2,68,"She saw all the glories of the camp : its tents stretched forth in beauteous uniformity of lines , crowded with the young and the gay , and dazzling with scarlet ; and , to complete the view , she saw herself seated beneath a tent , tenderly flirting with at least six officers at once . ","She saw all the glories of the camp : its tents stretched forth in beauteous uniformity of lines , crowded with the young and the gay , and dazzling with scarlet ; and , to complete the view , she saw herself seated beneath a tent , tenderly flirting with at least six officers at once . "
pride_20,2,69,"Had she known that her sister sought to tear her from such prospects and such realities as these , what would have been her sensations ? ","Had she known that her sister sought to tear her from such prospects and such realities as these , what would have been her sensations ? "
pride_20,2,70,They could ,They could 
pride_20,2,71,"have been understood only by her mother , who might have felt nearly the same . ","have been understood only by her mother , who might have felt nearly the same . "
pride_20,2,72,Lydia ’s going to Brighton was all that consoled her for the melancholy conviction of her husband ’s never intending to go there himself . ,Lydia ’s going to Brighton was all that consoled her for the melancholy conviction of her husband ’s never intending to go there himself . 
pride_20,2,73,"But they were entirely ignorant of what had passed ; and their raptures continued , with little intermission , to the very day of Lydia ’s leaving home . ","But they were entirely ignorant of what had passed ; and their raptures continued , with little intermission , to the very day of Lydia ’s leaving home . "
pride_20,2,74,Elizabeth was now to see Mr. Wickham for the last time . ,Elizabeth was now to see Mr. Wickham for the last time . 
pride_20,2,75,"Having been frequently in company with him since her return , agitation was pretty well over ; the agitations of former partiality entirely so . ","Having been frequently in company with him since her return , agitation was pretty well over ; the agitations of former partiality entirely so . "
pride_20,2,76,"She had even learnt to detect , in the very gentleness which had first delighted her , an affectation and a sameness to disgust and weary . ","She had even learnt to detect , in the very gentleness which had first delighted her , an affectation and a sameness to disgust and weary . "
pride_20,2,77,In his present behaviour to herself ,In his present behaviour to herself 
pride_20,2,78,", moreover , she had a fresh source of displeasure ; for the inclination he soon testified of renewing those attentions which had marked the early part of their acquaintance could only serve , after what had since passed , to provoke her . ",", moreover , she had a fresh source of displeasure ; for the inclination he soon testified of renewing those attentions which had marked the early part of their acquaintance could only serve , after what had since passed , to provoke her . "
pride_20,2,79,"She lost all concern for him in finding herself thus selected as the object of such idle and frivolous gallantry ; and while she steadily repressed it , could not but feel the reproof contained in his believing , that however long , and for whatever cause , his attentions had been withdrawn , her vanity would be gratified , and her preference secured , at any time , by their renewal . On the very last day of the regiment ’s remaining in Meryton , he dined , with others of the officers , at Longbourn ; and so little was Elizabeth disposed to part from him in good - humour , that , on his making some inquiry as to the manner in which her time had passed at Hunsford , she mentioned Colonel Fitzwilliam ’s and Mr. Darcy ’s having both spent three weeks at Rosings , and asked him if he were acquainted with the former . ","She lost all concern for him in finding herself thus selected as the object of such idle and frivolous gallantry ; and while she steadily repressed it , could not but feel the reproof contained in his believing , that however long , and for whatever cause , his attentions had been withdrawn , her vanity would be gratified , and her preference secured , at any time , by their renewal . On the very last day of the regiment ’s remaining in Meryton , he dined , with others of the officers , at Longbourn ; and so little was Elizabeth disposed to part from him in good - humour , that , on his making some inquiry as to the manner in which her time had passed at Hunsford , she mentioned Colonel Fitzwilliam ’s and Mr. Darcy ’s having both spent three weeks at Rosings , and asked him if he were acquainted with the former . "
pride_20,2,80,"He looked surprised , displeased , alarmed ; but , with a moment ’s recollection , and a returning smile , replied , that he had formerly seen him often ; and , after observing that he was a very gentlemanlike man , asked her how she had liked him . ","He looked surprised , displeased , alarmed ; but , with a moment ’s recollection , and a returning smile , replied , that he had formerly seen him often ; and , after observing that he was a very gentlemanlike man , asked her how she had liked him . "
pride_20,2,81,Her answer was warmly in his favour . ,Her answer was warmly in his favour . 
pride_20,2,82,"With an air of indifference , he soon afterwards added , “ How long did you say that he was at Rosings ? ” “ Nearly three weeks . ” “ And you saw him frequently ? ” “ Yes , almost every day . ” “ His manners are very different from his cousin ’s . ” ","With an air of indifference , he soon afterwards added , “ How long did you say that he was at Rosings ? ” “ Nearly three weeks . ” “ And you saw him frequently ? ” “ Yes , almost every day . ” “ His manners are very different from his cousin ’s . ” "
pride_20,2,83,"“ Yes , very different ; but I think Mr. Darcy improves on acquaintance . ” “ Indeed ! ” cried Wickham , with a look which did not escape her . ","“ Yes , very different ; but I think Mr. Darcy improves on acquaintance . ” “ Indeed ! ” cried Wickham , with a look which did not escape her . "
pride_20,2,84,"“ And pray may I ask-- ” but checking himself , he added , in a gayer tone , “ Is it in address that he improves ? ","“ And pray may I ask-- ” but checking himself , he added , in a gayer tone , “ Is it in address that he improves ? "
pride_20,2,85,Has he deigned to add aught of civility to his ordinary style ? ,Has he deigned to add aught of civility to his ordinary style ? 
pride_20,2,86,"for I dare not hope , ” he continued , in a lower and more serious tone , “ that he is improved in essentials . ” ","for I dare not hope , ” he continued , in a lower and more serious tone , “ that he is improved in essentials . ” "
pride_20,2,87,"“ Oh , no ! ” said Elizabeth . ","“ Oh , no ! ” said Elizabeth . "
pride_20,2,88,"“ In essentials , I believe , he is very much what he ever was . ” ","“ In essentials , I believe , he is very much what he ever was . ” "
pride_20,2,89,"While she spoke , Wickham looked as if scarcely knowing whether to rejoice over her words or to distrust their meaning . ","While she spoke , Wickham looked as if scarcely knowing whether to rejoice over her words or to distrust their meaning . "
pride_20,2,90,"There was a something in her countenance which made him listen with an apprehensive and anxious attention , while she added,-- “ When I said that he improved on acquaintance , I did not mean that either his mind or manners were in a state of improvement ; but that , from knowing him better , his disposition was better understood . ","There was a something in her countenance which made him listen with an apprehensive and anxious attention , while she added,-- “ When I said that he improved on acquaintance , I did not mean that either his mind or manners were in a state of improvement ; but that , from knowing him better , his disposition was better understood . "
pride_20,2,91,"” Wickham ’s alarm now appeared in a heightened complexion and agitated look ; for a few minutes he was silent ; till , shaking off his embarrassment , he turned to her again , and said in the gentlest of accents,-- “ You , who so well know my feelings towards Mr. Darcy , will readily comprehend how sincerely I must rejoice that he is wise enough to assume even the _ appearance _ of what is right . ","” Wickham ’s alarm now appeared in a heightened complexion and agitated look ; for a few minutes he was silent ; till , shaking off his embarrassment , he turned to her again , and said in the gentlest of accents,-- “ You , who so well know my feelings towards Mr. Darcy , will readily comprehend how sincerely I must rejoice that he is wise enough to assume even the _ appearance _ of what is right . "
pride_20,2,92,"His pride , in that direction , may be of service , if not to himself , to many others , for it must deter him from such foul misconduct as I have suffered by . ","His pride , in that direction , may be of service , if not to himself , to many others , for it must deter him from such foul misconduct as I have suffered by . "
pride_20,2,93,"I only fear that the sort of cautiousness to which you , I imagine , have been alluding , is merely adopted on his visits to his aunt , of whose good opinion and judgment he stands much in awe . ","I only fear that the sort of cautiousness to which you , I imagine , have been alluding , is merely adopted on his visits to his aunt , of whose good opinion and judgment he stands much in awe . "
pride_20,2,94,"His fear of her has always operated , I know , when they were together ; and a good deal is to be imputed to his wish of forwarding the match with Miss de Bourgh , which I am certain he has very much at heart . ","His fear of her has always operated , I know , when they were together ; and a good deal is to be imputed to his wish of forwarding the match with Miss de Bourgh , which I am certain he has very much at heart . "
pride_20,2,95,"” Elizabeth could not repress a smile at this , but she answered only by a slight inclination of the head . ","” Elizabeth could not repress a smile at this , but she answered only by a slight inclination of the head . "
pride_20,2,96,"She saw that he wanted to engage her on the old subject of his grievances , and she was in no humour to indulge him . ","She saw that he wanted to engage her on the old subject of his grievances , and she was in no humour to indulge him . "
pride_20,2,97,"The rest of the evening passed with the _ appearance _ , on his side , of usual cheerfulness , but with no further attempt to distinguish Elizabeth ; and they parted at last with mutual civility , and possibly a mutual desire of never meeting again . When the party broke up , Lydia returned with Mrs. Forster to Meryton , from whence they were to set out early the next morning . ","The rest of the evening passed with the _ appearance _ , on his side , of usual cheerfulness , but with no further attempt to distinguish Elizabeth ; and they parted at last with mutual civility , and possibly a mutual desire of never meeting again . When the party broke up , Lydia returned with Mrs. Forster to Meryton , from whence they were to set out early the next morning . "
pride_20,2,98,The separation between her and her family was rather noisy than pathetic . ,The separation between her and her family was rather noisy than pathetic . 
pride_20,2,99,Kitty was the only one who shed tears ; but she did weep from vexation and envy . ,Kitty was the only one who shed tears ; but she did weep from vexation and envy . 
pride_20,2,100,"Mrs. Bennet was diffuse in her good wishes for the felicity of her daughter , and impressive in her injunctions that she would not miss the opportunity of enjoying herself as much as possible,--advice which there was every reason to believe would be attended to ; and , in the clamorous happiness of Lydia herself in bidding farewell , the more gentle adieus of her sisters were uttered without being heard . ","Mrs. Bennet was diffuse in her good wishes for the felicity of her daughter , and impressive in her injunctions that she would not miss the opportunity of enjoying herself as much as possible,--advice which there was every reason to believe would be attended to ; and , in the clamorous happiness of Lydia herself in bidding farewell , the more gentle adieus of her sisters were uttered without being heard . "
