fic_id,chapter_id,para_id,text,text_tokenized
pride_28,2,52,"I thought it my duty to give the speediest intelligence of this to my cousin , that she and her noble admirer may be aware of what they are about , and not run hastily into a marriage which has not been properly sanctioned . ’ ","I thought it my duty to give the speediest intelligence of this to my cousin , that she and her noble admirer may be aware of what they are about , and not run hastily into a marriage which has not been properly sanctioned . ’ "
pride_28,2,53,"Mr. Collins , moreover , adds , ‘ I am truly rejoiced that my cousin Lydia ’s sad business has been so well hushed up , and am only concerned that their living together before the marriage took place should be so generally known . ","Mr. Collins , moreover , adds , ‘ I am truly rejoiced that my cousin Lydia ’s sad business has been so well hushed up , and am only concerned that their living together before the marriage took place should be so generally known . "
pride_28,2,54,"I must not , however , neglect the duties of my station , or refrain from declaring my amazement , at hearing that you received the young couple into your house as soon as they were married . ","I must not , however , neglect the duties of my station , or refrain from declaring my amazement , at hearing that you received the young couple into your house as soon as they were married . "
pride_28,2,55,"It was an encouragement of vice ; and had I been the rector of Longbourn , I should very strenuously have opposed it . ","It was an encouragement of vice ; and had I been the rector of Longbourn , I should very strenuously have opposed it . "
pride_28,2,56,"You ought certainly to forgive them as a Christian , but never to admit them in your sight , or allow ","You ought certainly to forgive them as a Christian , but never to admit them in your sight , or allow "
pride_28,2,57,their names to be mentioned in your hearing . ’ ,their names to be mentioned in your hearing . ’ 
pride_28,2,58,_ That _ is his notion of Christian forgiveness ! ,_ That _ is his notion of Christian forgiveness ! 
pride_28,2,59,"The rest of his letter is only about his dear Charlotte ’s situation , and his expectation of a young olive - branch . ","The rest of his letter is only about his dear Charlotte ’s situation , and his expectation of a young olive - branch . "
pride_28,2,60,"But , Lizzy , you look as if you did not enjoy it . ","But , Lizzy , you look as if you did not enjoy it . "
pride_28,2,61,"You are not going to be _ missish _ , I hope , and pretend to be affronted at an idle report . ","You are not going to be _ missish _ , I hope , and pretend to be affronted at an idle report . "
pride_28,2,62,"For what do we live , but to make sport for our neighbours , and laugh at them in our turn ? ” ","For what do we live , but to make sport for our neighbours , and laugh at them in our turn ? ” "
pride_28,2,63,"“ Oh , ” cried Elizabeth , “ I am exceedingly diverted . ","“ Oh , ” cried Elizabeth , “ I am exceedingly diverted . "
pride_28,2,64,But it is so strange ! ” ,But it is so strange ! ” 
pride_28,2,65,"“ Yes , _ that _ is what makes it amusing . ","“ Yes , _ that _ is what makes it amusing . "
pride_28,2,66,Had they fixed on any other man it would have been nothing ; but _ his _ perfect indifference and _ your _ pointed dislike make it so delightfully absurd ! ,Had they fixed on any other man it would have been nothing ; but _ his _ perfect indifference and _ your _ pointed dislike make it so delightfully absurd ! 
pride_28,2,67,"Much as I abominate writing , I would not give up Mr. Collins ’s correspondence for any consideration . ","Much as I abominate writing , I would not give up Mr. Collins ’s correspondence for any consideration . "
pride_28,2,68,"Nay , when I read a letter of his , I can not help giving him the preference even over Wickham , much as I value the impudence and hypocrisy of my son - in - law . ","Nay , when I read a letter of his , I can not help giving him the preference even over Wickham , much as I value the impudence and hypocrisy of my son - in - law . "
pride_28,2,69,"And pray , Lizzy , what said Lady Catherine about this report ? ","And pray , Lizzy , what said Lady Catherine about this report ? "
pride_28,2,70,"Did she call to refuse her consent ? ” To this question his daughter replied only with a laugh ; and as it had been asked without the least suspicion , she was not distressed by his repeating it . ","Did she call to refuse her consent ? ” To this question his daughter replied only with a laugh ; and as it had been asked without the least suspicion , she was not distressed by his repeating it . "
pride_28,2,71,Elizabeth had never been more at a loss to make her feelings appear what they were not . ,Elizabeth had never been more at a loss to make her feelings appear what they were not . 
pride_28,2,72,It was necessary to laugh when she would rather have cried . ,It was necessary to laugh when she would rather have cried . 
pride_28,2,73,"Her father had most cruelly mortified her by what he said of Mr. Darcy ’s indifference ; and she could do nothing but wonder at such a want of penetration , or fear that , perhaps , instead of his seeing too _ little _ , she might have fancied too _ much _ . ","Her father had most cruelly mortified her by what he said of Mr. Darcy ’s indifference ; and she could do nothing but wonder at such a want of penetration , or fear that , perhaps , instead of his seeing too _ little _ , she might have fancied too _ much _ . "
