fic_id,chapter_id,para_id,text,text_tokenized
pride_26,1,99,"But he had given a reason for his interference , which asked no extraordinary stretch of belief . ","But he had given a reason for his interference , which asked no extraordinary stretch of belief . "
pride_26,1,100,"It was reasonable that he should feel he had been wrong ; he had liberality , and he had the means of exercising it ; and though she would not place herself as his principal inducement , she could perhaps believe , that remaining partiality for her might assist his endeavours in a cause where her peace of mind must be materially concerned . ","It was reasonable that he should feel he had been wrong ; he had liberality , and he had the means of exercising it ; and though she would not place herself as his principal inducement , she could perhaps believe , that remaining partiality for her might assist his endeavours in a cause where her peace of mind must be materially concerned . "
pride_26,1,101,"It was painful , exceedingly painful , to know that they were under obligations to a person who could never receive a return . ","It was painful , exceedingly painful , to know that they were under obligations to a person who could never receive a return . "
pride_26,1,102,"They owed the restoration of Lydia , her character , everything to him . ","They owed the restoration of Lydia , her character , everything to him . "
pride_26,1,103,"Oh , how heartily did she grieve over every ungracious sensation she had ever encouraged , every saucy speech she had ever directed towards him ! ","Oh , how heartily did she grieve over every ungracious sensation she had ever encouraged , every saucy speech she had ever directed towards him ! "
pride_26,1,104,"For herself she was humbled ; but she was proud of him,--proud that in a cause of compassion and honour he had been able to get the better of himself . ","For herself she was humbled ; but she was proud of him,--proud that in a cause of compassion and honour he had been able to get the better of himself . "
pride_26,1,105,She read over her aunt ’s commendation of him again and again . ,She read over her aunt ’s commendation of him again and again . 
pride_26,1,106,It was hardly enough ; but it pleased her . ,It was hardly enough ; but it pleased her . 
pride_26,1,107,"She was even sensible of some pleasure , though mixed with regret , on finding how steadfastly both she and her uncle had been persuaded that affection and confidence subsisted between Mr. Darcy and herself . ","She was even sensible of some pleasure , though mixed with regret , on finding how steadfastly both she and her uncle had been persuaded that affection and confidence subsisted between Mr. Darcy and herself . "
pride_26,1,108,"She was roused from her seat and her reflections , by someone ’s approach ; and , before she could strike into another path , she was overtaken by Wickham . ","She was roused from her seat and her reflections , by someone ’s approach ; and , before she could strike into another path , she was overtaken by Wickham . "
pride_26,1,109,"“ I am afraid I interrupt your solitary ramble , my dear sister ? ” said he , as he joined her . “ You certainly do , ” she replied with a smile ; “ but it does not follow that the interruption must be unwelcome . ” ","“ I am afraid I interrupt your solitary ramble , my dear sister ? ” said he , as he joined her . “ You certainly do , ” she replied with a smile ; “ but it does not follow that the interruption must be unwelcome . ” "
pride_26,1,110,"“ I should be sorry , indeed , if it were . ","“ I should be sorry , indeed , if it were . "
pride_26,1,111,"_ We _ were always good friends , and now we are better . ” ","_ We _ were always good friends , and now we are better . ” "
pride_26,1,112,“ True . ,“ True . 
pride_26,1,113,Are the others coming out ? ” “ I do not know . ,Are the others coming out ? ” “ I do not know . 
pride_26,1,114,Mrs. Bennet and Lydia are going in the carriage to Meryton . ,Mrs. Bennet and Lydia are going in the carriage to Meryton . 
pride_26,1,115,"And so , my dear sister , I find , from our uncle and aunt , that you have actually seen Pemberley . ” ","And so , my dear sister , I find , from our uncle and aunt , that you have actually seen Pemberley . ” "
pride_26,1,116,She replied in the affirmative . ,She replied in the affirmative . 
pride_26,1,117,"“ I almost envy you the pleasure , and yet I believe it would be too much for me , or else I could take it in my way to Newcastle . ","“ I almost envy you the pleasure , and yet I believe it would be too much for me , or else I could take it in my way to Newcastle . "
pride_26,1,118,"And you saw the old housekeeper , I suppose ? ","And you saw the old housekeeper , I suppose ? "
pride_26,1,119,"Poor Reynolds , she was always very fond of me . ","Poor Reynolds , she was always very fond of me . "
pride_26,1,120,But of course she did not mention my name to you . ” ,But of course she did not mention my name to you . ” 
pride_26,1,121,"“ Yes , she did . ” ","“ Yes , she did . ” "
pride_26,1,122,"“ And what did she say ? ” “ That you were gone into the army , and she was afraid had -- not turned out well . ","“ And what did she say ? ” “ That you were gone into the army , and she was afraid had -- not turned out well . "
pride_26,1,123,"At such a distance as _ that _ , you know , things are strangely misrepresented . ” ","At such a distance as _ that _ , you know , things are strangely misrepresented . ” "
pride_26,1,124,"“ Certainly , ” he replied , biting his lips . ","“ Certainly , ” he replied , biting his lips . "
pride_26,1,125,"Elizabeth hoped she had silenced him ; but he soon afterwards said,-- “ I was surprised to see Darcy in town last month . ","Elizabeth hoped she had silenced him ; but he soon afterwards said,-- “ I was surprised to see Darcy in town last month . "
pride_26,1,126,We passed each other several times . ,We passed each other several times . 
pride_26,1,127,"I wonder what he can be doing there . ” “ Perhaps preparing for his marriage with Miss de Bourgh , ” said Elizabeth . ","I wonder what he can be doing there . ” “ Perhaps preparing for his marriage with Miss de Bourgh , ” said Elizabeth . "
pride_26,1,128,“ It must be something particular to take him there at this time of year . ” ,“ It must be something particular to take him there at this time of year . ” 
pride_26,1,129,“ Undoubtedly . ,“ Undoubtedly . 
pride_26,1,130,Did you see him while you were at Lambton ? ,Did you see him while you were at Lambton ? 
pride_26,1,131,I thought I understood from the Gardiners that you had . ” ,I thought I understood from the Gardiners that you had . ” 
pride_26,1,132,“ Yes ; he introduced us to his sister . ” “ And do you like her ? ” “ Very much . ” ,“ Yes ; he introduced us to his sister . ” “ And do you like her ? ” “ Very much . ” 
pride_26,1,133,"“ I have heard , indeed , that she is uncommonly improved within this year or two . ","“ I have heard , indeed , that she is uncommonly improved within this year or two . "
pride_26,1,134,"When I last saw her , she was not very promising . ","When I last saw her , she was not very promising . "
pride_26,1,135,I am very glad you liked her . ,I am very glad you liked her . 
pride_26,1,136,I hope she will turn out well . ” ,I hope she will turn out well . ” 
pride_26,1,137,“ I dare say she will ; she has got over the most trying age . ” “ Did you go by the village of Kympton ? ,“ I dare say she will ; she has got over the most trying age . ” “ Did you go by the village of Kympton ? 
pride_26,1,138,” ,” 
pride_26,1,139,“ I do not recollect that we did . ” “ I mention it because it is the living which I ought to have had . ,“ I do not recollect that we did . ” “ I mention it because it is the living which I ought to have had . 
pride_26,1,140,A most delightful place ! ,A most delightful place ! 
pride_26,1,141,Excellent parsonage - house ! ,Excellent parsonage - house ! 
pride_26,1,142,It would have suited me in every respect . ” ,It would have suited me in every respect . ” 
pride_26,1,143,“ How should you have liked making sermons ? ” “ Exceedingly well . ,“ How should you have liked making sermons ? ” “ Exceedingly well . 
pride_26,1,144,"I should have considered it as part of my duty , and the exertion would soon have been nothing . ","I should have considered it as part of my duty , and the exertion would soon have been nothing . "
pride_26,1,145,"One ought not to repine ; but , to be sure , it would have been such a thing for me ! ","One ought not to repine ; but , to be sure , it would have been such a thing for me ! "
pride_26,1,146,"The quiet , the retirement of such a life , would have answered all my ideas of happiness ! ","The quiet , the retirement of such a life , would have answered all my ideas of happiness ! "
pride_26,1,147,But it was not to be . ,But it was not to be . 
pride_26,1,148,Did you ever hear Darcy mention the circumstance when you were in Kent ? ” ,Did you ever hear Darcy mention the circumstance when you were in Kent ? ” 
pride_26,1,149,"“ I _ have _ heard from authority , which I thought _ as good _ , that it was left you conditionally only , and at the will of the present patron . ” “ You have ! ","“ I _ have _ heard from authority , which I thought _ as good _ , that it was left you conditionally only , and at the will of the present patron . ” “ You have ! "
pride_26,1,150,"Yes , there was something in _ that _ ; I told you so from the first , you may remember . ” ","Yes , there was something in _ that _ ; I told you so from the first , you may remember . ” "
pride_26,1,151,"“ I _ did _ hear , too , that there was a time when sermon - making was not so palatable to you as it seems to be at present ; that you actually declared your resolution of never taking orders , and that the business had been compromised accordingly . ” “ You did ! ","“ I _ did _ hear , too , that there was a time when sermon - making was not so palatable to you as it seems to be at present ; that you actually declared your resolution of never taking orders , and that the business had been compromised accordingly . ” “ You did ! "
pride_26,1,152,and it was not wholly without foundation . ,and it was not wholly without foundation . 
pride_26,1,153,"You may remember what I told you on that point , when first we talked of it . ” ","You may remember what I told you on that point , when first we talked of it . ” "
pride_26,1,154,"They were now almost at the door of the house , for she had walked fast to get rid of him ; and unwilling , for her sister ’s sake , to provoke him , she only said in reply , with a good - humoured smile,-- “ Come , Mr. Wickham , we are brother and sister , you know . ","They were now almost at the door of the house , for she had walked fast to get rid of him ; and unwilling , for her sister ’s sake , to provoke him , she only said in reply , with a good - humoured smile,-- “ Come , Mr. Wickham , we are brother and sister , you know . "
pride_26,1,155,Do not let us quarrel about the past . ,Do not let us quarrel about the past . 
pride_26,1,156,"In future , I hope we shall be always of one mind . ” ","In future , I hope we shall be always of one mind . ” "
pride_26,1,157,"She held out her hand : he kissed it with affectionate gallantry , though he hardly knew how to look , and they entered the house . ","She held out her hand : he kissed it with affectionate gallantry , though he hardly knew how to look , and they entered the house . "
pride_26,2,1, LIII . , LIII . 
pride_26,2,2,"Mr. Wickham was so perfectly satisfied with this conversation , that he never again distressed himself , or provoked his dear sister Elizabeth , by introducing the subject of it ; and she was pleased to find that she had said enough to keep him quiet . ","Mr. Wickham was so perfectly satisfied with this conversation , that he never again distressed himself , or provoked his dear sister Elizabeth , by introducing the subject of it ; and she was pleased to find that she had said enough to keep him quiet . "
pride_26,2,3,"The day of his and Lydia ’s departure soon came ; and Mrs. Bennet was forced to submit to a separation , which , as her husband by no means entered into her scheme of their all going to Newcastle , was likely to continue at least a twelvemonth . ","The day of his and Lydia ’s departure soon came ; and Mrs. Bennet was forced to submit to a separation , which , as her husband by no means entered into her scheme of their all going to Newcastle , was likely to continue at least a twelvemonth . "
pride_26,2,4,"“ Oh , my dear Lydia , ” she cried , “ when shall we meet again ? ” ","“ Oh , my dear Lydia , ” she cried , “ when shall we meet again ? ” "
pride_26,2,5,"“ Oh , Lord ! ","“ Oh , Lord ! "
pride_26,2,6,I do n’t know . ,I do n’t know . 
pride_26,2,7,"Not these two or three years , perhaps . ” ","Not these two or three years , perhaps . ” "
pride_26,2,8,"“ Write to me very often , my dear . ” “ As often as I can . ","“ Write to me very often , my dear . ” “ As often as I can . "
pride_26,2,9,But you know married women have never much time for writing . ,But you know married women have never much time for writing . 
pride_26,2,10,My sisters may write to _ me _ . ,My sisters may write to _ me _ . 
pride_26,2,11,They will have nothing else to do . ,They will have nothing else to do . 
pride_26,2,12,” ,” 
pride_26,2,13,Mr. Wickham ’s adieus were much more affectionate than his wife ’s . ,Mr. Wickham ’s adieus were much more affectionate than his wife ’s . 
pride_26,2,14,"He smiled , looked handsome , and said many pretty things . ","He smiled , looked handsome , and said many pretty things . "
pride_26,2,15,"“ He is as fine a fellow , ” said Mr. Bennet , as soon as they were out of the house , “ as ever I saw . ","“ He is as fine a fellow , ” said Mr. Bennet , as soon as they were out of the house , “ as ever I saw . "
pride_26,2,16,"He simpers , and smirks , and makes love to us all . ","He simpers , and smirks , and makes love to us all . "
pride_26,2,17,I am prodigiously proud of him . ,I am prodigiously proud of him . 
pride_26,2,18,I defy even Sir William Lucas himself to produce a more valuable son - in - law . ,I defy even Sir William Lucas himself to produce a more valuable son - in - law . 
pride_26,2,19,” ,” 
pride_26,2,20,"The loss of her daughter made Mrs. Bennet very dull for several days . “ I often think , ” said she , “ that there is nothing so bad as parting with one ’s friends . ","The loss of her daughter made Mrs. Bennet very dull for several days . “ I often think , ” said she , “ that there is nothing so bad as parting with one ’s friends . "
pride_26,2,21,One seems so forlorn without them . ” ,One seems so forlorn without them . ” 
pride_26,2,22,"“ This is the consequence , you see , madam , of marrying a daughter , ” said Elizabeth . ","“ This is the consequence , you see , madam , of marrying a daughter , ” said Elizabeth . "
pride_26,2,23,“ It must make you better satisfied that your other four are single . ” ,“ It must make you better satisfied that your other four are single . ” 
pride_26,2,24,“ It is no such thing . ,“ It is no such thing . 
pride_26,2,25,Lydia does not leave me because she is married ; but only because her husband ’s regiment happens to be so far off . ,Lydia does not leave me because she is married ; but only because her husband ’s regiment happens to be so far off . 
pride_26,2,26,"If that had been nearer , she would not have gone so soon . ","If that had been nearer , she would not have gone so soon . "
pride_26,2,27,” ,” 
pride_26,2,28,"But the spiritless condition which this event threw her into was shortly relieved , and her mind opened again to the agitation of hope , by an article of news which then began to be in circulation . ","But the spiritless condition which this event threw her into was shortly relieved , and her mind opened again to the agitation of hope , by an article of news which then began to be in circulation . "
pride_26,2,29,"The housekeeper at Netherfield had received orders to prepare for the arrival of her master , who was coming down in a day or two , to shoot there for several weeks . ","The housekeeper at Netherfield had received orders to prepare for the arrival of her master , who was coming down in a day or two , to shoot there for several weeks . "
pride_26,2,30,Mrs. Bennet was quite in the fidgets . ,Mrs. Bennet was quite in the fidgets . 
pride_26,2,31,"She looked at Jane , and smiled , and shook her head , by turns . ","She looked at Jane , and smiled , and shook her head , by turns . "
pride_26,2,32,"“ Well , well , and so Mr. Bingley is coming down , sister , ” ( for Mrs. Philips first brought her the news ) . ","“ Well , well , and so Mr. Bingley is coming down , sister , ” ( for Mrs. Philips first brought her the news ) . "
pride_26,2,33,“ ,“ 
pride_26,2,34,"Well , so much the better . ","Well , so much the better . "
pride_26,2,35,"Not that I care about it , though . ","Not that I care about it , though . "
pride_26,2,36,"He is nothing to us , you know , and I am sure I never want to see him again . ","He is nothing to us , you know , and I am sure I never want to see him again . "
pride_26,2,37,"But , however , he is very welcome to come to Netherfield , if he likes it . ","But , however , he is very welcome to come to Netherfield , if he likes it . "
pride_26,2,38,And who knows what _ may _ happen ? ,And who knows what _ may _ happen ? 
pride_26,2,39,But that is nothing to us . ,But that is nothing to us . 
pride_26,2,40,"You know , sister , we agreed long ago never to mention a word about it . ","You know , sister , we agreed long ago never to mention a word about it . "
pride_26,2,41,"And so , it is quite certain he is coming ? ” ","And so , it is quite certain he is coming ? ” "
pride_26,2,42,"“ You may depend on it , ” replied the other , “ for Mrs. Nichols was in Meryton last night : I saw her passing by , and went out myself on purpose to know the truth of it ; and she told me that it was certainly true . ","“ You may depend on it , ” replied the other , “ for Mrs. Nichols was in Meryton last night : I saw her passing by , and went out myself on purpose to know the truth of it ; and she told me that it was certainly true . "
pride_26,2,43,"He comes down on Thursday , at the latest , very likely on Wednesday . ","He comes down on Thursday , at the latest , very likely on Wednesday . "
pride_26,2,44,"She was going to the butcher ’s , she told me , on purpose to order in some meat on Wednesday , and she has got three couple of ducks just fit to be killed . ” ","She was going to the butcher ’s , she told me , on purpose to order in some meat on Wednesday , and she has got three couple of ducks just fit to be killed . ” "
pride_26,2,45,Miss Bennet had not been able to hear of his coming without changing colour . ,Miss Bennet had not been able to hear of his coming without changing colour . 
pride_26,2,46,"It was many months since she had mentioned his name to Elizabeth ; but now , as soon as they were alone together , she said,-- “ I saw you look at me to - day , Lizzy , when my aunt told us of the present report ; and I know I appeared distressed ; but do n’t imagine it was from any silly cause . ","It was many months since she had mentioned his name to Elizabeth ; but now , as soon as they were alone together , she said,-- “ I saw you look at me to - day , Lizzy , when my aunt told us of the present report ; and I know I appeared distressed ; but do n’t imagine it was from any silly cause . "
pride_26,2,47,"I was only confused for the moment , because I felt that I _ should _ be looked at . ","I was only confused for the moment , because I felt that I _ should _ be looked at . "
pride_26,2,48,I do assure you that the news does not affect me either with pleasure or pain . ,I do assure you that the news does not affect me either with pleasure or pain . 
pride_26,2,49,"I am glad of one thing , that he comes alone ; because we shall see the less of him . ","I am glad of one thing , that he comes alone ; because we shall see the less of him . "
pride_26,2,50,"Not that I am afraid of _ myself _ , but I dread other people ’s remarks . ” Elizabeth did not know what to make of it . ","Not that I am afraid of _ myself _ , but I dread other people ’s remarks . ” Elizabeth did not know what to make of it . "
pride_26,2,51,"Had she not seen him in Derbyshire , she might have supposed him capable of coming there with no other view than what was acknowledged ; but she still thought him partial to Jane , and she wavered as to the greater probability of his coming there _ with _ his friend ’s permission , or being bold enough to come without it . ","Had she not seen him in Derbyshire , she might have supposed him capable of coming there with no other view than what was acknowledged ; but she still thought him partial to Jane , and she wavered as to the greater probability of his coming there _ with _ his friend ’s permission , or being bold enough to come without it . "
pride_26,2,52,"“ Yet it is hard , ” she sometimes thought , “ that this poor man can not come to a house , which he has legally hired , without raising all this speculation ! ","“ Yet it is hard , ” she sometimes thought , “ that this poor man can not come to a house , which he has legally hired , without raising all this speculation ! "
pride_26,2,53,I _ will _ leave him to himself . ” ,I _ will _ leave him to himself . ” 
pride_26,2,54,"In spite of what her sister declared , and really believed to be her feelings , in the expectation of his arrival , Elizabeth could easily perceive that her spirits were affected by it . ","In spite of what her sister declared , and really believed to be her feelings , in the expectation of his arrival , Elizabeth could easily perceive that her spirits were affected by it . "
pride_26,2,55,"They were more disturbed , more unequal , than she had often seen them . ","They were more disturbed , more unequal , than she had often seen them . "
pride_26,2,56,"The subject which had been so warmly canvassed between their parents , about a twelvemonth ago , was now brought forward again . ","The subject which had been so warmly canvassed between their parents , about a twelvemonth ago , was now brought forward again . "
pride_26,2,57,"“ As soon as ever Mr. Bingley comes , my dear , ” said Mrs. Bennet , “ you will wait on him , of course . ” ","“ As soon as ever Mr. Bingley comes , my dear , ” said Mrs. Bennet , “ you will wait on him , of course . ” "
pride_26,2,58,"“ No , no . ","“ No , no . "
pride_26,2,59,"You forced me into visiting him last year , and promised , if I went to see him , he should marry one of my daughters . ","You forced me into visiting him last year , and promised , if I went to see him , he should marry one of my daughters . "
pride_26,2,60,"But it ended in nothing , and I will not be sent on a fool ’s errand again . ” ","But it ended in nothing , and I will not be sent on a fool ’s errand again . ” "
pride_26,2,61,"His wife represented to him how absolutely necessary such an attention would be from all the neighbouring gentlemen , on his returning to Netherfield . “ ’ Tis an _ etiquette _ I despise , ” said he . ","His wife represented to him how absolutely necessary such an attention would be from all the neighbouring gentlemen , on his returning to Netherfield . “ ’ Tis an _ etiquette _ I despise , ” said he . "
pride_26,2,62,"“ If he wants our society , let him seek it . ","“ If he wants our society , let him seek it . "
pride_26,2,63,He knows where we live . ,He knows where we live . 
pride_26,2,64,I will not spend _ my _ hours in running after my neighbours every time they go away and come back again . ” ,I will not spend _ my _ hours in running after my neighbours every time they go away and come back again . ” 
pride_26,2,65,"“ Well , all I know is , that it will be abominably rude if you do not wait on him . ","“ Well , all I know is , that it will be abominably rude if you do not wait on him . "
pride_26,2,66,"But , however , that sha n’t prevent my asking him to dine here , I am determined . ","But , however , that sha n’t prevent my asking him to dine here , I am determined . "
pride_26,2,67,We must have Mrs. Long and the Gouldings soon . ,We must have Mrs. Long and the Gouldings soon . 
pride_26,2,68,That will ,That will 
pride_26,2,69,"make thirteen with ourselves , so there will be just room at table for him . ","make thirteen with ourselves , so there will be just room at table for him . "
pride_26,2,70,” ,” 
pride_26,2,71,"Consoled by this resolution , she was the better able to bear her husband ’s incivility ; though it was very mortifying to know that her neighbours might all see Mr. Bingley , in consequence of it , before _ they _ did . ","Consoled by this resolution , she was the better able to bear her husband ’s incivility ; though it was very mortifying to know that her neighbours might all see Mr. Bingley , in consequence of it , before _ they _ did . "
