fic_id,chapter_id,para_id,text,text_tokenized
pride_3,1,1, VI . , VI . 
pride_3,1,2,The ladies of Longbourn soon waited on those of Netherfield . ,The ladies of Longbourn soon waited on those of Netherfield . 
pride_3,1,3,The visit was returned in due form . ,The visit was returned in due form . 
pride_3,1,4,"Miss Bennet ’s pleasing manners grew on the good - will of Mrs. Hurst and Miss Bingley ; and though the mother was found to be intolerable , and the younger sisters not worth speaking to ","Miss Bennet ’s pleasing manners grew on the good - will of Mrs. Hurst and Miss Bingley ; and though the mother was found to be intolerable , and the younger sisters not worth speaking to "
pride_3,1,5,", a wish of being better acquainted with _ them _ was expressed towards the two eldest . ",", a wish of being better acquainted with _ them _ was expressed towards the two eldest . "
pride_3,1,6,"By Jane this attention was received with the greatest pleasure ; but Elizabeth still saw superciliousness in their treatment of everybody , hardly excepting even her sister , and could not like them ; though their kindness to Jane , such as it was , had a value , as arising , in all probability , from the influence of their brother ’s admiration . ","By Jane this attention was received with the greatest pleasure ; but Elizabeth still saw superciliousness in their treatment of everybody , hardly excepting even her sister , and could not like them ; though their kindness to Jane , such as it was , had a value , as arising , in all probability , from the influence of their brother ’s admiration . "
pride_3,1,7,"It was generally evident , whenever they met , that he _ did _ admire her ; and to _ her _ it was equally evident that Jane was yielding to the preference which she had begun to entertain for him from the first , and was in a way to be very much in love ; but she considered with pleasure that it was not likely to be discovered by the world in general , since Jane united with great strength of feeling , a composure of temper and an uniform cheerfulness of manner , which would guard her from the suspicions of the impertinent . ","It was generally evident , whenever they met , that he _ did _ admire her ; and to _ her _ it was equally evident that Jane was yielding to the preference which she had begun to entertain for him from the first , and was in a way to be very much in love ; but she considered with pleasure that it was not likely to be discovered by the world in general , since Jane united with great strength of feeling , a composure of temper and an uniform cheerfulness of manner , which would guard her from the suspicions of the impertinent . "
pride_3,1,8,"She mentioned this to her friend , Miss Lucas . ","She mentioned this to her friend , Miss Lucas . "
pride_3,1,9,"“ It may , perhaps , be pleasant , ” replied Charlotte , “ to be able to impose on the public in such a case ; but it is sometimes a disadvantage to be so very guarded . ","“ It may , perhaps , be pleasant , ” replied Charlotte , “ to be able to impose on the public in such a case ; but it is sometimes a disadvantage to be so very guarded . "
pride_3,1,10,"If a woman conceals her affection with the same skill from the object of it , she may lose the opportunity of fixing him ; and it will then be but poor consolation to believe the world equally in the dark . ","If a woman conceals her affection with the same skill from the object of it , she may lose the opportunity of fixing him ; and it will then be but poor consolation to believe the world equally in the dark . "
pride_3,1,11,"There is so much of gratitude or vanity in almost every attachment , that it is not safe to leave any to itself . ","There is so much of gratitude or vanity in almost every attachment , that it is not safe to leave any to itself . "
pride_3,1,12,We can all _ begin _ freely -- a slight preference is natural enough ; but there are very few of us who have heart enough to be really in love without encouragement . ,We can all _ begin _ freely -- a slight preference is natural enough ; but there are very few of us who have heart enough to be really in love without encouragement . 
pride_3,1,13,"In nine cases out of ten , a woman had better show _ more _ affection than she feels . ","In nine cases out of ten , a woman had better show _ more _ affection than she feels . "
pride_3,1,14,"Bingley likes your sister undoubtedly ; but he may never do more than like her , if she does not help him on . ","Bingley likes your sister undoubtedly ; but he may never do more than like her , if she does not help him on . "
pride_3,1,15,"” “ But she does help him on , as much as her nature will allow . ","” “ But she does help him on , as much as her nature will allow . "
pride_3,1,16,"If _ I _ can perceive her regard for him , he must be a simpleton indeed not to discover it too . ” ","If _ I _ can perceive her regard for him , he must be a simpleton indeed not to discover it too . ” "
pride_3,1,17,"“ Remember , Eliza , that he does not know Jane ’s disposition as you do . ” “ But if a woman is partial to a man , and does not endeavor to conceal it , he must find it out . ” ","“ Remember , Eliza , that he does not know Jane ’s disposition as you do . ” “ But if a woman is partial to a man , and does not endeavor to conceal it , he must find it out . ” "
pride_3,1,18,"“ Perhaps he must , if he sees enough of her . ","“ Perhaps he must , if he sees enough of her . "
pride_3,1,19,"But though Bingley and Jane meet tolerably often , it is never for many hours together ; and as they always see each other in large mixed parties , it is impossible that every moment should be employed in conversing together . ","But though Bingley and Jane meet tolerably often , it is never for many hours together ; and as they always see each other in large mixed parties , it is impossible that every moment should be employed in conversing together . "
pride_3,1,20,Jane should therefore make the most of every half hour in which she can command his attention . ,Jane should therefore make the most of every half hour in which she can command his attention . 
pride_3,1,21,"When she is secure of him , there will be leisure for falling in love as much as she chooses . ” “ Your plan is a good one , ” replied Elizabeth , “ where nothing is in question but the desire of being well married ; and if I were determined to get a rich husband , or any husband , I dare say I should adopt it . ","When she is secure of him , there will be leisure for falling in love as much as she chooses . ” “ Your plan is a good one , ” replied Elizabeth , “ where nothing is in question but the desire of being well married ; and if I were determined to get a rich husband , or any husband , I dare say I should adopt it . "
pride_3,1,22,But these are not Jane ’s feelings ; she is not acting by design . ,But these are not Jane ’s feelings ; she is not acting by design . 
pride_3,1,23,"As yet she can not even be certain of the degree of her own regard , nor of its reasonableness . ","As yet she can not even be certain of the degree of her own regard , nor of its reasonableness . "
pride_3,1,24,She has known him only a fortnight . ,She has known him only a fortnight . 
pride_3,1,25,"She danced four dances with him at Meryton ; she saw him one morning at his own house , and has since dined in company with him four times . ","She danced four dances with him at Meryton ; she saw him one morning at his own house , and has since dined in company with him four times . "
pride_3,1,26,This is not quite enough to make her understand his character . ” ,This is not quite enough to make her understand his character . ” 
pride_3,1,27,“ Not as you represent it . ,“ Not as you represent it . 
pride_3,1,28,"Had she merely _ dined _ with him , she might only have discovered whether he had a good appetite ; but you must remember that four evenings have been also spent together -- and ","Had she merely _ dined _ with him , she might only have discovered whether he had a good appetite ; but you must remember that four evenings have been also spent together -- and "
pride_3,1,29,four evenings may do a great deal . ” ,four evenings may do a great deal . ” 
pride_3,1,30,"“ Yes : these four evenings have enabled them to ascertain that they both like Vingt - un better than Commerce , but with respect to any other leading characteristic , I do not imagine that much has been unfolded . ” “ Well , ” said Charlotte , “ I wish Jane success with all my heart ; and if she were married to him to - morrow , I should think she had as good a chance of happiness as if she were to be studying his character for a twelvemonth . ","“ Yes : these four evenings have enabled them to ascertain that they both like Vingt - un better than Commerce , but with respect to any other leading characteristic , I do not imagine that much has been unfolded . ” “ Well , ” said Charlotte , “ I wish Jane success with all my heart ; and if she were married to him to - morrow , I should think she had as good a chance of happiness as if she were to be studying his character for a twelvemonth . "
pride_3,1,31,Happiness in marriage is entirely a matter of chance . ,Happiness in marriage is entirely a matter of chance . 
pride_3,1,32,"If the dispositions of the parties are ever so well known to each other , or ever so similar beforehand , it does not advance their felicity in the least . ","If the dispositions of the parties are ever so well known to each other , or ever so similar beforehand , it does not advance their felicity in the least . "
pride_3,1,33,They always continue to grow sufficiently unlike afterwards to have their share of vexation ; and it is better to know as little as possible of the defects of the person with whom you are to pass your life . ,They always continue to grow sufficiently unlike afterwards to have their share of vexation ; and it is better to know as little as possible of the defects of the person with whom you are to pass your life . 
pride_3,1,34,” ,” 
pride_3,1,35,"“ You make me laugh , Charlotte ; but it is not sound . ","“ You make me laugh , Charlotte ; but it is not sound . "
pride_3,1,36,"You know it is not sound , and that you would never act in this way yourself . ” Occupied in observing Mr. Bingley ’s attention to her sister , Elizabeth was far from suspecting that she was herself becoming an object of some interest in the eyes of his friend . Mr. Darcy had at first scarcely allowed her to be pretty : he had looked at her without admiration at the ball ; and when they next met , he looked at her only to criticise . ","You know it is not sound , and that you would never act in this way yourself . ” Occupied in observing Mr. Bingley ’s attention to her sister , Elizabeth was far from suspecting that she was herself becoming an object of some interest in the eyes of his friend . Mr. Darcy had at first scarcely allowed her to be pretty : he had looked at her without admiration at the ball ; and when they next met , he looked at her only to criticise . "
pride_3,1,37,"But no sooner had he made it clear to himself and his friends that she had hardly a good feature in her face , than he began to find it was rendered uncommonly intelligent by the beautiful expression of her dark eyes . ","But no sooner had he made it clear to himself and his friends that she had hardly a good feature in her face , than he began to find it was rendered uncommonly intelligent by the beautiful expression of her dark eyes . "
pride_3,1,38,To this discovery succeeded some others equally mortifying . ,To this discovery succeeded some others equally mortifying . 
pride_3,1,39,"Though he had detected with a critical eye more than one failure of perfect symmetry in her form , he was forced to acknowledge her figure to be light and pleasing ; and in spite of his asserting that her manners were not those of the fashionable world , he was caught by their easy playfulness . ","Though he had detected with a critical eye more than one failure of perfect symmetry in her form , he was forced to acknowledge her figure to be light and pleasing ; and in spite of his asserting that her manners were not those of the fashionable world , he was caught by their easy playfulness . "
pride_3,1,40,"Of this she was perfectly unaware : to her he was only the man who made himself agreeable nowhere , and who had not thought her handsome enough to dance with . ","Of this she was perfectly unaware : to her he was only the man who made himself agreeable nowhere , and who had not thought her handsome enough to dance with . "
pride_3,1,41,"He began to wish to know more of her ; and , as a step towards conversing with her himself , attended to her conversation with others . ","He began to wish to know more of her ; and , as a step towards conversing with her himself , attended to her conversation with others . "
pride_3,1,42,His doing so drew her notice . ,His doing so drew her notice . 
pride_3,1,43,"It was at Sir William Lucas ’s , where a large party were assembled . ","It was at Sir William Lucas ’s , where a large party were assembled . "
pride_3,1,44,"“ What does Mr. Darcy mean , ” said she to Charlotte , “ by listening to my conversation with Colonel Forster ? ” “ That is a question which Mr. Darcy only can answer . ” ","“ What does Mr. Darcy mean , ” said she to Charlotte , “ by listening to my conversation with Colonel Forster ? ” “ That is a question which Mr. Darcy only can answer . ” "
pride_3,1,45,"“ But if he does it any more , I shall certainly let him know that I see what he is about . ","“ But if he does it any more , I shall certainly let him know that I see what he is about . "
pride_3,1,46,"He has a very satirical eye , and if I do not begin by being impertinent myself , I shall soon grow afraid of him . ” [ Illustration : “ The entreaties of several ” ","He has a very satirical eye , and if I do not begin by being impertinent myself , I shall soon grow afraid of him . ” [ Illustration : “ The entreaties of several ” "
pride_3,1,47,[ _ Copyright 1894 by George Allen . ,[ _ Copyright 1894 by George Allen . 
pride_3,1,48,"_ ] ] On his approaching them soon afterwards , though without seeming to have any intention of speaking , Miss Lucas defied her friend to mention such a subject to him , which immediately provoking Elizabeth to do it , she turned to him and said,-- “ Did not you think , Mr. Darcy , that I expressed myself uncommonly well just now , when I was teasing Colonel Forster to give us a ball at Meryton ? ” “ With great energy ; but it is a subject which always makes a lady energetic . ” “ You are severe on us . ” “ It will be _ her _ turn soon to be teased , ” said Miss Lucas . ","_ ] ] On his approaching them soon afterwards , though without seeming to have any intention of speaking , Miss Lucas defied her friend to mention such a subject to him , which immediately provoking Elizabeth to do it , she turned to him and said,-- “ Did not you think , Mr. Darcy , that I expressed myself uncommonly well just now , when I was teasing Colonel Forster to give us a ball at Meryton ? ” “ With great energy ; but it is a subject which always makes a lady energetic . ” “ You are severe on us . ” “ It will be _ her _ turn soon to be teased , ” said Miss Lucas . "
pride_3,1,49,"“ I am going to open the instrument , Eliza , and you know what follows . ","“ I am going to open the instrument , Eliza , and you know what follows . "
pride_3,1,50,” ,” 
pride_3,1,51,“ You are a very strange creature by way of a friend!--always wanting me to play and sing before anybody and everybody ! ,“ You are a very strange creature by way of a friend!--always wanting me to play and sing before anybody and everybody ! 
pride_3,1,52,"If my vanity had taken a musical turn , you would have been invaluable ; but as it is , I would really rather not sit down before those who must be in the habit of hearing the very best performers . ” ","If my vanity had taken a musical turn , you would have been invaluable ; but as it is , I would really rather not sit down before those who must be in the habit of hearing the very best performers . ” "
pride_3,1,53,"On Miss Lucas ’s persevering , however , she added , “ Very well ; if it must be so , it must . ” ","On Miss Lucas ’s persevering , however , she added , “ Very well ; if it must be so , it must . ” "
pride_3,1,54,"And gravely glancing at Mr. Darcy , “ There is a very fine old saying , which everybody here is of course familiar with--‘Keep your breath to cool your porridge,’--and I shall keep mine to swell my song . ” ","And gravely glancing at Mr. Darcy , “ There is a very fine old saying , which everybody here is of course familiar with--‘Keep your breath to cool your porridge,’--and I shall keep mine to swell my song . ” "
pride_3,1,55,"Her performance was pleasing , though by no means capital . ","Her performance was pleasing , though by no means capital . "
pride_3,1,56,"After a song or two , and before she could reply to the entreaties of several that she would sing again , she was eagerly succeeded at the instrument by her sister Mary , who having , in consequence of being the only plain one in the family , worked hard for knowledge and accomplishments , was always impatient for display . Mary had neither genius nor taste ; and though vanity had given her application , it had given her likewise a pedantic air and conceited manner , which would have injured a higher degree of excellence than she had reached . ","After a song or two , and before she could reply to the entreaties of several that she would sing again , she was eagerly succeeded at the instrument by her sister Mary , who having , in consequence of being the only plain one in the family , worked hard for knowledge and accomplishments , was always impatient for display . Mary had neither genius nor taste ; and though vanity had given her application , it had given her likewise a pedantic air and conceited manner , which would have injured a higher degree of excellence than she had reached . "
pride_3,1,57,"Elizabeth , easy and unaffected , had been listened to with much more pleasure , though not playing half so well ; and Mary , at the end of a long concerto , was glad to purchase praise and gratitude by Scotch and Irish airs , at the request of her younger sisters , who with some of the Lucases , and two or three officers , joined eagerly in dancing at one end of the room . Mr. Darcy stood near them in silent indignation at such a mode of passing the evening , to the exclusion of all conversation , and was too much engrossed by his own thoughts to perceive that Sir William Lucas was his neighbour , till Sir William thus began:-- “ What a charming amusement for young people this is , Mr. Darcy ! ","Elizabeth , easy and unaffected , had been listened to with much more pleasure , though not playing half so well ; and Mary , at the end of a long concerto , was glad to purchase praise and gratitude by Scotch and Irish airs , at the request of her younger sisters , who with some of the Lucases , and two or three officers , joined eagerly in dancing at one end of the room . Mr. Darcy stood near them in silent indignation at such a mode of passing the evening , to the exclusion of all conversation , and was too much engrossed by his own thoughts to perceive that Sir William Lucas was his neighbour , till Sir William thus began:-- “ What a charming amusement for young people this is , Mr. Darcy ! "
pride_3,1,58,"There is nothing like dancing , after all . ","There is nothing like dancing , after all . "
pride_3,1,59,I consider it as one of the first refinements of polished societies . ” ,I consider it as one of the first refinements of polished societies . ” 
pride_3,1,60,"“ Certainly , sir ; and it has the advantage also of being in vogue amongst the less polished societies of the world : every savage can dance . ” ","“ Certainly , sir ; and it has the advantage also of being in vogue amongst the less polished societies of the world : every savage can dance . ” "
pride_3,1,61,Sir William only smiled . ,Sir William only smiled . 
pride_3,1,62,"“ Your friend performs delightfully , ” he continued , after a pause , on seeing Bingley join the group ; “ and I doubt not that you are an adept in the science yourself , Mr. Darcy . ” ","“ Your friend performs delightfully , ” he continued , after a pause , on seeing Bingley join the group ; “ and I doubt not that you are an adept in the science yourself , Mr. Darcy . ” "
pride_3,1,63,"“ You saw me dance at Meryton , I believe , sir . ” ","“ You saw me dance at Meryton , I believe , sir . ” "
pride_3,1,64,"“ Yes , indeed , and received no inconsiderable pleasure from the sight . ","“ Yes , indeed , and received no inconsiderable pleasure from the sight . "
pride_3,1,65,"Do you often dance at St. James ’s ? ” “ Never , sir . ” ","Do you often dance at St. James ’s ? ” “ Never , sir . ” "
pride_3,1,66,“ Do you not think it would be a proper compliment to the place ? ” ,“ Do you not think it would be a proper compliment to the place ? ” 
pride_3,1,67,“ It is a compliment which I never pay to any place if I can avoid it . ” ,“ It is a compliment which I never pay to any place if I can avoid it . ” 
pride_3,1,68,"“ You have a house in town , I conclude ? ” ","“ You have a house in town , I conclude ? ” "
pride_3,1,69,Mr. Darcy bowed . ,Mr. Darcy bowed . 
pride_3,1,70,"“ I had once some thoughts of fixing in town myself , for I am fond of superior society ; but I did not feel quite certain that the air of London would agree with Lady Lucas . ” ","“ I had once some thoughts of fixing in town myself , for I am fond of superior society ; but I did not feel quite certain that the air of London would agree with Lady Lucas . ” "
pride_3,1,71,"He paused in hopes of an answer : but his companion was not disposed to make any ; and Elizabeth at that instant moving towards them , he was struck with the notion of doing a very gallant thing , and called out to her,-- “ My dear Miss Eliza , why are not you dancing ? ","He paused in hopes of an answer : but his companion was not disposed to make any ; and Elizabeth at that instant moving towards them , he was struck with the notion of doing a very gallant thing , and called out to her,-- “ My dear Miss Eliza , why are not you dancing ? "
pride_3,1,72,"Mr. Darcy , you must allow me to present this young lady to you as a very desirable partner . ","Mr. Darcy , you must allow me to present this young lady to you as a very desirable partner . "
pride_3,1,73,"You can not refuse to dance , I am sure , when so much beauty is before you . ","You can not refuse to dance , I am sure , when so much beauty is before you . "
pride_3,1,74,"” And , taking her hand , he would have given it to Mr. Darcy , who , though extremely surprised , was not unwilling to receive it , when she instantly drew back , and said with some discomposure to Sir William,-- “ Indeed , sir , I have not the least intention of dancing . ","” And , taking her hand , he would have given it to Mr. Darcy , who , though extremely surprised , was not unwilling to receive it , when she instantly drew back , and said with some discomposure to Sir William,-- “ Indeed , sir , I have not the least intention of dancing . "
pride_3,1,75,I entreat you not to suppose that I moved this way in order to beg for a partner . ” ,I entreat you not to suppose that I moved this way in order to beg for a partner . ” 
pride_3,1,76,"Mr. Darcy , with grave propriety , requested to be allowed the honour of her hand , but in vain . ","Mr. Darcy , with grave propriety , requested to be allowed the honour of her hand , but in vain . "
pride_3,1,77,Elizabeth was determined ; nor did Sir William at all shake her purpose by his attempt at persuasion . ,Elizabeth was determined ; nor did Sir William at all shake her purpose by his attempt at persuasion . 
pride_3,1,78,"“ You excel so much in the dance , Miss Eliza , that it is cruel to deny me the happiness of seeing you ; and though this gentleman dislikes the amusement in general , he can have no objection , I am sure , to oblige us for one half hour . ” ","“ You excel so much in the dance , Miss Eliza , that it is cruel to deny me the happiness of seeing you ; and though this gentleman dislikes the amusement in general , he can have no objection , I am sure , to oblige us for one half hour . ” "
pride_3,1,79,"“ Mr. Darcy is all politeness , ” said Elizabeth , smiling . ","“ Mr. Darcy is all politeness , ” said Elizabeth , smiling . "
pride_3,1,80,"“ He is , indeed : but considering the inducement , my dear Miss Eliza , we can not wonder at his complaisance ; for who would object to such a partner ? ” ","“ He is , indeed : but considering the inducement , my dear Miss Eliza , we can not wonder at his complaisance ; for who would object to such a partner ? ” "
pride_3,1,81,"Elizabeth looked archly , and turned away . ","Elizabeth looked archly , and turned away . "
pride_3,1,82,"Her resistance had not injured her with the gentleman , and he was thinking of her with some complacency , when thus accosted by Miss Bingley,-- “ I can guess the subject of your reverie . ","Her resistance had not injured her with the gentleman , and he was thinking of her with some complacency , when thus accosted by Miss Bingley,-- “ I can guess the subject of your reverie . "
pride_3,1,83,” ,” 
