fic_id,chapter_id,para_id,text,text_tokenized
pride_3,2,88,"Elizabeth was glad to be taken to her immediately ; and Jane , who had only been withheld by the fear of giving alarm or inconvenience , from expressing in her note how much she longed for such a visit , ","Elizabeth was glad to be taken to her immediately ; and Jane , who had only been withheld by the fear of giving alarm or inconvenience , from expressing in her note how much she longed for such a visit , "
pride_3,2,89,was delighted at her entrance . ,was delighted at her entrance . 
pride_3,2,90,"She was not equal , however , to much conversation ; and when Miss Bingley left them together , could attempt little beside expressions of gratitude for the extraordinary kindness she was treated with . ","She was not equal , however , to much conversation ; and when Miss Bingley left them together , could attempt little beside expressions of gratitude for the extraordinary kindness she was treated with . "
pride_3,2,91,Elizabeth silently attended her . ,Elizabeth silently attended her . 
pride_3,2,92,"When breakfast was over , they were joined by the sisters ; and Elizabeth began to like them herself , when she saw how much affection and solicitude they showed for Jane . ","When breakfast was over , they were joined by the sisters ; and Elizabeth began to like them herself , when she saw how much affection and solicitude they showed for Jane . "
pride_3,2,93,"The apothecary came ; and having examined his patient , said , as might be supposed , that she had caught a violent cold , and that they must endeavour to get the better of it ; advised her to return to bed , and promised her some draughts . ","The apothecary came ; and having examined his patient , said , as might be supposed , that she had caught a violent cold , and that they must endeavour to get the better of it ; advised her to return to bed , and promised her some draughts . "
pride_3,2,94,"The advice was followed readily , for the feverish symptoms increased , and her head ached acutely . ","The advice was followed readily , for the feverish symptoms increased , and her head ached acutely . "
pride_3,2,95,"Elizabeth did not quit her room for a moment , nor were the other ladies often absent ; the gentlemen being out , they had in fact nothing to do elsewhere . ","Elizabeth did not quit her room for a moment , nor were the other ladies often absent ; the gentlemen being out , they had in fact nothing to do elsewhere . "
pride_3,2,96,"When the clock struck three , Elizabeth felt that she must go , and very unwillingly said so . ","When the clock struck three , Elizabeth felt that she must go , and very unwillingly said so . "
pride_3,2,97,"Miss Bingley offered her the carriage , and she only ","Miss Bingley offered her the carriage , and she only "
pride_3,2,98,"wanted a little pressing to accept it , when Jane testified such concern at parting with her that Miss Bingley was obliged to convert the offer of the chaise into an invitation to remain at Netherfield for the present . ","wanted a little pressing to accept it , when Jane testified such concern at parting with her that Miss Bingley was obliged to convert the offer of the chaise into an invitation to remain at Netherfield for the present . "
pride_3,2,99,"Elizabeth most thankfully consented , and a servant was despatched to Longbourn , to acquaint the family with her stay , and bring back a supply of clothes . ","Elizabeth most thankfully consented , and a servant was despatched to Longbourn , to acquaint the family with her stay , and bring back a supply of clothes . "
pride_3,2,100,[ Illustration : “ The Apothecary came ” ] [ Illustration : “ covering a screen ” ] ,[ Illustration : “ The Apothecary came ” ] [ Illustration : “ covering a screen ” ] 
