fic_id,chapter_id,para_id,text,text_tokenized
pride_1,2,60,"Mary had heard herself mentioned to Miss Bingley as the most accomplished girl in the neighbourhood ; and Catherine and Lydia had been fortunate enough to be never without partners , which was all that they had yet learnt to care for at a ball . ","Mary had heard herself mentioned to Miss Bingley as the most accomplished girl in the neighbourhood ; and Catherine and Lydia had been fortunate enough to be never without partners , which was all that they had yet learnt to care for at a ball . "
pride_1,2,61,"They returned , therefore , in good spirits to Longbourn , the village where they lived , and of which they were the principal inhabitants . ","They returned , therefore , in good spirits to Longbourn , the village where they lived , and of which they were the principal inhabitants . "
pride_1,2,62,They found Mr. Bennet still up . ,They found Mr. Bennet still up . 
pride_1,2,63,"With a book , he was regardless of time ; and on the present occasion he had a ","With a book , he was regardless of time ; and on the present occasion he had a "
pride_1,2,64,good ,good 
pride_1,2,65,deal of curiosity as to the event of an evening which had raised ,deal of curiosity as to the event of an evening which had raised 
pride_1,2,66,such splendid expectations ,such splendid expectations 
pride_1,2,67,. ,. 
pride_1,2,68,He had rather hoped that all his wife ’s views on the stranger would be disappointed ; but he soon found that he had a very different story to hear . ,He had rather hoped that all his wife ’s views on the stranger would be disappointed ; but he soon found that he had a very different story to hear . 
pride_1,2,69,"“ Oh , my dear Mr. Bennet , ” as she entered the room , “ we have had a most delightful evening , a most excellent ball . ","“ Oh , my dear Mr. Bennet , ” as she entered the room , “ we have had a most delightful evening , a most excellent ball . "
pride_1,2,70,I wish you had been there . ,I wish you had been there . 
pride_1,2,71,"Jane was so admired , nothing could be like it . ","Jane was so admired , nothing could be like it . "
pride_1,2,72,"Everybody said how well she looked ; and Mr. Bingley thought her quite beautiful , and danced with her twice . ","Everybody said how well she looked ; and Mr. Bingley thought her quite beautiful , and danced with her twice . "
pride_1,2,73,"Only think of _ that _ , my dear : he actually danced with her twice ; and she was the only creature in the room that he asked a second time . ","Only think of _ that _ , my dear : he actually danced with her twice ; and she was the only creature in the room that he asked a second time . "
pride_1,2,74,"First of all , he asked Miss Lucas . ","First of all , he asked Miss Lucas . "
pride_1,2,75,"I was so vexed to see him stand up with her ; but , however , he did not admire her at all ; indeed , nobody can , you know ; and he seemed quite struck with Jane as she was going down the dance . ","I was so vexed to see him stand up with her ; but , however , he did not admire her at all ; indeed , nobody can , you know ; and he seemed quite struck with Jane as she was going down the dance . "
pride_1,2,76,"So he inquired who she was , and got introduced , and asked her for the two next . ","So he inquired who she was , and got introduced , and asked her for the two next . "
pride_1,2,77,"Then , the two third he danced with Miss King , and the two fourth with Maria Lucas , and the two fifth with Jane again , and the two sixth with Lizzy , and the _ ","Then , the two third he danced with Miss King , and the two fourth with Maria Lucas , and the two fifth with Jane again , and the two sixth with Lizzy , and the _ "
pride_1,2,78,Boulanger_---- ,Boulanger_---- 
pride_1,2,79,"” “ If he had had any compassion for _ me _ , ” cried her husband impatiently , “ he would not have danced half so much ! ","” “ If he had had any compassion for _ me _ , ” cried her husband impatiently , “ he would not have danced half so much ! "
pride_1,2,80,"For God ’s sake , say no more of his partners . ","For God ’s sake , say no more of his partners . "
pride_1,2,81,O that he had sprained his ancle in the first dance ! ” ,O that he had sprained his ancle in the first dance ! ” 
pride_1,2,82,"“ Oh , my dear , ” continued Mrs. Bennet , “ I am quite delighted with him . ","“ Oh , my dear , ” continued Mrs. Bennet , “ I am quite delighted with him . "
pride_1,2,83,He is so excessively handsome ! ,He is so excessively handsome ! 
pride_1,2,84,and his sisters are charming women . ,and his sisters are charming women . 
pride_1,2,85,I never in my life saw anything more elegant than their dresses . ,I never in my life saw anything more elegant than their dresses . 
pride_1,2,86,I dare say the lace upon Mrs. Hurst ’s gown---- ,I dare say the lace upon Mrs. Hurst ’s gown---- 
pride_1,2,87,” ,” 
pride_1,2,88,Here she was interrupted again . ,Here she was interrupted again . 
pride_1,2,89,Mr. Bennet protested against any description of finery . ,Mr. Bennet protested against any description of finery . 
pride_1,2,90,"She was therefore obliged to seek another branch of the subject , and related , with much bitterness of spirit , and some exaggeration , the shocking rudeness of Mr. Darcy . ","She was therefore obliged to seek another branch of the subject , and related , with much bitterness of spirit , and some exaggeration , the shocking rudeness of Mr. Darcy . "
pride_1,2,91,"“ But I can assure you , ” she added , “ that Lizzy does not lose much by not suiting _ his _ fancy ; for he is a most disagreeable , horrid man , not at all worth pleasing . ","“ But I can assure you , ” she added , “ that Lizzy does not lose much by not suiting _ his _ fancy ; for he is a most disagreeable , horrid man , not at all worth pleasing . "
pride_1,2,92,"So high and so conceited , that there was no enduring him ! ","So high and so conceited , that there was no enduring him ! "
pride_1,2,93,"He walked here , and he walked there , fancying himself so very great ! ","He walked here , and he walked there , fancying himself so very great ! "
pride_1,2,94,Not handsome enough to dance with ! ,Not handsome enough to dance with ! 
pride_1,2,95,"I wish you had been there , my dear , to have given him one of your set - downs . ","I wish you had been there , my dear , to have given him one of your set - downs . "
pride_1,2,96,I quite detest the man . ” ,I quite detest the man . ” 
