fic_id,chapter_id,para_id,text,text_tokenized
pride_20,1,1, XL . , XL . 
pride_20,1,2,"Elizabeth ’s impatience to acquaint Jane with what had happened could no longer be overcome ; and at length resolving to suppress every particular in which her sister was concerned , and preparing her to be surprised , she related to her the next morning the chief of the scene between Mr. Darcy and herself . Miss Bennet ’s astonishment was soon lessened by the strong sisterly partiality which made any admiration of Elizabeth appear perfectly natural ; and all surprise was shortly lost in other feelings . ","Elizabeth ’s impatience to acquaint Jane with what had happened could no longer be overcome ; and at length resolving to suppress every particular in which her sister was concerned , and preparing her to be surprised , she related to her the next morning the chief of the scene between Mr. Darcy and herself . Miss Bennet ’s astonishment was soon lessened by the strong sisterly partiality which made any admiration of Elizabeth appear perfectly natural ; and all surprise was shortly lost in other feelings . "
pride_20,1,3,She was sorry that Mr. Darcy should have delivered his sentiments in a manner so little suited to recommend them ; but still more was she grieved for the unhappiness which her sister ’s refusal must have given him . ,She was sorry that Mr. Darcy should have delivered his sentiments in a manner so little suited to recommend them ; but still more was she grieved for the unhappiness which her sister ’s refusal must have given him . 
pride_20,1,4,"“ His being so sure of succeeding was wrong , ” said she , “ and certainly ought not to have appeared ; but consider how much it must increase his disappointment . ” ","“ His being so sure of succeeding was wrong , ” said she , “ and certainly ought not to have appeared ; but consider how much it must increase his disappointment . ” "
pride_20,1,5,"“ Indeed , ” replied Elizabeth , “ I am heartily sorry for him ; but he has other feelings which will probably soon drive away his regard for me . ","“ Indeed , ” replied Elizabeth , “ I am heartily sorry for him ; but he has other feelings which will probably soon drive away his regard for me . "
pride_20,1,6,"You do not blame me , however , for refusing him ? ” “ Blame you ! ","You do not blame me , however , for refusing him ? ” “ Blame you ! "
pride_20,1,7,"Oh , no . ” ","Oh , no . ” "
pride_20,1,8,“ But you blame me for having spoken so warmly of Wickham ? ” ,“ But you blame me for having spoken so warmly of Wickham ? ” 
pride_20,1,9,“ No -- I do not know that you were wrong in saying what you did . ” ,“ No -- I do not know that you were wrong in saying what you did . ” 
pride_20,1,10,"“ But you _ will _ know it , when I have told you what happened the very next day . ” She then spoke of the letter , repeating the whole of its contents as far as they concerned George Wickham . ","“ But you _ will _ know it , when I have told you what happened the very next day . ” She then spoke of the letter , repeating the whole of its contents as far as they concerned George Wickham . "
pride_20,1,11,"What a stroke was this for poor Jane , who would willingly have gone through the world without believing that so much wickedness existed in the whole race of mankind as was here collected in one individual ! ","What a stroke was this for poor Jane , who would willingly have gone through the world without believing that so much wickedness existed in the whole race of mankind as was here collected in one individual ! "
pride_20,1,12,"Nor was Darcy ’s vindication , though grateful to her feelings , capable of consoling her for such discovery . ","Nor was Darcy ’s vindication , though grateful to her feelings , capable of consoling her for such discovery . "
pride_20,1,13,"Most earnestly did she labour to prove the probability of error , and seek to clear one , without involving the other . ","Most earnestly did she labour to prove the probability of error , and seek to clear one , without involving the other . "
pride_20,1,14,"“ This will not do , ” said Elizabeth ; “ you never will be able to make both of them good for anything . ","“ This will not do , ” said Elizabeth ; “ you never will be able to make both of them good for anything . "
pride_20,1,15,"Take your choice , but you must be satisfied ","Take your choice , but you must be satisfied "
pride_20,1,16,with only one ,with only one 
pride_20,1,17,. ,. 
pride_20,1,18,There is but such a quantity of merit between them ; just enough to make one good sort of man ; and of late it has been shifting about pretty much . ,There is but such a quantity of merit between them ; just enough to make one good sort of man ; and of late it has been shifting about pretty much . 
pride_20,1,19,"For my part , I am inclined to believe it all Mr. Darcy ’s , but you shall do as you choose . ","For my part , I am inclined to believe it all Mr. Darcy ’s , but you shall do as you choose . "
pride_20,1,20,"” It was some time , however , before a smile could be extorted from Jane . ","” It was some time , however , before a smile could be extorted from Jane . "
pride_20,1,21,"“ I do not know when I have been more shocked , ” said she . ","“ I do not know when I have been more shocked , ” said she . "
pride_20,1,22,“ Wickham so very bad ! ,“ Wickham so very bad ! 
pride_20,1,23,It is almost past belief . ,It is almost past belief . 
pride_20,1,24,And poor Mr. Darcy ! ,And poor Mr. Darcy ! 
pride_20,1,25,"dear Lizzy , only consider what he must have suffered . ","dear Lizzy , only consider what he must have suffered . "
pride_20,1,26,Such a disappointment ! ,Such a disappointment ! 
pride_20,1,27,and with the knowledge of your ill opinion too ! and having to relate such a thing of his sister ! ,and with the knowledge of your ill opinion too ! and having to relate such a thing of his sister ! 
pride_20,1,28,"It is really too distressing , I am sure you must feel it so . ” ","It is really too distressing , I am sure you must feel it so . ” "
pride_20,1,29,"“ Oh no , my regret and compassion are all done away by seeing you so full of both . ","“ Oh no , my regret and compassion are all done away by seeing you so full of both . "
pride_20,1,30,"I know you will do him such ample justice , that I am growing every moment more unconcerned and indifferent . ","I know you will do him such ample justice , that I am growing every moment more unconcerned and indifferent . "
pride_20,1,31,"Your profusion makes me saving ; and if you lament over him much longer , my heart will be as light as a feather . ” ","Your profusion makes me saving ; and if you lament over him much longer , my heart will be as light as a feather . ” "
pride_20,1,32,“ Poor Wickham ! ,“ Poor Wickham ! 
pride_20,1,33,there is such an expression of goodness in his countenance ! ,there is such an expression of goodness in his countenance ! 
pride_20,1,34,such an openness and gentleness in his manner . ,such an openness and gentleness in his manner . 
pride_20,1,35,” “ There certainly was some great mismanagement in the education of those two young men . ,” “ There certainly was some great mismanagement in the education of those two young men . 
pride_20,1,36,"One has got all the goodness , and the other all the appearance of it . ” ","One has got all the goodness , and the other all the appearance of it . ” "
pride_20,1,37,"“ I never thought Mr. Darcy so deficient in the _ appearance _ of it as you used to do . ” “ And yet I meant to be uncommonly clever in taking so decided a dislike to him , without any reason . ","“ I never thought Mr. Darcy so deficient in the _ appearance _ of it as you used to do . ” “ And yet I meant to be uncommonly clever in taking so decided a dislike to him , without any reason . "
pride_20,1,38,"It is such a spur to one ’s genius , such an opening for wit , to have a dislike of that kind . ","It is such a spur to one ’s genius , such an opening for wit , to have a dislike of that kind . "
pride_20,1,39,One may be continually abusive without saying anything just ; but one can not be always laughing at a man without now and then stumbling on something witty . ” ,One may be continually abusive without saying anything just ; but one can not be always laughing at a man without now and then stumbling on something witty . ” 
pride_20,1,40,"“ Lizzy , when you first read that letter , I am sure you could not treat the matter as you do now . ” ","“ Lizzy , when you first read that letter , I am sure you could not treat the matter as you do now . ” "
pride_20,1,41,"“ Indeed , I could not . ","“ Indeed , I could not . "
pride_20,1,42,"I was uncomfortable enough , I was very uncomfortable -- I may say unhappy . ","I was uncomfortable enough , I was very uncomfortable -- I may say unhappy . "
pride_20,1,43,"And with no one to speak to of what I felt , no Jane to comfort me , and say that I had not been so very weak , and vain , and nonsensical , as I knew I had ! ","And with no one to speak to of what I felt , no Jane to comfort me , and say that I had not been so very weak , and vain , and nonsensical , as I knew I had ! "
pride_20,1,44,"Oh , how I wanted you ! ” ","Oh , how I wanted you ! ” "
pride_20,1,45,"“ How unfortunate that you should have used such very strong expressions in speaking of Wickham to Mr. Darcy , for now they _ do _ appear wholly undeserved . ” “ Certainly . ","“ How unfortunate that you should have used such very strong expressions in speaking of Wickham to Mr. Darcy , for now they _ do _ appear wholly undeserved . ” “ Certainly . "
pride_20,1,46,But the misfortune of speaking with bitterness is a most natural consequence of the prejudices I had been encouraging . ,But the misfortune of speaking with bitterness is a most natural consequence of the prejudices I had been encouraging . 
pride_20,1,47,There is one point on which I want your advice . ,There is one point on which I want your advice . 
pride_20,1,48,"I want to be told whether I ought , or ought not , to make our acquaintance in general understand Wickham ’s character . ” ","I want to be told whether I ought , or ought not , to make our acquaintance in general understand Wickham ’s character . ” "
pride_20,1,49,"Miss Bennet paused a little , and then replied , “ Surely there can be no occasion for exposing him so dreadfully . ","Miss Bennet paused a little , and then replied , “ Surely there can be no occasion for exposing him so dreadfully . "
pride_20,1,50,What is your own opinion ? ” “ That it ought not to be attempted . ,What is your own opinion ? ” “ That it ought not to be attempted . 
pride_20,1,51,Mr. Darcy has not authorized me to make his communication public . ,Mr. Darcy has not authorized me to make his communication public . 
pride_20,1,52,"On the contrary , every particular relative to his sister was meant to be kept as much as possible to myself ; and if I endeavour to undeceive people as to the rest of his conduct , who will believe me ? ","On the contrary , every particular relative to his sister was meant to be kept as much as possible to myself ; and if I endeavour to undeceive people as to the rest of his conduct , who will believe me ? "
pride_20,1,53,"The general prejudice against Mr. Darcy is so violent , that it would be the death of half the good people in Meryton , to attempt to place him in an amiable light . ","The general prejudice against Mr. Darcy is so violent , that it would be the death of half the good people in Meryton , to attempt to place him in an amiable light . "
pride_20,1,54,I am not equal to it . ,I am not equal to it . 
pride_20,1,55,"Wickham will soon be gone ; and , therefore , it will not signify to anybody here what he really is . ","Wickham will soon be gone ; and , therefore , it will not signify to anybody here what he really is . "
pride_20,1,56,"Some time hence it will be all found out , and then we may laugh at their stupidity in not knowing it before . ","Some time hence it will be all found out , and then we may laugh at their stupidity in not knowing it before . "
pride_20,1,57,At present I will say nothing about it . ” “ You are quite right . ,At present I will say nothing about it . ” “ You are quite right . 
pride_20,1,58,To have his errors made public might ruin him for ever . ,To have his errors made public might ruin him for ever . 
pride_20,1,59,"He is now , perhaps , sorry for what he has done , and anxious to re - establish a character . ","He is now , perhaps , sorry for what he has done , and anxious to re - establish a character . "
pride_20,1,60,We must not make him desperate . ” The tumult of Elizabeth ’s mind was allayed by this conversation . ,We must not make him desperate . ” The tumult of Elizabeth ’s mind was allayed by this conversation . 
pride_20,1,61,"She had got rid of two of the secrets which had weighed on her for a fortnight , and was certain of a willing listener in Jane , whenever she might wish to talk again of either . ","She had got rid of two of the secrets which had weighed on her for a fortnight , and was certain of a willing listener in Jane , whenever she might wish to talk again of either . "
pride_20,1,62,"But there was still something lurking behind , of which prudence forbade the disclosure . ","But there was still something lurking behind , of which prudence forbade the disclosure . "
pride_20,1,63,She dared not ,She dared not 
pride_20,1,64,"relate the other half of Mr. Darcy ’s letter , nor explain to her sister how sincerely she had been valued by his friend . ","relate the other half of Mr. Darcy ’s letter , nor explain to her sister how sincerely she had been valued by his friend . "
pride_20,1,65,Here was knowledge in which no one could partake ; and she was sensible that nothing less than a perfect understanding between the parties could justify her in throwing off this last encumbrance of mystery . ,Here was knowledge in which no one could partake ; and she was sensible that nothing less than a perfect understanding between the parties could justify her in throwing off this last encumbrance of mystery . 
pride_20,1,66,"“ And then , ” said she , “ if that very improbable event should ever take place , I shall merely be able to tell what Bingley may tell in a much more agreeable manner himself . ","“ And then , ” said she , “ if that very improbable event should ever take place , I shall merely be able to tell what Bingley may tell in a much more agreeable manner himself . "
pride_20,1,67,The liberty of communication can not be mine till it has lost all its value ! ” ,The liberty of communication can not be mine till it has lost all its value ! ” 
pride_20,1,68,"She was now , on being settled at home , at leisure to observe the real state of her sister ’s spirits . ","She was now , on being settled at home , at leisure to observe the real state of her sister ’s spirits . "
pride_20,1,69,Jane was not happy . ,Jane was not happy . 
pride_20,1,70,She still cherished a very tender affection for Bingley . ,She still cherished a very tender affection for Bingley . 
pride_20,1,71,"Having never even fancied herself in love before , her regard had all the warmth of first attachment , and from her age and disposition , greater steadiness than first attachments often boast ; and so fervently did she value his remembrance , and prefer him to every other man , that all her good sense , and all her attention to the feelings of her friends , were requisite to check the indulgence of those regrets which must have been injurious to her own health and their tranquillity . “ Well , Lizzy , ” said Mrs. Bennet , one day , “ what is your opinion _ now _ of this sad business of Jane ’s ? ","Having never even fancied herself in love before , her regard had all the warmth of first attachment , and from her age and disposition , greater steadiness than first attachments often boast ; and so fervently did she value his remembrance , and prefer him to every other man , that all her good sense , and all her attention to the feelings of her friends , were requisite to check the indulgence of those regrets which must have been injurious to her own health and their tranquillity . “ Well , Lizzy , ” said Mrs. Bennet , one day , “ what is your opinion _ now _ of this sad business of Jane ’s ? "
pride_20,1,72,"For my part , I am determined never to speak of it again to anybody . ","For my part , I am determined never to speak of it again to anybody . "
pride_20,1,73,I told my sister Philips so the other day . ,I told my sister Philips so the other day . 
pride_20,1,74,But I can not find out that Jane saw anything of him in London . ,But I can not find out that Jane saw anything of him in London . 
pride_20,1,75,"Well , he is a very undeserving young man -- and I do not suppose there is the least chance in the world of her ever getting him now . ","Well , he is a very undeserving young man -- and I do not suppose there is the least chance in the world of her ever getting him now . "
pride_20,1,76,"There is no talk of his coming to Netherfield again in the summer ; and I have inquired of everybody , too , who is likely to know . ” ","There is no talk of his coming to Netherfield again in the summer ; and I have inquired of everybody , too , who is likely to know . ” "
pride_20,1,77,“ I do not believe that he will ever live at Netherfield any more . ” ,“ I do not believe that he will ever live at Netherfield any more . ” 
pride_20,1,78,"“ Oh , well ! ","“ Oh , well ! "
pride_20,1,79,it is just as he chooses . ,it is just as he chooses . 
pride_20,1,80,"Nobody wants him to come ; though I shall always say that he used my daughter extremely ill ; and , if I was her , I would not have put up with it . ","Nobody wants him to come ; though I shall always say that he used my daughter extremely ill ; and , if I was her , I would not have put up with it . "
pride_20,1,81,"Well , my comfort is , I am sure Jane will die of a broken heart , and then he will be sorry for what he has done . ","Well , my comfort is , I am sure Jane will die of a broken heart , and then he will be sorry for what he has done . "
pride_20,1,82,” But as Elizabeth could not receive comfort from any such expectation she made no answer . ,” But as Elizabeth could not receive comfort from any such expectation she made no answer . 
pride_20,1,83,"“ Well , Lizzy , ” continued her mother , soon afterwards , “ and so the Collinses live very comfortable , do they ? ","“ Well , Lizzy , ” continued her mother , soon afterwards , “ and so the Collinses live very comfortable , do they ? "
pride_20,1,84,"Well , well , I only hope it will last . ","Well , well , I only hope it will last . "
pride_20,1,85,And what sort of table do they keep ? ,And what sort of table do they keep ? 
pride_20,1,86,"Charlotte is an excellent manager , I dare say . ","Charlotte is an excellent manager , I dare say . "
pride_20,1,87,"If she is half as sharp as her mother , she is saving enough . ","If she is half as sharp as her mother , she is saving enough . "
pride_20,1,88,"There is nothing extravagant in _ their _ housekeeping , I dare say . ” ","There is nothing extravagant in _ their _ housekeeping , I dare say . ” "
pride_20,1,89,"“ No , nothing at all . ” “ A great deal of good management , depend upon it . ","“ No , nothing at all . ” “ A great deal of good management , depend upon it . "
pride_20,1,90,"Yes , yes . ","Yes , yes . "
pride_20,1,91,_ They _ will take care not to outrun their income . ,_ They _ will take care not to outrun their income . 
pride_20,1,92,_ They _ will never be distressed for money . ,_ They _ will never be distressed for money . 
pride_20,1,93,"Well , much good may it do them ! ","Well , much good may it do them ! "
pride_20,1,94,"And so , I suppose , they often talk of having Longbourn when your father is dead . ","And so , I suppose , they often talk of having Longbourn when your father is dead . "
pride_20,1,95,"They look upon it quite as their own , I dare say , whenever that happens . ","They look upon it quite as their own , I dare say , whenever that happens . "
pride_20,1,96,” ,” 
pride_20,1,97,“ It was a subject which they could not mention before me . ” ,“ It was a subject which they could not mention before me . ” 
pride_20,1,98,“ No ; it would have been strange if they had . ,“ No ; it would have been strange if they had . 
pride_20,1,99,But I make no doubt they often talk of it between themselves . ,But I make no doubt they often talk of it between themselves . 
pride_20,1,100,"Well , if they can be easy with an estate that is not lawfully their own , so much the better . ","Well , if they can be easy with an estate that is not lawfully their own , so much the better . "
pride_20,1,101,_ I _ should be ashamed of having one that was only entailed on me . ” ,_ I _ should be ashamed of having one that was only entailed on me . ” 
pride_20,2,1, XLI . , XLI . 
pride_20,2,2,The first week of their return was soon gone . ,The first week of their return was soon gone . 
pride_20,2,3,The second began . ,The second began . 
pride_20,2,4,"It was the last of the regiment ’s stay in Meryton , and all the young ladies in the neighbourhood were drooping apace . ","It was the last of the regiment ’s stay in Meryton , and all the young ladies in the neighbourhood were drooping apace . "
pride_20,2,5,The dejection was almost universal . ,The dejection was almost universal . 
pride_20,2,6,"The elder Miss Bennets alone were still able to eat , drink , and sleep , and pursue the usual course of their employments . ","The elder Miss Bennets alone were still able to eat , drink , and sleep , and pursue the usual course of their employments . "
pride_20,2,7,"Very frequently were they reproached for this insensibility by Kitty and Lydia , whose own misery was extreme , and who could not comprehend such hard - heartedness in any of the family . ","Very frequently were they reproached for this insensibility by Kitty and Lydia , whose own misery was extreme , and who could not comprehend such hard - heartedness in any of the family . "
pride_20,2,8,“ Good Heaven ! ,“ Good Heaven ! 
pride_20,2,9,What is to become of us ? ,What is to become of us ? 
pride_20,2,10,What are we to do ? ” would they often exclaim in the bitterness of woe . ,What are we to do ? ” would they often exclaim in the bitterness of woe . 
pride_20,2,11,"“ How can you be smiling so , Lizzy ? ” ","“ How can you be smiling so , Lizzy ? ” "
pride_20,2,12,"Their affectionate mother shared all their grief ; she remembered what she had herself endured on a similar occasion five - and - twenty years ago . “ I am sure , ” said she , “ I cried for two days together when Colonel Miller ’s regiment went away . ","Their affectionate mother shared all their grief ; she remembered what she had herself endured on a similar occasion five - and - twenty years ago . “ I am sure , ” said she , “ I cried for two days together when Colonel Miller ’s regiment went away . "
pride_20,2,13,I thought I should have broke my heart . ,I thought I should have broke my heart . 
pride_20,2,14,” ,” 
pride_20,2,15,"“ I am sure I shall break _ mine _ , ” said Lydia . ","“ I am sure I shall break _ mine _ , ” said Lydia . "
pride_20,2,16,“ If one could but go to Brighton ! ” observed Mrs. Bennet . ,“ If one could but go to Brighton ! ” observed Mrs. Bennet . 
pride_20,2,17,“ Oh yes!--if one could but go to Brighton ! ,“ Oh yes!--if one could but go to Brighton ! 
pride_20,2,18,But papa is so disagreeable . ” ,But papa is so disagreeable . ” 
pride_20,2,19,"“ A little sea - bathing would set me up for ever . ” “ And my aunt Philips is sure it would do _ me _ a great deal of good , ” added Kitty . ","“ A little sea - bathing would set me up for ever . ” “ And my aunt Philips is sure it would do _ me _ a great deal of good , ” added Kitty . "
pride_20,2,20,Such were the kind of lamentations resounding perpetually through Longbourn House . ,Such were the kind of lamentations resounding perpetually through Longbourn House . 
pride_20,2,21,Elizabeth tried to be diverted by them ; but all sense of pleasure was lost in shame . ,Elizabeth tried to be diverted by them ; but all sense of pleasure was lost in shame . 
pride_20,2,22,She felt anew the justice of Mr. Darcy ’s objections ; and never had she before been so much disposed to pardon his interference in the views of his friend . ,She felt anew the justice of Mr. Darcy ’s objections ; and never had she before been so much disposed to pardon his interference in the views of his friend . 
pride_20,2,23,"But the gloom of Lydia ’s prospect was shortly cleared away ; for she received an invitation from Mrs. Forster , the wife of the colonel of the regiment , to accompany her to Brighton . ","But the gloom of Lydia ’s prospect was shortly cleared away ; for she received an invitation from Mrs. Forster , the wife of the colonel of the regiment , to accompany her to Brighton . "
pride_20,2,24,This invaluable friend was a ,This invaluable friend was a 
pride_20,2,25,very ,very 
pride_20,2,26,"young woman , and very lately married ","young woman , and very lately married "
pride_20,2,27,. ,. 
