fic_id,chapter_id,para_id,text,text_tokenized
pride_3,1,84,“ I should imagine not . ” ,“ I should imagine not . ” 
pride_3,1,85,"“ You are considering how insupportable it would be to pass many evenings in this manner,--in such society ; and , indeed , I am quite of your opinion . ","“ You are considering how insupportable it would be to pass many evenings in this manner,--in such society ; and , indeed , I am quite of your opinion . "
pride_3,1,86,I was never more annoyed ! ,I was never more annoyed ! 
pride_3,1,87,"The insipidity , and yet the noise -- the nothingness , and yet the self - importance , of all these people ! ","The insipidity , and yet the noise -- the nothingness , and yet the self - importance , of all these people ! "
pride_3,1,88,What would I give to hear your strictures on them ! ” ,What would I give to hear your strictures on them ! ” 
pride_3,1,89,"“ Your conjecture is totally wrong , I assure you . ","“ Your conjecture is totally wrong , I assure you . "
pride_3,1,90,My mind was ,My mind was 
pride_3,1,91,more agreeably engaged . ,more agreeably engaged . 
pride_3,1,92,I have been meditating on the very great pleasure which a pair of fine eyes in the face of a pretty woman can bestow . ” ,I have been meditating on the very great pleasure which a pair of fine eyes in the face of a pretty woman can bestow . ” 
pride_3,1,93,"Miss Bingley immediately fixed her eyes on his face , and desired he would tell her what lady had the credit of inspiring such reflections . Mr. Darcy replied , with great intrepidity,-- “ Miss Elizabeth Bennet . ” “ Miss Elizabeth Bennet ! ” repeated Miss Bingley . ","Miss Bingley immediately fixed her eyes on his face , and desired he would tell her what lady had the credit of inspiring such reflections . Mr. Darcy replied , with great intrepidity,-- “ Miss Elizabeth Bennet . ” “ Miss Elizabeth Bennet ! ” repeated Miss Bingley . "
pride_3,1,94,“ I am all astonishment . ,“ I am all astonishment . 
pride_3,1,95,How long has she been such a favourite ? ,How long has she been such a favourite ? 
pride_3,1,96,and pray when am I to wish you joy ? ” ,and pray when am I to wish you joy ? ” 
pride_3,1,97,“ That is exactly the question which I expected you to ask . ,“ That is exactly the question which I expected you to ask . 
pride_3,1,98,"A lady ’s imagination is very rapid ; it jumps from admiration to love , from love to matrimony , in a moment . ","A lady ’s imagination is very rapid ; it jumps from admiration to love , from love to matrimony , in a moment . "
pride_3,1,99,I knew you would be wishing me joy . ” ,I knew you would be wishing me joy . ” 
pride_3,1,100,"“ Nay , if you are so serious about it , I shall consider the matter as absolutely settled . ","“ Nay , if you are so serious about it , I shall consider the matter as absolutely settled . "
pride_3,1,101,"You will have a charming mother - in - law , indeed , and of course she will be always at Pemberley with you . ” He listened to her with perfect indifference , while she chose to entertain herself in this manner ; and as his composure convinced her that all was safe , her wit flowed along . ","You will have a charming mother - in - law , indeed , and of course she will be always at Pemberley with you . ” He listened to her with perfect indifference , while she chose to entertain herself in this manner ; and as his composure convinced her that all was safe , her wit flowed along . "
pride_3,1,102,[ Illustration : “ A note for Miss Bennet ” [ _ Copyright 1894 by George Allen . ,[ Illustration : “ A note for Miss Bennet ” [ _ Copyright 1894 by George Allen . 
pride_3,1,103,_ ,_ 
pride_3,1,104,] ,] 
pride_3,1,105,] ,] 
pride_3,2,1, VII . , VII . 
pride_3,2,2,"Mr. Bennet ’s property consisted almost entirely in an estate of two thousand a year , which , unfortunately for his daughters , was entailed , in default of heirs male , on a distant relation ; and their mother ’s fortune , though ample for her situation in life , could but ill supply the deficiency of his . ","Mr. Bennet ’s property consisted almost entirely in an estate of two thousand a year , which , unfortunately for his daughters , was entailed , in default of heirs male , on a distant relation ; and their mother ’s fortune , though ample for her situation in life , could but ill supply the deficiency of his . "
pride_3,2,3,"Her father had been an attorney in Meryton , and had left her four thousand pounds . ","Her father had been an attorney in Meryton , and had left her four thousand pounds . "
pride_3,2,4,"She had a sister married to a Mr. Philips , who had been a clerk to their father and succeeded him in the business , and a brother settled in London in a respectable line of trade . ","She had a sister married to a Mr. Philips , who had been a clerk to their father and succeeded him in the business , and a brother settled in London in a respectable line of trade . "
pride_3,2,5,"The village of Longbourn was only one mile from Meryton ; a most convenient distance for the young ladies , who were usually tempted thither three or four times a week , to pay their duty to their aunt , and to a milliner ’s shop just over the way . ","The village of Longbourn was only one mile from Meryton ; a most convenient distance for the young ladies , who were usually tempted thither three or four times a week , to pay their duty to their aunt , and to a milliner ’s shop just over the way . "
pride_3,2,6,"The two youngest of the family , Catherine and Lydia , were particularly frequent in these attentions ","The two youngest of the family , Catherine and Lydia , were particularly frequent in these attentions "
pride_3,2,7,": their minds were more vacant than their sisters ’ , and when nothing better offered , a walk to Meryton was necessary to amuse their morning hours and furnish conversation for the evening ; and , however bare of news the country in general might be , they always contrived to learn some from their aunt . ",": their minds were more vacant than their sisters ’ , and when nothing better offered , a walk to Meryton was necessary to amuse their morning hours and furnish conversation for the evening ; and , however bare of news the country in general might be , they always contrived to learn some from their aunt . "
pride_3,2,8,"At present , indeed , they were well supplied both with news and happiness by the recent arrival of a militia regiment in the neighbourhood ; it was to remain the whole winter , and Meryton was the head - quarters . ","At present , indeed , they were well supplied both with news and happiness by the recent arrival of a militia regiment in the neighbourhood ; it was to remain the whole winter , and Meryton was the head - quarters . "
pride_3,2,9,Their visits to Mrs. Philips were now productive of the most interesting intelligence . ,Their visits to Mrs. Philips were now productive of the most interesting intelligence . 
pride_3,2,10,Every day added something to their knowledge of the officers ’ names and connections . ,Every day added something to their knowledge of the officers ’ names and connections . 
pride_3,2,11,"Their lodgings were not long a secret , and at length they began to know the officers themselves . ","Their lodgings were not long a secret , and at length they began to know the officers themselves . "
pride_3,2,12,"Mr. Philips visited them all , and this opened to his nieces a source of felicity unknown before . ","Mr. Philips visited them all , and this opened to his nieces a source of felicity unknown before . "
pride_3,2,13,"They could talk of nothing but officers ; and Mr. Bingley ’s large fortune , the mention of which gave animation to their mother , was worthless in their eyes when opposed to the regimentals of an ensign . ","They could talk of nothing but officers ; and Mr. Bingley ’s large fortune , the mention of which gave animation to their mother , was worthless in their eyes when opposed to the regimentals of an ensign . "
pride_3,2,14,"After listening one morning to their effusions on this subject , Mr. Bennet coolly observed,-- ","After listening one morning to their effusions on this subject , Mr. Bennet coolly observed,-- "
pride_3,2,15,"“ From all that I can collect by your manner of talking , you must be two of the silliest girls in the country . ","“ From all that I can collect by your manner of talking , you must be two of the silliest girls in the country . "
pride_3,2,16,"I have suspected it some time , but I am now convinced . ” ","I have suspected it some time , but I am now convinced . ” "
pride_3,2,17,"Catherine was disconcerted , and made no answer ; but Lydia , with perfect indifference , continued to express her admiration of Captain Carter , and her hope of seeing him in the course of the day , as he was going the next morning to London . “ I am astonished , my dear , ” said Mrs. Bennet , “ that you should be so ready to think your own children silly . ","Catherine was disconcerted , and made no answer ; but Lydia , with perfect indifference , continued to express her admiration of Captain Carter , and her hope of seeing him in the course of the day , as he was going the next morning to London . “ I am astonished , my dear , ” said Mrs. Bennet , “ that you should be so ready to think your own children silly . "
pride_3,2,18,"If I wished to think slightingly of anybody ’s children , it should not be of my own , however . ” ","If I wished to think slightingly of anybody ’s children , it should not be of my own , however . ” "
pride_3,2,19,"“ If my children are silly , I must hope to be always sensible of it . ” “ Yes ; but as it happens , they are all of them very clever . ” ","“ If my children are silly , I must hope to be always sensible of it . ” “ Yes ; but as it happens , they are all of them very clever . ” "
pride_3,2,20,"“ This is the only point , I flatter myself , on which we do not agree . ","“ This is the only point , I flatter myself , on which we do not agree . "
pride_3,2,21,"I had hoped that our sentiments coincided in every particular , but I must so far differ from you as to think our two youngest daughters uncommonly foolish . ” ","I had hoped that our sentiments coincided in every particular , but I must so far differ from you as to think our two youngest daughters uncommonly foolish . ” "
pride_3,2,22,"“ My dear Mr. Bennet , you must not expect such girls to have the sense of their father and mother . ","“ My dear Mr. Bennet , you must not expect such girls to have the sense of their father and mother . "
pride_3,2,23,"When they get to our age , I dare say they will not think about officers any more than we do . ","When they get to our age , I dare say they will not think about officers any more than we do . "
pride_3,2,24,"I remember the time when I liked a red coat myself very well -- and , indeed , so I do still at my heart ; and if a smart young colonel , with five or six thousand a year , should want one of my girls , I shall not say nay to him ; and I thought Colonel Forster looked very becoming the other night at Sir William ’s in his regimentals . ” ","I remember the time when I liked a red coat myself very well -- and , indeed , so I do still at my heart ; and if a smart young colonel , with five or six thousand a year , should want one of my girls , I shall not say nay to him ; and I thought Colonel Forster looked very becoming the other night at Sir William ’s in his regimentals . ” "
pride_3,2,25,"“ Mamma , ” cried Lydia , “ my aunt says that Colonel Forster and Captain Carter do not go so often to Miss Watson ’s as they did when they first came ; she sees them now very often standing in Clarke ’s library . ” ","“ Mamma , ” cried Lydia , “ my aunt says that Colonel Forster and Captain Carter do not go so often to Miss Watson ’s as they did when they first came ; she sees them now very often standing in Clarke ’s library . ” "
pride_3,2,26,"Mrs. Bennet was prevented replying by the entrance of the footman with a note for Miss Bennet ; it came from Netherfield , and the servant waited for an answer . ","Mrs. Bennet was prevented replying by the entrance of the footman with a note for Miss Bennet ; it came from Netherfield , and the servant waited for an answer . "
pride_3,2,27,"Mrs. Bennet ’s eyes sparkled with pleasure , and she was eagerly calling out , while her daughter read,-- “ Well , Jane , who is it from ? ","Mrs. Bennet ’s eyes sparkled with pleasure , and she was eagerly calling out , while her daughter read,-- “ Well , Jane , who is it from ? "
pride_3,2,28,What is it about ? ,What is it about ? 
pride_3,2,29,What does he say ? ,What does he say ? 
pride_3,2,30,"Well , Jane , make haste and tell us ; make haste , my love . ” ","Well , Jane , make haste and tell us ; make haste , my love . ” "
pride_3,2,31,"“ It is from Miss Bingley , ” said Jane , and then read it aloud . ","“ It is from Miss Bingley , ” said Jane , and then read it aloud . "
pride_3,2,32,/ * NIND ,/ * NIND 
pride_3,2,33,"“ My dear friend , * / ","“ My dear friend , * / "
pride_3,2,34,"“ If you are not so compassionate as to dine to - day with Louisa and me , we shall be in danger of hating each other for the rest of our lives ; for a whole day ’s _ tête - à - tête _ between two women can never end without a quarrel . ","“ If you are not so compassionate as to dine to - day with Louisa and me , we shall be in danger of hating each other for the rest of our lives ; for a whole day ’s _ tête - à - tête _ between two women can never end without a quarrel . "
pride_3,2,35,Come as soon as you can on the receipt of this . ,Come as soon as you can on the receipt of this . 
pride_3,2,36,My brother and the gentlemen are to dine with the officers . ,My brother and the gentlemen are to dine with the officers . 
pride_3,2,37,"Yours ever , “ CAROLINE BINGLEY . ” ","Yours ever , “ CAROLINE BINGLEY . ” "
pride_3,2,38,"“ With the officers ! ” cried Lydia : “ I wonder my aunt did not tell us of _ that _ . ” “ Dining out , ” said Mrs. Bennet ; “ that is very unlucky . ” “ Can I have the carriage ? ” said Jane . ","“ With the officers ! ” cried Lydia : “ I wonder my aunt did not tell us of _ that _ . ” “ Dining out , ” said Mrs. Bennet ; “ that is very unlucky . ” “ Can I have the carriage ? ” said Jane . "
pride_3,2,39,"“ No , my dear , you had better go on horseback , because it seems likely to rain ; and then you must stay all night . ” ","“ No , my dear , you had better go on horseback , because it seems likely to rain ; and then you must stay all night . ” "
pride_3,2,40,"“ That would be a good scheme , ” said Elizabeth , “ if you were sure that they would not offer to send her home . ” ","“ That would be a good scheme , ” said Elizabeth , “ if you were sure that they would not offer to send her home . ” "
pride_3,2,41,"“ Oh , but the gentlemen will have Mr. Bingley ’s chaise to go to Meryton ; and the Hursts have no horses to theirs . ” ","“ Oh , but the gentlemen will have Mr. Bingley ’s chaise to go to Meryton ; and the Hursts have no horses to theirs . ” "
pride_3,2,42,“ I had much rather go in the coach . ” ,“ I had much rather go in the coach . ” 
pride_3,2,43,"“ But , my dear , your father can not spare the horses , I am sure . ","“ But , my dear , your father can not spare the horses , I am sure . "
pride_3,2,44,"They are wanted in the farm , Mr. Bennet , are not they ? ” ","They are wanted in the farm , Mr. Bennet , are not they ? ” "
pride_3,2,45,“ They are wanted in the farm much oftener than I can get them . ” ,“ They are wanted in the farm much oftener than I can get them . ” 
pride_3,2,46,"“ But if you have got them to - day , ” said Elizabeth , “ my mother ’s purpose will be answered . ","“ But if you have got them to - day , ” said Elizabeth , “ my mother ’s purpose will be answered . "
pride_3,2,47,” ,” 
pride_3,2,48,"She did at last extort from her father an acknowledgment that the horses were engaged ; Jane was therefore obliged to go on horseback , and her mother attended her to the door with many cheerful prognostics of a bad day . ","She did at last extort from her father an acknowledgment that the horses were engaged ; Jane was therefore obliged to go on horseback , and her mother attended her to the door with many cheerful prognostics of a bad day . "
pride_3,2,49,Her hopes were answered ; Jane had not been gone long before it rained hard . ,Her hopes were answered ; Jane had not been gone long before it rained hard . 
pride_3,2,50,"Her sisters were uneasy for her , but her mother was delighted . ","Her sisters were uneasy for her , but her mother was delighted . "
pride_3,2,51,The rain continued the whole evening without intermission ; Jane certainly could not come back . ,The rain continued the whole evening without intermission ; Jane certainly could not come back . 
pride_3,2,52,"“ This was a lucky idea of mine , indeed ! ” said Mrs. Bennet , more than once , as if the credit of making it rain were all her own . ","“ This was a lucky idea of mine , indeed ! ” said Mrs. Bennet , more than once , as if the credit of making it rain were all her own . "
pride_3,2,53,Till the next morning ,Till the next morning 
pride_3,2,54,", however , she was not aware of all the felicity of her contrivance . ",", however , she was not aware of all the felicity of her contrivance . "
pride_3,2,55,"Breakfast was scarcely over when a servant from Netherfield brought the following note for Elizabeth:-- / * NIND “ My dearest Lizzie , * / “ I find myself very unwell this morning , which , I suppose , is to be imputed to my getting wet through yesterday . ","Breakfast was scarcely over when a servant from Netherfield brought the following note for Elizabeth:-- / * NIND “ My dearest Lizzie , * / “ I find myself very unwell this morning , which , I suppose , is to be imputed to my getting wet through yesterday . "
pride_3,2,56,My kind friends will not hear of my returning home till I am better . ,My kind friends will not hear of my returning home till I am better . 
pride_3,2,57,"They insist also on my seeing Mr. Jones -- therefore do not be alarmed if you should hear of his having been to me -- and , excepting a sore throat and a headache , there is not much the matter with me . ","They insist also on my seeing Mr. Jones -- therefore do not be alarmed if you should hear of his having been to me -- and , excepting a sore throat and a headache , there is not much the matter with me . "
pride_3,2,58,"“ Yours , etc . ” ","“ Yours , etc . ” "
pride_3,2,59,"“ Well , my dear , ” said Mr. Bennet , when Elizabeth had read the note aloud , “ if your daughter should have a dangerous fit of illness -- if she should die -- it would be a comfort to know that it was all in pursuit of Mr. Bingley , and under your orders . ” ","“ Well , my dear , ” said Mr. Bennet , when Elizabeth had read the note aloud , “ if your daughter should have a dangerous fit of illness -- if she should die -- it would be a comfort to know that it was all in pursuit of Mr. Bingley , and under your orders . ” "
pride_3,2,60,"“ Oh , I am not at all afraid of her dying . ","“ Oh , I am not at all afraid of her dying . "
pride_3,2,61,People do not die of little trifling colds . ,People do not die of little trifling colds . 
pride_3,2,62,She will be taken good care of . ,She will be taken good care of . 
pride_3,2,63,"As long as she stays there , it is all very well . ","As long as she stays there , it is all very well . "
pride_3,2,64,I would go and see her if I could have the carriage . ,I would go and see her if I could have the carriage . 
pride_3,2,65,” ,” 
pride_3,2,66,"Elizabeth , feeling really anxious , determined to go to her , though the carriage was not to be had : and as she was no horsewoman , walking was her only alternative . ","Elizabeth , feeling really anxious , determined to go to her , though the carriage was not to be had : and as she was no horsewoman , walking was her only alternative . "
pride_3,2,67,She declared her resolution . ,She declared her resolution . 
pride_3,2,68,"“ How can you be so silly , ” cried her mother , “ as to think of such a thing , in all this dirt ! ","“ How can you be so silly , ” cried her mother , “ as to think of such a thing , in all this dirt ! "
pride_3,2,69,You will not be fit to be seen when you get there . ” ,You will not be fit to be seen when you get there . ” 
pride_3,2,70,“ I shall be very fit to see Jane -- which is all I want . ” ,“ I shall be very fit to see Jane -- which is all I want . ” 
pride_3,2,71,"“ Is this a hint to me , Lizzy , ” said her father , “ to send for the horses ? ” “ No , indeed . ","“ Is this a hint to me , Lizzy , ” said her father , “ to send for the horses ? ” “ No , indeed . "
pride_3,2,72,I do not wish to avoid the walk . ,I do not wish to avoid the walk . 
pride_3,2,73,"The distance is nothing , when one has a motive ; only three miles . ","The distance is nothing , when one has a motive ; only three miles . "
pride_3,2,74,I shall be back by dinner . ” ,I shall be back by dinner . ” 
pride_3,2,75,"“ I admire the activity of your benevolence , ” observed Mary , “ but every impulse of feeling should be guided by reason ; and , in my opinion , exertion should always be in proportion to what is required . ” ","“ I admire the activity of your benevolence , ” observed Mary , “ but every impulse of feeling should be guided by reason ; and , in my opinion , exertion should always be in proportion to what is required . ” "
pride_3,2,76,"“ We will go as far as Meryton with you , ” said Catherine and Lydia . ","“ We will go as far as Meryton with you , ” said Catherine and Lydia . "
pride_3,2,77,"Elizabeth accepted their company , and the three young ladies set off together . ","Elizabeth accepted their company , and the three young ladies set off together . "
pride_3,2,78,"“ If we make haste , ” said Lydia , as they walked along , “ perhaps we may see something of Captain Carter , before he goes . ” ","“ If we make haste , ” said Lydia , as they walked along , “ perhaps we may see something of Captain Carter , before he goes . ” "
pride_3,2,79,"In Meryton they parted : the two youngest repaired to the lodgings of one of the officers ’ wives , and Elizabeth continued her walk alone , crossing field after field at a quick pace , jumping over stiles and springing over puddles , with impatient activity , and finding herself at last within view of the house , with weary ancles , dirty stockings , and a face glowing with the warmth of exercise . ","In Meryton they parted : the two youngest repaired to the lodgings of one of the officers ’ wives , and Elizabeth continued her walk alone , crossing field after field at a quick pace , jumping over stiles and springing over puddles , with impatient activity , and finding herself at last within view of the house , with weary ancles , dirty stockings , and a face glowing with the warmth of exercise . "
pride_3,2,80,"She was shown into the breakfast parlour , where all but Jane were assembled , and where her appearance created a great deal of surprise . ","She was shown into the breakfast parlour , where all but Jane were assembled , and where her appearance created a great deal of surprise . "
pride_3,2,81,"That she should have walked three miles so early in the day in such dirty weather , and by herself , was almost incredible to Mrs. Hurst and Miss Bingley ; and Elizabeth was convinced that they held her in contempt for it . ","That she should have walked three miles so early in the day in such dirty weather , and by herself , was almost incredible to Mrs. Hurst and Miss Bingley ; and Elizabeth was convinced that they held her in contempt for it . "
pride_3,2,82,"She was received , however , very politely by them ; and in their brother ’s manners there was something better than politeness -- there was good - humour and kindness . ","She was received , however , very politely by them ; and in their brother ’s manners there was something better than politeness -- there was good - humour and kindness . "
pride_3,2,83,"Mr. Darcy said very little , and Mr. Hurst nothing at all . ","Mr. Darcy said very little , and Mr. Hurst nothing at all . "
pride_3,2,84,The former was divided between admiration of the brilliancy which exercise had given to her complexion and doubt as to the occasion ’s justifying her coming so far alone . ,The former was divided between admiration of the brilliancy which exercise had given to her complexion and doubt as to the occasion ’s justifying her coming so far alone . 
pride_3,2,85,The latter was thinking only of his breakfast . ,The latter was thinking only of his breakfast . 
pride_3,2,86,Her inquiries after her sister were not very favourably answered . ,Her inquiries after her sister were not very favourably answered . 
pride_3,2,87,"Miss Bennet had slept ill , and though up , was very feverish , and not well enough to leave her room . ","Miss Bennet had slept ill , and though up , was very feverish , and not well enough to leave her room . "
