fic_id,chapter_id,para_id,text,text_tokenized
emma_19,1,67,"Ever since the service he rendered Jane at Weymouth , when they were out in that party on the water , and she , by the sudden whirling round of something or other among the sails , would have been dashed into the sea at once , and actually was all but gone , if he had not , with the greatest presence of mind , caught hold of her habit-- ( I can never think of it without trembling!)--But ever since we had the history of that day , I have been so fond of Mr. Dixon ! ","Ever since the service he rendered Jane at Weymouth , when they were out in that party on the water , and she , by the sudden whirling round of something or other among the sails , would have been dashed into the sea at once , and actually was all but gone , if he had not , with the greatest presence of mind , caught hold of her habit-- ( I can never think of it without trembling!)--But ever since we had the history of that day , I have been so fond of Mr. Dixon ! "
emma_19,1,68,""" ",""" "
emma_19,1,69,""" But , in spite of all her friends ' urgency , and her own wish of seeing Ireland , Miss Fairfax prefers devoting the time to you and Mrs. Bates ? "" ",""" But , in spite of all her friends ' urgency , and her own wish of seeing Ireland , Miss Fairfax prefers devoting the time to you and Mrs. Bates ? "" "
emma_19,1,70,""" Yes -- entirely her own doing , entirely her own choice ; and Colonel and Mrs. Campbell think she does quite right , just what they should recommend ; and indeed they particularly _ wish _ her to try her native air , as she has not been quite so well as usual lately . "" "" ",""" Yes -- entirely her own doing , entirely her own choice ; and Colonel and Mrs. Campbell think she does quite right , just what they should recommend ; and indeed they particularly _ wish _ her to try her native air , as she has not been quite so well as usual lately . "" "" "
emma_19,1,71,I am concerned to hear of it . ,I am concerned to hear of it . 
emma_19,1,72,I think they judge wisely . But Mrs. Dixon must be very much disappointed . ,I think they judge wisely . But Mrs. Dixon must be very much disappointed . 
emma_19,1,73,"Mrs. Dixon , I understand , has no remarkable degree of personal beauty ; is not , by any means , to be compared with Miss Fairfax . ","Mrs. Dixon , I understand , has no remarkable degree of personal beauty ; is not , by any means , to be compared with Miss Fairfax . "
emma_19,1,74,""" ",""" "
emma_19,1,75,""" Oh ! no . ",""" Oh ! no . "
emma_19,1,76,You are very obliging to say such things -- but certainly not . ,You are very obliging to say such things -- but certainly not . 
emma_19,1,77,There is no comparison between them . ,There is no comparison between them . 
emma_19,1,78,Miss Campbell always was absolutely plain -- but extremely elegant and amiable . ,Miss Campbell always was absolutely plain -- but extremely elegant and amiable . 
emma_19,1,79,""" ",""" "
emma_19,1,80,""" Yes , that of course . "" ",""" Yes , that of course . "" "
emma_19,1,81,""" Jane caught a bad cold , poor thing ! ",""" Jane caught a bad cold , poor thing ! "
emma_19,1,82,"so long ago as the 7th of November , ( as I am going to read to you , ) and has never been well since . ","so long ago as the 7th of November , ( as I am going to read to you , ) and has never been well since . "
emma_19,1,83,"A long time , is not it , for a cold to hang upon her ? ","A long time , is not it , for a cold to hang upon her ? "
emma_19,1,84,"She never mentioned it before , because she would not alarm us . Just like her ! ","She never mentioned it before , because she would not alarm us . Just like her ! "
emma_19,1,85,"so considerate!--But however , she is so far from well , that her kind friends the Campbells think she had better come home , and try an air that always agrees with her ; and they have no doubt that three or four months at Highbury will entirely cure her-- and it is certainly a great deal better that she should come here , than go to Ireland , if she is unwell . ","so considerate!--But however , she is so far from well , that her kind friends the Campbells think she had better come home , and try an air that always agrees with her ; and they have no doubt that three or four months at Highbury will entirely cure her-- and it is certainly a great deal better that she should come here , than go to Ireland , if she is unwell . "
emma_19,1,86,"Nobody could nurse her , as we should do . "" "" It appears to me the most desirable arrangement in the world . ","Nobody could nurse her , as we should do . "" "" It appears to me the most desirable arrangement in the world . "
emma_19,1,87,""" ",""" "
emma_19,1,88,""" And so she is to come to us next Friday or Saturday , and the Campbells leave town in their way to Holyhead the Monday following-- as you will find from Jane 's letter . ",""" And so she is to come to us next Friday or Saturday , and the Campbells leave town in their way to Holyhead the Monday following-- as you will find from Jane 's letter . "
emma_19,1,89,"So sudden!--You may guess , dear Miss Woodhouse , what a flurry it has thrown me in ! ","So sudden!--You may guess , dear Miss Woodhouse , what a flurry it has thrown me in ! "
emma_19,1,90,"If it was not for the drawback of her illness -- but I am afraid we must expect to see her grown thin , and looking very poorly . ","If it was not for the drawback of her illness -- but I am afraid we must expect to see her grown thin , and looking very poorly . "
emma_19,1,91,"I must tell you what an unlucky thing happened to me , as to that . ","I must tell you what an unlucky thing happened to me , as to that . "
emma_19,1,92,"I always make a point of reading Jane 's letters through to myself first , before I read them aloud to my mother , you know , for fear of there being any thing in them to distress her . ","I always make a point of reading Jane 's letters through to myself first , before I read them aloud to my mother , you know , for fear of there being any thing in them to distress her . "
emma_19,1,93,"Jane desired me to do it , so I always do : and so I began to - day with my usual caution ; but no sooner did I come to the mention of her being unwell , than I burst out , quite frightened , with ` Bless me ! ","Jane desired me to do it , so I always do : and so I began to - day with my usual caution ; but no sooner did I come to the mention of her being unwell , than I burst out , quite frightened , with ` Bless me ! "
emma_19,1,94,"poor Jane is ill!'-- which my mother , being on the watch , heard distinctly , and was sadly ","poor Jane is ill!'-- which my mother , being on the watch , heard distinctly , and was sadly "
emma_19,1,95,alarmed at ,alarmed at 
emma_19,1,96,. ,. 
emma_19,1,97,"However , when I read on , I found it was not near so bad as I had fancied at first ; and I make so light of it now to her , that she does not think much about it . ","However , when I read on , I found it was not near so bad as I had fancied at first ; and I make so light of it now to her , that she does not think much about it . "
emma_19,1,98,But I can not imagine how I could be so off my guard . ,But I can not imagine how I could be so off my guard . 
emma_19,1,99,"If Jane does not get well soon , we will call in Mr. Perry . The expense shall not be thought of ; and though he is so liberal , and so fond of Jane that I dare say he would not mean to charge any thing for attendance , we could not suffer it to be so , you know . He has a wife and family to maintain , and is not to be giving away his time . ","If Jane does not get well soon , we will call in Mr. Perry . The expense shall not be thought of ; and though he is so liberal , and so fond of Jane that I dare say he would not mean to charge any thing for attendance , we could not suffer it to be so , you know . He has a wife and family to maintain , and is not to be giving away his time . "
emma_19,1,100,"Well , now I have just given you a hint of what Jane writes about , we will turn to her letter , and I am sure she tells her own story a great deal better than I can tell it for her . ","Well , now I have just given you a hint of what Jane writes about , we will turn to her letter , and I am sure she tells her own story a great deal better than I can tell it for her . "
emma_19,1,101,""" "" I am afraid we must be running away , "" said Emma , glancing at Harriet , and beginning to rise--""My father will be expecting us . ",""" "" I am afraid we must be running away , "" said Emma , glancing at Harriet , and beginning to rise--""My father will be expecting us . "
emma_19,1,102,"I had no intention , I thought I had no power of staying more than five minutes , when I first entered the house . ","I had no intention , I thought I had no power of staying more than five minutes , when I first entered the house . "
emma_19,1,103,"I merely called , because I would not pass the door without inquiring after Mrs. Bates ; but I have been so pleasantly detained ! ","I merely called , because I would not pass the door without inquiring after Mrs. Bates ; but I have been so pleasantly detained ! "
emma_19,1,104,"Now , however , we must wish you and Mrs. Bates good morning . ","Now , however , we must wish you and Mrs. Bates good morning . "
emma_19,1,105,""" And not all that could be urged to detain her succeeded . ",""" And not all that could be urged to detain her succeeded . "
emma_19,1,106,"She regained the street -- happy in this , that though much had been forced on her against her will , though she had in fact heard the whole substance of Jane Fairfax 's letter , she had been able to escape the letter itself . ","She regained the street -- happy in this , that though much had been forced on her against her will , though she had in fact heard the whole substance of Jane Fairfax 's letter , she had been able to escape the letter itself . "
