fic_id,chapter_id,para_id,text,text_tokenized
emma_19,1,1," I Emma and Harriet had been walking together one morning , and , in Emma 's opinion , had been talking enough of Mr. Elton for that day . She could not think that Harriet 's solace or her own sins required more ; and she was therefore industriously getting rid of the subject as they returned;--but it burst out again when she thought she had succeeded , and after speaking some time of what the poor must suffer in winter , and receiving no other answer than a very plaintive-- "" Mr. Elton is so good to the poor ! "" she found something else must be done . "," I Emma and Harriet had been walking together one morning , and , in Emma 's opinion , had been talking enough of Mr. Elton for that day . She could not think that Harriet 's solace or her own sins required more ; and she was therefore industriously getting rid of the subject as they returned;--but it burst out again when she thought she had succeeded , and after speaking some time of what the poor must suffer in winter , and receiving no other answer than a very plaintive-- "" Mr. Elton is so good to the poor ! "" she found something else must be done . "
emma_19,1,2,They were just approaching the house where lived Mrs. and Miss Bates . ,They were just approaching the house where lived Mrs. and Miss Bates . 
emma_19,1,3,She determined to call upon them and seek safety in numbers . ,She determined to call upon them and seek safety in numbers . 
emma_19,1,4,"There was always sufficient reason for such an attention ; Mrs. and Miss Bates loved to be called on , and she knew she was considered by the very few who presumed ever to see imperfection in her , as rather negligent in that respect , and as not contributing what she ought to the stock of their scanty comforts . She had had many a hint from Mr. Knightley and some from her own heart , as to her deficiency -- but none were equal to counteract the persuasion of its being very disagreeable,--a waste of time -- tiresome women-- and all the horror of being in danger of falling in with the second - rate and third - rate of Highbury , who were calling on them for ever , and therefore she seldom went near them . ","There was always sufficient reason for such an attention ; Mrs. and Miss Bates loved to be called on , and she knew she was considered by the very few who presumed ever to see imperfection in her , as rather negligent in that respect , and as not contributing what she ought to the stock of their scanty comforts . She had had many a hint from Mr. Knightley and some from her own heart , as to her deficiency -- but none were equal to counteract the persuasion of its being very disagreeable,--a waste of time -- tiresome women-- and all the horror of being in danger of falling in with the second - rate and third - rate of Highbury , who were calling on them for ever , and therefore she seldom went near them . "
emma_19,1,5,"But now she made the sudden resolution of not passing their door without going in -- observing , as she proposed it to Harriet , that , as well as she could calculate , they were just now quite safe from any letter from Jane Fairfax . ","But now she made the sudden resolution of not passing their door without going in -- observing , as she proposed it to Harriet , that , as well as she could calculate , they were just now quite safe from any letter from Jane Fairfax . "
emma_19,1,6,The house belonged to people in business . ,The house belonged to people in business . 
emma_19,1,7,"Mrs. and Miss Bates occupied the drawing - room floor ; and there , in the very moderate - sized apartment , which was every thing to them , the visitors were most cordially and even gratefully welcomed ; the quiet neat old lady , who with her knitting was seated in the warmest corner , wanting even to give up her place to Miss Woodhouse , and her more active , talking daughter , ","Mrs. and Miss Bates occupied the drawing - room floor ; and there , in the very moderate - sized apartment , which was every thing to them , the visitors were most cordially and even gratefully welcomed ; the quiet neat old lady , who with her knitting was seated in the warmest corner , wanting even to give up her place to Miss Woodhouse , and her more active , talking daughter , "
emma_19,1,8,"almost ready to overpower them with care and kindness , thanks for their visit , solicitude for their shoes , anxious inquiries after Mr. Woodhouse 's health , cheerful communications about her mother 's , and sweet - cake from the beaufet--""Mrs ","almost ready to overpower them with care and kindness , thanks for their visit , solicitude for their shoes , anxious inquiries after Mr. Woodhouse 's health , cheerful communications about her mother 's , and sweet - cake from the beaufet--""Mrs "
emma_19,1,9,". Cole had just been there , just called in for ten minutes , and had been so good as to sit an hour with them , and _ she _ had taken a piece of cake and been so kind as to say she liked it very much ; and , therefore , she hoped Miss Woodhouse and Miss Smith would do them the favour to eat a piece too . "" ",". Cole had just been there , just called in for ten minutes , and had been so good as to sit an hour with them , and _ she _ had taken a piece of cake and been so kind as to say she liked it very much ; and , therefore , she hoped Miss Woodhouse and Miss Smith would do them the favour to eat a piece too . "" "
emma_19,1,10,The mention of the Coles was sure to be followed by that of Mr. Elton . ,The mention of the Coles was sure to be followed by that of Mr. Elton . 
emma_19,1,11,"There was intimacy between them , and Mr. Cole had heard from Mr. Elton since his going away . ","There was intimacy between them , and Mr. Cole had heard from Mr. Elton since his going away . "
emma_19,1,12,"Emma knew what was coming ; they must have the letter over again , and settle how long he had been gone , and how much he was engaged in company , and what a favourite he was wherever he went , and how full the Master of the Ceremonies ' ball had been ; and she went through it very well , with all the interest and all the commendation that could be requisite , and always putting forward to prevent Harriet 's being obliged to say a word . This she had been prepared for when she entered the house ; but meant , having once talked him handsomely over , to be no farther incommoded by any troublesome topic , and to wander at large amongst all the Mistresses and Misses of Highbury , and their card - parties . ","Emma knew what was coming ; they must have the letter over again , and settle how long he had been gone , and how much he was engaged in company , and what a favourite he was wherever he went , and how full the Master of the Ceremonies ' ball had been ; and she went through it very well , with all the interest and all the commendation that could be requisite , and always putting forward to prevent Harriet 's being obliged to say a word . This she had been prepared for when she entered the house ; but meant , having once talked him handsomely over , to be no farther incommoded by any troublesome topic , and to wander at large amongst all the Mistresses and Misses of Highbury , and their card - parties . "
emma_19,1,13,"She had not been prepared to have Jane Fairfax succeed Mr. Elton ; but he was actually hurried off by Miss Bates , she jumped away from him at last abruptly to the Coles , to usher in a letter from her niece . ","She had not been prepared to have Jane Fairfax succeed Mr. Elton ; but he was actually hurried off by Miss Bates , she jumped away from him at last abruptly to the Coles , to usher in a letter from her niece . "
emma_19,1,14,""" Oh ! ",""" Oh ! "
emma_19,1,15,"yes -- Mr. Elton , I understand -- certainly as to dancing-- Mrs. Cole was telling me that dancing at the rooms at Bath was-- Mrs. Cole was so kind as to sit some time with us , talking of Jane ; for as soon as she came in , she began inquiring after her , Jane is so very great a favourite there . Whenever she is with us , Mrs. Cole does not know how to shew her kindness enough ; and I must say that Jane deserves it as much as any body can . ","yes -- Mr. Elton , I understand -- certainly as to dancing-- Mrs. Cole was telling me that dancing at the rooms at Bath was-- Mrs. Cole was so kind as to sit some time with us , talking of Jane ; for as soon as she came in , she began inquiring after her , Jane is so very great a favourite there . Whenever she is with us , Mrs. Cole does not know how to shew her kindness enough ; and I must say that Jane deserves it as much as any body can . "
emma_19,1,16,"And so she began inquiring after her directly , saying , ` I know you can not have heard from Jane lately , because it is not her time for writing ; ' and when I immediately said , ` But indeed we have , we had a letter this very morning , ' I do not know that I ever saw any body more surprized . ` Have you , upon your honour ? ' said she ; ` well , that is quite unexpected . ","And so she began inquiring after her directly , saying , ` I know you can not have heard from Jane lately , because it is not her time for writing ; ' and when I immediately said , ` But indeed we have , we had a letter this very morning , ' I do not know that I ever saw any body more surprized . ` Have you , upon your honour ? ' said she ; ` well , that is quite unexpected . "
emma_19,1,17,Do let me hear what she says . ' ,Do let me hear what she says . ' 
emma_19,1,18,""" Emma 's politeness was at hand directly , to say , with smiling interest-- "" Have you heard from Miss Fairfax so lately ? ",""" Emma 's politeness was at hand directly , to say , with smiling interest-- "" Have you heard from Miss Fairfax so lately ? "
emma_19,1,19,I am extremely happy . ,I am extremely happy . 
emma_19,1,20,"I hope she is well ? "" "" Thank you . ","I hope she is well ? "" "" Thank you . "
emma_19,1,21,"You are so kind ! "" replied the happily deceived aunt , while eagerly hunting for the letter.--""Oh ! ","You are so kind ! "" replied the happily deceived aunt , while eagerly hunting for the letter.--""Oh ! "
emma_19,1,22,here it is . ,here it is . 
emma_19,1,23,"I was sure it could not be far off ; but I had put my huswife upon it , you see , without being aware , and so it was quite hid , but I had it in my hand so very lately that I was almost sure it must be on the table . ","I was sure it could not be far off ; but I had put my huswife upon it , you see , without being aware , and so it was quite hid , but I had it in my hand so very lately that I was almost sure it must be on the table . "
emma_19,1,24,"I was reading it to Mrs. Cole , and since she went away , I was reading it again to my mother , for it is such a pleasure to her-- a letter from Jane -- that she can never hear it often enough ; so I knew it could not be far off , and here it is , only just under my huswife -- and since you are so kind as to wish to hear what she says;--but , first of all , I really must , in justice to Jane , apologise for her writing so short a letter -- only two pages you see-- hardly two -- and in general she fills the whole paper and crosses half . ","I was reading it to Mrs. Cole , and since she went away , I was reading it again to my mother , for it is such a pleasure to her-- a letter from Jane -- that she can never hear it often enough ; so I knew it could not be far off , and here it is , only just under my huswife -- and since you are so kind as to wish to hear what she says;--but , first of all , I really must , in justice to Jane , apologise for her writing so short a letter -- only two pages you see-- hardly two -- and in general she fills the whole paper and crosses half . "
emma_19,1,25,My mother often wonders that I can make it out so well . ,My mother often wonders that I can make it out so well . 
emma_19,1,26,"She often says , when the letter is first opened , ` Well , Hetty , now I think you will be put to it to make out all that checker - work'-- do n't you , ma'am?--And then I tell her , I am sure she would contrive to make it out herself , if she had nobody to do it for her-- every word of it -- I am sure she would pore over it till she had made out every word . ","She often says , when the letter is first opened , ` Well , Hetty , now I think you will be put to it to make out all that checker - work'-- do n't you , ma'am?--And then I tell her , I am sure she would contrive to make it out herself , if she had nobody to do it for her-- every word of it -- I am sure she would pore over it till she had made out every word . "
emma_19,1,27,"And , indeed , though my mother 's eyes are not so good as they were , she can see amazingly well still , thank God ! with the help of spectacles . ","And , indeed , though my mother 's eyes are not so good as they were , she can see amazingly well still , thank God ! with the help of spectacles . "
emma_19,1,28,It is such a blessing ! ,It is such a blessing ! 
emma_19,1,29,My mother 's are really very good indeed . ,My mother 's are really very good indeed . 
emma_19,1,30,"Jane often says , when she is here , ` I am sure , grandmama , you must have had very strong eyes to see as you do -- and so much fine work as you have done too!--I only wish my eyes may last me as well . ' ","Jane often says , when she is here , ` I am sure , grandmama , you must have had very strong eyes to see as you do -- and so much fine work as you have done too!--I only wish my eyes may last me as well . ' "
emma_19,1,31,""" All this spoken extremely fast obliged Miss Bates to stop for breath ; and Emma said something very civil about the excellence of Miss Fairfax 's handwriting . ",""" All this spoken extremely fast obliged Miss Bates to stop for breath ; and Emma said something very civil about the excellence of Miss Fairfax 's handwriting . "
emma_19,1,32,""" You are extremely kind , "" replied Miss Bates , highly gratified ; "" you who are such a judge , and write so beautifully yourself . ",""" You are extremely kind , "" replied Miss Bates , highly gratified ; "" you who are such a judge , and write so beautifully yourself . "
emma_19,1,33,I am sure there is nobody 's praise that could give us so much pleasure as Miss Woodhouse 's . ,I am sure there is nobody 's praise that could give us so much pleasure as Miss Woodhouse 's . 
emma_19,1,34,My mother does not hear ; she is a little deaf you know . ,My mother does not hear ; she is a little deaf you know . 
emma_19,1,35,"Ma'am , "" addressing her , "" do you hear what Miss Woodhouse is so obliging to say about Jane 's handwriting ? "" ","Ma'am , "" addressing her , "" do you hear what Miss Woodhouse is so obliging to say about Jane 's handwriting ? "" "
emma_19,1,36,And Emma had the advantage of hearing her own silly compliment repeated twice over before the good old lady could comprehend it . ,And Emma had the advantage of hearing her own silly compliment repeated twice over before the good old lady could comprehend it . 
emma_19,1,37,"She was pondering , in the meanwhile , upon the possibility , without seeming very rude , of making her escape from Jane Fairfax 's letter , and had almost resolved on hurrying away directly under some slight excuse , when Miss Bates turned to her again and seized her attention . "" My mother 's deafness is very trifling you see -- just nothing at all . ","She was pondering , in the meanwhile , upon the possibility , without seeming very rude , of making her escape from Jane Fairfax 's letter , and had almost resolved on hurrying away directly under some slight excuse , when Miss Bates turned to her again and seized her attention . "" My mother 's deafness is very trifling you see -- just nothing at all . "
emma_19,1,38,"By only raising my voice , and saying any thing two or three times over , she is sure to hear ; but then she is used to my voice . ","By only raising my voice , and saying any thing two or three times over , she is sure to hear ; but then she is used to my voice . "
emma_19,1,39,But it is very remarkable that she should always hear Jane better than she does me . Jane speaks so distinct ! ,But it is very remarkable that she should always hear Jane better than she does me . Jane speaks so distinct ! 
emma_19,1,40,"However , she will not find her grandmama at all deafer than she was two years ago ; which is saying a great deal at my mother 's time of life -- and it really is full two years , you know , since she was here . We never were so long without seeing her before , and as I was telling Mrs. Cole , we shall hardly know how to make enough of her now . "" ","However , she will not find her grandmama at all deafer than she was two years ago ; which is saying a great deal at my mother 's time of life -- and it really is full two years , you know , since she was here . We never were so long without seeing her before , and as I was telling Mrs. Cole , we shall hardly know how to make enough of her now . "" "
emma_19,1,41,""" Are you expecting Miss Fairfax here soon ? "" "" Oh yes ; next week . "" "" Indeed!--that must be a very great pleasure . ",""" Are you expecting Miss Fairfax here soon ? "" "" Oh yes ; next week . "" "" Indeed!--that must be a very great pleasure . "
emma_19,1,42,""" ",""" "
emma_19,1,43,""" Thank you . ",""" Thank you . "
emma_19,1,44,You are very kind . ,You are very kind . 
emma_19,1,45,"Yes , next week . ","Yes , next week . "
emma_19,1,46,Every body is so surprized ; and every body says the same obliging things . ,Every body is so surprized ; and every body says the same obliging things . 
emma_19,1,47,"I am sure she will be as happy to see her friends at Highbury , as they can be to see her . Yes , Friday or Saturday ; she can not say which , because Colonel Campbell will be wanting the carriage himself one of those days . ","I am sure she will be as happy to see her friends at Highbury , as they can be to see her . Yes , Friday or Saturday ; she can not say which , because Colonel Campbell will be wanting the carriage himself one of those days . "
emma_19,1,48,So very good of them to send her the whole way ! ,So very good of them to send her the whole way ! 
emma_19,1,49,"But they always do , you know . ","But they always do , you know . "
emma_19,1,50,"Oh yes , Friday or Saturday next . That is what she writes about . ","Oh yes , Friday or Saturday next . That is what she writes about . "
emma_19,1,51,"That is the reason of her writing out of rule , as we call it ; for , in the common course , we should not have heard from her before next Tuesday or Wednesday . "" "" Yes , so I imagined . ","That is the reason of her writing out of rule , as we call it ; for , in the common course , we should not have heard from her before next Tuesday or Wednesday . "" "" Yes , so I imagined . "
emma_19,1,52,"I was afraid there could be little chance of my hearing any thing of Miss Fairfax to - day . "" "" So obliging of you ! No , we should not have heard , if it had not been for this particular circumstance , of her being to come here so soon . My mother is so delighted!--for she is to be three months with us at least . ","I was afraid there could be little chance of my hearing any thing of Miss Fairfax to - day . "" "" So obliging of you ! No , we should not have heard , if it had not been for this particular circumstance , of her being to come here so soon . My mother is so delighted!--for she is to be three months with us at least . "
emma_19,1,53,"Three months , she says so , positively , as I am going to have the pleasure of reading to you . ","Three months , she says so , positively , as I am going to have the pleasure of reading to you . "
emma_19,1,54,"The case is , you see , that the Campbells are going to Ireland . ","The case is , you see , that the Campbells are going to Ireland . "
emma_19,1,55,Mrs. Dixon has persuaded her father and mother to come over and see her directly . ,Mrs. Dixon has persuaded her father and mother to come over and see her directly . 
emma_19,1,56,"They had not intended to go over till the summer , but she is so impatient to see them again -- for till she married , last October , she was never away from them so much as a week , which must make it very strange to be in different kingdoms , I was going to say , but however different countries , and so she wrote a very urgent letter to her mother -- or her father , I declare I do not know which it was , but we shall see presently in Jane 's letter -- wrote in Mr. Dixon 's name as well as her own , to press their coming over directly , ","They had not intended to go over till the summer , but she is so impatient to see them again -- for till she married , last October , she was never away from them so much as a week , which must make it very strange to be in different kingdoms , I was going to say , but however different countries , and so she wrote a very urgent letter to her mother -- or her father , I declare I do not know which it was , but we shall see presently in Jane 's letter -- wrote in Mr. Dixon 's name as well as her own , to press their coming over directly , "
emma_19,1,57,"and they would give them the meeting in Dublin , and take them back to their country seat , Baly - craig , a beautiful place , I fancy . ","and they would give them the meeting in Dublin , and take them back to their country seat , Baly - craig , a beautiful place , I fancy . "
emma_19,1,58,"Jane has heard a great deal of its beauty ; from Mr. Dixon , I mean-- I do not know that she ever heard about it from any body else ; but it was very natural , you know , that he should like to speak of his own place while he was paying his addresses -- and as Jane used to be very often walking out with them -- for Colonel and Mrs. Campbell were very particular about their daughter 's not walking out often with only Mr. Dixon , for which I do not at all blame them ; of course she heard every thing he might be telling Miss Campbell about his own home in Ireland ; and I think she wrote us word that he had shewn them some drawings of the place , views that he had taken himself . ","Jane has heard a great deal of its beauty ; from Mr. Dixon , I mean-- I do not know that she ever heard about it from any body else ; but it was very natural , you know , that he should like to speak of his own place while he was paying his addresses -- and as Jane used to be very often walking out with them -- for Colonel and Mrs. Campbell were very particular about their daughter 's not walking out often with only Mr. Dixon , for which I do not at all blame them ; of course she heard every thing he might be telling Miss Campbell about his own home in Ireland ; and I think she wrote us word that he had shewn them some drawings of the place , views that he had taken himself . "
emma_19,1,59,"He is a most amiable , charming young man , I believe . ","He is a most amiable , charming young man , I believe . "
emma_19,1,60,"Jane was quite longing to go to Ireland , from his account of things . "" At this moment , an ingenious and animating suspicion entering Emma 's brain with regard to Jane Fairfax , this charming Mr. Dixon , and the not going to Ireland , she said , with the insidious design of farther discovery , "" You must feel it very fortunate that Miss Fairfax should be allowed to come to you at such a time . ","Jane was quite longing to go to Ireland , from his account of things . "" At this moment , an ingenious and animating suspicion entering Emma 's brain with regard to Jane Fairfax , this charming Mr. Dixon , and the not going to Ireland , she said , with the insidious design of farther discovery , "" You must feel it very fortunate that Miss Fairfax should be allowed to come to you at such a time . "
emma_19,1,61,"Considering the very particular friendship between her and Mrs. Dixon , you could hardly have expected her to be excused from accompanying Colonel and Mrs. Campbell . ","Considering the very particular friendship between her and Mrs. Dixon , you could hardly have expected her to be excused from accompanying Colonel and Mrs. Campbell . "
emma_19,1,62,""" ",""" "
emma_19,1,63,""" Very true , very true , indeed . ",""" Very true , very true , indeed . "
emma_19,1,64,"The very thing that we have always been rather afraid of ; for we should not have liked to have her at such a distance from us , for months together -- not able to come if any thing was to happen . ","The very thing that we have always been rather afraid of ; for we should not have liked to have her at such a distance from us , for months together -- not able to come if any thing was to happen . "
emma_19,1,65,"But you see , every thing turns out for the best . ","But you see , every thing turns out for the best . "
emma_19,1,66,"They want her ( Mr. and Mrs. Dixon ) excessively to come over with Colonel and Mrs. Campbell ; quite depend upon it ; nothing can be more kind or pressing than their _ joint _ invitation , Jane says , as you will hear presently ; Mr. Dixon does not seem in the least backward in any attention . He is a most charming young man . ","They want her ( Mr. and Mrs. Dixon ) excessively to come over with Colonel and Mrs. Campbell ; quite depend upon it ; nothing can be more kind or pressing than their _ joint _ invitation , Jane says , as you will hear presently ; Mr. Dixon does not seem in the least backward in any attention . He is a most charming young man . "
