fic_id,chapter_id,para_id,text,text_tokenized
emma_51,1,96,"This proposal of his , this plan of marrying and continuing at Hartfield-- the more she contemplated it , the more pleasing it became . ","This proposal of his , this plan of marrying and continuing at Hartfield-- the more she contemplated it , the more pleasing it became . "
emma_51,1,97,"His evils seemed to lessen , her own advantages to increase , their mutual good to outweigh every drawback . ","His evils seemed to lessen , her own advantages to increase , their mutual good to outweigh every drawback . "
emma_51,1,98,Such a companion for herself in the periods of anxiety and cheerlessness before her!-- Such a partner in all those duties and cares to which time must be giving increase of melancholy ! ,Such a companion for herself in the periods of anxiety and cheerlessness before her!-- Such a partner in all those duties and cares to which time must be giving increase of melancholy ! 
emma_51,1,99,"She would have been too happy but for poor Harriet ; but every blessing of her own seemed to involve and advance the sufferings of her friend , who must now be even excluded from Hartfield . ","She would have been too happy but for poor Harriet ; but every blessing of her own seemed to involve and advance the sufferings of her friend , who must now be even excluded from Hartfield . "
emma_51,1,100,"The delightful family party which Emma was securing for herself , poor Harriet must , in mere charitable caution , be kept at a distance from . ","The delightful family party which Emma was securing for herself , poor Harriet must , in mere charitable caution , be kept at a distance from . "
emma_51,1,101,She would be a loser in every way . ,She would be a loser in every way . 
emma_51,1,102,Emma could not deplore her future absence as any deduction from her own enjoyment . ,Emma could not deplore her future absence as any deduction from her own enjoyment . 
emma_51,1,103,"In such a party , Harriet would be rather a dead weight than otherwise ; but for the poor girl herself , it seemed a peculiarly cruel necessity that was to be placing her in such a state of unmerited punishment . ","In such a party , Harriet would be rather a dead weight than otherwise ; but for the poor girl herself , it seemed a peculiarly cruel necessity that was to be placing her in such a state of unmerited punishment . "
emma_51,1,104,"In time , of course , Mr. Knightley would be forgotten , that is , supplanted ; but this could not be expected to happen very early . ","In time , of course , Mr. Knightley would be forgotten , that is , supplanted ; but this could not be expected to happen very early . "
emma_51,1,105,Mr. Knightley himself would be doing nothing to assist the cure;-- not like Mr. Elton . ,Mr. Knightley himself would be doing nothing to assist the cure;-- not like Mr. Elton . 
emma_51,1,106,"Mr. Knightley , always so kind , so feeling , so truly considerate for every body , would never deserve to be less worshipped than now ; and it really was too much to hope even of Harriet , that she could be in love with more than _ three _ men in one year . ","Mr. Knightley , always so kind , so feeling , so truly considerate for every body , would never deserve to be less worshipped than now ; and it really was too much to hope even of Harriet , that she could be in love with more than _ three _ men in one year . "
