fic_id,chapter_id,para_id,text,text_tokenized
emma_8,1,96,"Robert Martin would never have proceeded so far , if he had not felt persuaded of her not being disinclined to him . ","Robert Martin would never have proceeded so far , if he had not felt persuaded of her not being disinclined to him . "
emma_8,1,97,I know him well . He has too much real feeling to address any woman on the haphazard of selfish passion . ,I know him well . He has too much real feeling to address any woman on the haphazard of selfish passion . 
emma_8,1,98,"And as to conceit , he is the farthest from it of any man I know . ","And as to conceit , he is the farthest from it of any man I know . "
emma_8,1,99,Depend upon it he had encouragement . ,Depend upon it he had encouragement . 
emma_8,1,100,""" It was most convenient to Emma not to make a direct reply to this assertion ; she chose rather to take up her own line of the subject again . "" ",""" It was most convenient to Emma not to make a direct reply to this assertion ; she chose rather to take up her own line of the subject again . "" "
emma_8,1,101,"You are a very warm friend to Mr. Martin ; but , as I said before , are unjust to Harriet . ","You are a very warm friend to Mr. Martin ; but , as I said before , are unjust to Harriet . "
emma_8,1,102,"Harriet 's claims to marry well are not so contemptible as you represent them . She is not a clever girl , but she has better sense than you are aware of , and does not deserve to have her understanding spoken of so slightingly . Waiving that point , however , and supposing her to be , as you describe her , only pretty and good - natured , let me tell you , that in the degree she possesses them , they are not trivial recommendations to the world in general , for she is , in fact , a beautiful girl , and must be thought so by ninety - nine people out of an hundred ; and till it appears that men are much more philosophic on the subject of beauty than they are generally supposed ; till they do fall in love with well - informed minds instead of handsome faces , a girl , with such loveliness as Harriet , has a certainty of being admired and sought after , of having the power of chusing from among many , consequently a claim to be nice . Her good - nature , too , is not so very slight a claim , comprehending , as it does , real , thorough sweetness of temper and manner , a very humble opinion of herself , and a great readiness to be pleased with other people . I am very much mistaken if your sex in general would not think such beauty , and such temper , the highest claims a woman could possess . ","Harriet 's claims to marry well are not so contemptible as you represent them . She is not a clever girl , but she has better sense than you are aware of , and does not deserve to have her understanding spoken of so slightingly . Waiving that point , however , and supposing her to be , as you describe her , only pretty and good - natured , let me tell you , that in the degree she possesses them , they are not trivial recommendations to the world in general , for she is , in fact , a beautiful girl , and must be thought so by ninety - nine people out of an hundred ; and till it appears that men are much more philosophic on the subject of beauty than they are generally supposed ; till they do fall in love with well - informed minds instead of handsome faces , a girl , with such loveliness as Harriet , has a certainty of being admired and sought after , of having the power of chusing from among many , consequently a claim to be nice . Her good - nature , too , is not so very slight a claim , comprehending , as it does , real , thorough sweetness of temper and manner , a very humble opinion of herself , and a great readiness to be pleased with other people . I am very much mistaken if your sex in general would not think such beauty , and such temper , the highest claims a woman could possess . "
emma_8,1,103,""" ",""" "
emma_8,1,104,""" Upon my word , Emma , to hear you abusing the reason you have , is almost enough to make me think so too . ",""" Upon my word , Emma , to hear you abusing the reason you have , is almost enough to make me think so too . "
emma_8,1,105,"Better be without sense , than misapply it as you do . ","Better be without sense , than misapply it as you do . "
emma_8,1,106,""" "" To be sure ! "" cried she playfully . ",""" "" To be sure ! "" cried she playfully . "
emma_8,1,107,""" I know _ that _ is the feeling of you all . ",""" I know _ that _ is the feeling of you all . "
emma_8,1,108,I know that such a girl as Harriet is exactly what every man delights in -- what at once bewitches his senses and satisfies his judgment . ,I know that such a girl as Harriet is exactly what every man delights in -- what at once bewitches his senses and satisfies his judgment . 
emma_8,1,109,Oh ! ,Oh ! 
emma_8,1,110,Harriet may pick and chuse . ,Harriet may pick and chuse . 
emma_8,1,111,"Were you , yourself , ever to marry , she is the very woman for you . ","Were you , yourself , ever to marry , she is the very woman for you . "
emma_8,1,112,"And is she , at seventeen , just entering into life , just beginning to be known , to be wondered at because she does not accept the first offer she receives ? ","And is she , at seventeen , just entering into life , just beginning to be known , to be wondered at because she does not accept the first offer she receives ? "
emma_8,1,113,No -- pray let her have time to look about her . ,No -- pray let her have time to look about her . 
emma_8,1,114,""" "" I have always thought it a very foolish intimacy , "" said Mr. Knightley presently , "" though I have kept my thoughts to myself ; but I now perceive that it will be a very unfortunate one for Harriet . ",""" "" I have always thought it a very foolish intimacy , "" said Mr. Knightley presently , "" though I have kept my thoughts to myself ; but I now perceive that it will be a very unfortunate one for Harriet . "
emma_8,1,115,"You will puff her up with such ideas of her own beauty , and of what she has a claim to , that , in a little while , nobody within her reach will be good enough for her . ","You will puff her up with such ideas of her own beauty , and of what she has a claim to , that , in a little while , nobody within her reach will be good enough for her . "
emma_8,1,116,"Vanity working on a weak head , produces every sort of mischief . ","Vanity working on a weak head , produces every sort of mischief . "
emma_8,1,117,Nothing so easy as for a young lady to raise her expectations too high . ,Nothing so easy as for a young lady to raise her expectations too high . 
emma_8,1,118,"Miss Harriet Smith may not find offers of marriage flow in so fast , though she is a very pretty girl . ","Miss Harriet Smith may not find offers of marriage flow in so fast , though she is a very pretty girl . "
emma_8,1,119,"Men of sense , whatever you may chuse to say , do not want silly wives . ","Men of sense , whatever you may chuse to say , do not want silly wives . "
emma_8,1,120,"Men of family would not be very fond of connecting themselves with a girl of such obscurity -- and most prudent men would be afraid of the inconvenience and disgrace they might be involved in , when the mystery of her parentage came to be revealed . Let her marry Robert Martin , and she is safe , respectable , and happy for ever ; but if you encourage her to expect to marry greatly , and teach her to be satisfied with nothing less than a man of consequence and large fortune , she may be a parlour - boarder at Mrs. Goddard 's all the rest of her life -- or , at least , ( for Harriet Smith is a girl who will marry somebody or other , ) till she grow desperate , and is glad to catch at the old writing - master 's son . ","Men of family would not be very fond of connecting themselves with a girl of such obscurity -- and most prudent men would be afraid of the inconvenience and disgrace they might be involved in , when the mystery of her parentage came to be revealed . Let her marry Robert Martin , and she is safe , respectable , and happy for ever ; but if you encourage her to expect to marry greatly , and teach her to be satisfied with nothing less than a man of consequence and large fortune , she may be a parlour - boarder at Mrs. Goddard 's all the rest of her life -- or , at least , ( for Harriet Smith is a girl who will marry somebody or other , ) till she grow desperate , and is glad to catch at the old writing - master 's son . "
emma_8,1,121,""" ",""" "
emma_8,1,122,""" We think so very differently on this point , Mr. Knightley , that there can be no use in canvassing it . ",""" We think so very differently on this point , Mr. Knightley , that there can be no use in canvassing it . "
emma_8,1,123,We shall only be making each other more angry . ,We shall only be making each other more angry . 
emma_8,1,124,"But as to my _ letting _ her marry Robert Martin , it is impossible ; she has refused him , and so decidedly , I think , as must prevent any second application . ","But as to my _ letting _ her marry Robert Martin , it is impossible ; she has refused him , and so decidedly , I think , as must prevent any second application . "
emma_8,1,125,"She must abide by the evil of having refused him , whatever it may be ; and as to the refusal itself , I will not pretend to say that I might not influence her a little ; but I assure you there was very little for me or for any body to do . ","She must abide by the evil of having refused him , whatever it may be ; and as to the refusal itself , I will not pretend to say that I might not influence her a little ; but I assure you there was very little for me or for any body to do . "
emma_8,1,126,"His appearance is so much against him , and his manner so bad , that if she ever were disposed to favour him , she is not now . ","His appearance is so much against him , and his manner so bad , that if she ever were disposed to favour him , she is not now . "
emma_8,1,127,"I can imagine , that before she had seen any body superior , she might tolerate him . He was the brother of her friends , and he took pains to please her ; and altogether , having seen nobody better ( that must have been his great assistant ) she might not , while she was at Abbey - Mill , find him disagreeable . ","I can imagine , that before she had seen any body superior , she might tolerate him . He was the brother of her friends , and he took pains to please her ; and altogether , having seen nobody better ( that must have been his great assistant ) she might not , while she was at Abbey - Mill , find him disagreeable . "
emma_8,1,128,But the case is altered now . ,But the case is altered now . 
emma_8,1,129,She knows now what gentlemen are ; and nothing but a gentleman in education and manner has any chance with Harriet . ,She knows now what gentlemen are ; and nothing but a gentleman in education and manner has any chance with Harriet . 
emma_8,1,130,""" "" Nonsense , errant nonsense , as ever was talked ! "" cried Mr. Knightley.--""Robert Martin 's manners have sense , sincerity , and good - humour to recommend them ; and his mind has more true gentility than Harriet Smith could understand . ",""" "" Nonsense , errant nonsense , as ever was talked ! "" cried Mr. Knightley.--""Robert Martin 's manners have sense , sincerity , and good - humour to recommend them ; and his mind has more true gentility than Harriet Smith could understand . "
emma_8,1,131,""" ",""" "
emma_8,1,132,"Emma made no answer , and tried to look cheerfully unconcerned , but was really feeling uncomfortable and wanting him very much to be gone . ","Emma made no answer , and tried to look cheerfully unconcerned , but was really feeling uncomfortable and wanting him very much to be gone . "
emma_8,1,133,"She did not repent what she had done ; she still thought herself a better judge of such a point of female right and refinement than he could be ; but yet she had a sort of habitual respect for his judgment in general , which made her dislike having it so loudly against her ; and to have him sitting just opposite to her in angry state , was very disagreeable . ","She did not repent what she had done ; she still thought herself a better judge of such a point of female right and refinement than he could be ; but yet she had a sort of habitual respect for his judgment in general , which made her dislike having it so loudly against her ; and to have him sitting just opposite to her in angry state , was very disagreeable . "
emma_8,1,134,"Some minutes passed in this unpleasant silence , with only one attempt on Emma 's side to talk of the weather , but he made no answer . ","Some minutes passed in this unpleasant silence , with only one attempt on Emma 's side to talk of the weather , but he made no answer . "
emma_8,1,135,He was thinking . ,He was thinking . 
emma_8,1,136,The result of his thoughts appeared at last in these words . ,The result of his thoughts appeared at last in these words . 
emma_8,1,137,""" Robert Martin has no great loss -- if he can but think so ; and I hope it will not be long before he does . ",""" Robert Martin has no great loss -- if he can but think so ; and I hope it will not be long before he does . "
emma_8,1,138,"Your views for Harriet are best known to yourself ; but as you make no secret of your love of match - making , it is fair to suppose that views , and plans , and projects you have;--and as a friend I shall just hint to you that if Elton is the man , I think it will be all labour in vain . "" Emma laughed and disclaimed . ","Your views for Harriet are best known to yourself ; but as you make no secret of your love of match - making , it is fair to suppose that views , and plans , and projects you have;--and as a friend I shall just hint to you that if Elton is the man , I think it will be all labour in vain . "" Emma laughed and disclaimed . "
emma_8,1,139,"He continued , "" Depend upon it , Elton will not do . ","He continued , "" Depend upon it , Elton will not do . "
emma_8,1,140,"Elton is a very good sort of man , and a very respectable vicar of Highbury , but not at all likely to make an imprudent match . He knows the value of a good income as well as any body . ","Elton is a very good sort of man , and a very respectable vicar of Highbury , but not at all likely to make an imprudent match . He knows the value of a good income as well as any body . "
emma_8,1,141,"Elton may talk sentimentally , but he will act rationally . ","Elton may talk sentimentally , but he will act rationally . "
emma_8,1,142,"He is as well acquainted with his own claims , as you can be with Harriet 's . ","He is as well acquainted with his own claims , as you can be with Harriet 's . "
emma_8,1,143,"He knows that he is a very handsome young man , and a great favourite wherever he goes ; and from his general way of talking in unreserved moments , when there are only men present , I am convinced that he does not mean to throw himself away . ","He knows that he is a very handsome young man , and a great favourite wherever he goes ; and from his general way of talking in unreserved moments , when there are only men present , I am convinced that he does not mean to throw himself away . "
emma_8,1,144,"I have heard him speak with great animation of a large family of young ladies that his sisters are intimate with , who have all twenty thousand pounds apiece . ","I have heard him speak with great animation of a large family of young ladies that his sisters are intimate with , who have all twenty thousand pounds apiece . "
emma_8,1,145,""" "" I am very much obliged to you , "" said Emma , laughing again . ",""" "" I am very much obliged to you , "" said Emma , laughing again . "
emma_8,1,146,""" If I had set my heart on Mr. Elton 's marrying Harriet , it would have been very kind to open my eyes ; but at present I only want to keep Harriet to myself . ",""" If I had set my heart on Mr. Elton 's marrying Harriet , it would have been very kind to open my eyes ; but at present I only want to keep Harriet to myself . "
emma_8,1,147,I have done with match - making indeed . ,I have done with match - making indeed . 
emma_8,1,148,I could never hope to equal my own doings at Randalls . I shall leave off while I am well . ,I could never hope to equal my own doings at Randalls . I shall leave off while I am well . 
emma_8,1,149,""" ",""" "
emma_8,1,150,""" Good morning to you,""--said he , rising and walking off abruptly . ",""" Good morning to you,""--said he , rising and walking off abruptly . "
emma_8,1,151,He was very much vexed . ,He was very much vexed . 
emma_8,1,152,"He felt the disappointment of the young man , and was mortified to have been the means of promoting it , by the sanction he had given ; and the part which he was persuaded Emma had taken in the affair , was provoking him exceedingly . ","He felt the disappointment of the young man , and was mortified to have been the means of promoting it , by the sanction he had given ; and the part which he was persuaded Emma had taken in the affair , was provoking him exceedingly . "
emma_8,1,153,"Emma remained in a state of vexation too ; but there was more indistinctness in the causes of her 's , than in his . ","Emma remained in a state of vexation too ; but there was more indistinctness in the causes of her 's , than in his . "
emma_8,1,154,"She did not always feel so absolutely satisfied with herself , so entirely convinced that her opinions were right and her adversary 's wrong , as Mr. Knightley . ","She did not always feel so absolutely satisfied with herself , so entirely convinced that her opinions were right and her adversary 's wrong , as Mr. Knightley . "
emma_8,1,155,He walked off in more complete self - approbation than he left for her . ,He walked off in more complete self - approbation than he left for her . 
emma_8,1,156,"She was not so materially cast down , however , but that a little time and the return of Harriet were very adequate restoratives . ","She was not so materially cast down , however , but that a little time and the return of Harriet were very adequate restoratives . "
emma_8,1,157,"Harriet 's staying away so long was beginning to make her uneasy . The possibility of the young man 's coming to Mrs. Goddard 's that morning , and meeting with Harriet and pleading his own cause , gave alarming ideas . The dread of such a failure after all became the prominent uneasiness ","Harriet 's staying away so long was beginning to make her uneasy . The possibility of the young man 's coming to Mrs. Goddard 's that morning , and meeting with Harriet and pleading his own cause , gave alarming ideas . The dread of such a failure after all became the prominent uneasiness "
emma_8,1,158,; ,; 
emma_8,1,159,and ,and 
emma_8,1,160,"when Harriet appeared , and in very good spirits , and without having any such reason to give for her long absence , she felt a satisfaction which settled her with her own mind , and convinced her , that let Mr. Knightley think or say what he would , ","when Harriet appeared , and in very good spirits , and without having any such reason to give for her long absence , she felt a satisfaction which settled her with her own mind , and convinced her , that let Mr. Knightley think or say what he would , "
emma_8,1,161,she ,she 
emma_8,1,162,had done nothing which woman 's friendship and woman 's feelings would not justify . ,had done nothing which woman 's friendship and woman 's feelings would not justify . 
emma_8,1,163,"He had frightened her a little about Mr. Elton ; but when she considered that Mr. Knightley could not have observed him as she had done , neither with the interest , nor ( she must be allowed to tell herself , in spite of Mr. Knightley 's pretensions ) with the skill of such an observer on such a question as herself , that he had spoken it hastily and in anger , she was able to believe , that he had rather said what he wished resentfully to be true , than what he knew any thing about . ","He had frightened her a little about Mr. Elton ; but when she considered that Mr. Knightley could not have observed him as she had done , neither with the interest , nor ( she must be allowed to tell herself , in spite of Mr. Knightley 's pretensions ) with the skill of such an observer on such a question as herself , that he had spoken it hastily and in anger , she was able to believe , that he had rather said what he wished resentfully to be true , than what he knew any thing about . "
emma_8,1,164,"He certainly might have heard Mr. Elton speak with more unreserve than she had ever done , and Mr. Elton might not be of an imprudent , inconsiderate disposition as to money matters ; he might naturally be rather attentive than otherwise to them ; but then , Mr. Knightley did not make due allowance for the influence of a strong passion at war with all interested motives . ","He certainly might have heard Mr. Elton speak with more unreserve than she had ever done , and Mr. Elton might not be of an imprudent , inconsiderate disposition as to money matters ; he might naturally be rather attentive than otherwise to them ; but then , Mr. Knightley did not make due allowance for the influence of a strong passion at war with all interested motives . "
emma_8,1,165,"Mr. Knightley saw no such passion , and of course thought nothing of its effects ; but she saw too much of it to feel a doubt of its overcoming any hesitations that a reasonable prudence might originally suggest ; and more than a reasonable , becoming degree of prudence , she was very sure did not belong to Mr. Elton . ","Mr. Knightley saw no such passion , and of course thought nothing of its effects ; but she saw too much of it to feel a doubt of its overcoming any hesitations that a reasonable prudence might originally suggest ; and more than a reasonable , becoming degree of prudence , she was very sure did not belong to Mr. Elton . "
emma_8,1,166,"Harriet 's cheerful look and manner established hers : she came back , not to think of Mr. Martin , but to talk of Mr. Elton . Miss Nash had been telling her something , which she repeated immediately with great delight . ","Harriet 's cheerful look and manner established hers : she came back , not to think of Mr. Martin , but to talk of Mr. Elton . Miss Nash had been telling her something , which she repeated immediately with great delight . "
emma_8,1,167,"Mr. Perry had been to Mrs. Goddard 's to attend a sick child , and Miss Nash had seen him , and he had told Miss Nash , that as he was coming back yesterday from Clayton Park , he had met Mr. Elton , and found to his great surprize , that Mr. Elton was actually on his road to London , and not meaning to return till the morrow , though it was the whist - club night , which he had been never known to miss before ; and Mr. Perry had remonstrated with him about it , and told him how shabby it was in him , their best player , to absent himself , and tried very much to persuade him to put off his journey only one day ; but it would not do ; ","Mr. Perry had been to Mrs. Goddard 's to attend a sick child , and Miss Nash had seen him , and he had told Miss Nash , that as he was coming back yesterday from Clayton Park , he had met Mr. Elton , and found to his great surprize , that Mr. Elton was actually on his road to London , and not meaning to return till the morrow , though it was the whist - club night , which he had been never known to miss before ; and Mr. Perry had remonstrated with him about it , and told him how shabby it was in him , their best player , to absent himself , and tried very much to persuade him to put off his journey only one day ; but it would not do ; "
emma_8,1,168,"Mr. Elton had been determined to go on , and had said in a _ very _ _ particular _ way indeed , that he was going on business which he would not put off for any inducement in the world ; and something about a very enviable commission , and being the bearer of something exceedingly precious . ","Mr. Elton had been determined to go on , and had said in a _ very _ _ particular _ way indeed , that he was going on business which he would not put off for any inducement in the world ; and something about a very enviable commission , and being the bearer of something exceedingly precious . "
emma_8,1,169,"Mr. Perry could not quite understand him , but he was very sure there must ","Mr. Perry could not quite understand him , but he was very sure there must "
emma_8,1,170,be a _ lady _ in the case ,be a _ lady _ in the case 
emma_8,1,171,", ",", "
emma_8,1,172,and ,and 
emma_8,1,173,"he told him so ; and Mr. Elton only looked very conscious and smiling , and rode off in great spirits . ","he told him so ; and Mr. Elton only looked very conscious and smiling , and rode off in great spirits . "
emma_8,1,174,"Miss Nash had told her all this , and had talked a great deal more about Mr. Elton ; and said , looking so very significantly at her , "" that she did not pretend to understand what his business might be , but she only knew that any woman whom Mr. Elton could prefer , she should think the luckiest woman in the world ; for , beyond a doubt , Mr. Elton had not his equal for beauty or agreeableness . "" ","Miss Nash had told her all this , and had talked a great deal more about Mr. Elton ; and said , looking so very significantly at her , "" that she did not pretend to understand what his business might be , but she only knew that any woman whom Mr. Elton could prefer , she should think the luckiest woman in the world ; for , beyond a doubt , Mr. Elton had not his equal for beauty or agreeableness . "" "
