fic_id,chapter_id,para_id,text,text_tokenized
emma_32,1,84,"She restrained herself , however , from any of the reproofs she could have given , and only thanked Mrs. Elton coolly ; "" but their going to Bath was quite out of the question ; and she was not perfectly convinced that the place might suit her better than her father . ","She restrained herself , however , from any of the reproofs she could have given , and only thanked Mrs. Elton coolly ; "" but their going to Bath was quite out of the question ; and she was not perfectly convinced that the place might suit her better than her father . "
emma_32,1,85,""" ",""" "
emma_32,1,86,"And then , to prevent farther outrage and indignation , changed the subject directly . "" ","And then , to prevent farther outrage and indignation , changed the subject directly . "" "
emma_32,1,87,"I do not ask whether you are musical , Mrs. Elton . ","I do not ask whether you are musical , Mrs. Elton . "
emma_32,1,88,"Upon these occasions , a lady 's character generally precedes her ; and Highbury has long known that you are a superior performer . "" ","Upon these occasions , a lady 's character generally precedes her ; and Highbury has long known that you are a superior performer . "" "
emma_32,1,89,""" Oh ! no , indeed ; I must protest against any such idea . ",""" Oh ! no , indeed ; I must protest against any such idea . "
emma_32,1,90,"A superior performer!--very far from it , I assure you . ","A superior performer!--very far from it , I assure you . "
emma_32,1,91,Consider from how partial a quarter your information came . ,Consider from how partial a quarter your information came . 
emma_32,1,92,"I am doatingly fond of music -- passionately fond;--and my friends say I am not entirely devoid of taste ; but as to any thing else , upon my honour my performance is _ mediocre _ to the last degree . You , Miss Woodhouse , I well know , play delightfully . I assure you it has been the greatest satisfaction , comfort , and delight to me , to hear what a musical society I am got into . ","I am doatingly fond of music -- passionately fond;--and my friends say I am not entirely devoid of taste ; but as to any thing else , upon my honour my performance is _ mediocre _ to the last degree . You , Miss Woodhouse , I well know , play delightfully . I assure you it has been the greatest satisfaction , comfort , and delight to me , to hear what a musical society I am got into . "
emma_32,1,93,I absolutely can not do without music . ,I absolutely can not do without music . 
emma_32,1,94,"It is a necessary of life to me ; and having always been used to a very musical society , both at Maple Grove and in Bath , it would have been a most serious sacrifice . ","It is a necessary of life to me ; and having always been used to a very musical society , both at Maple Grove and in Bath , it would have been a most serious sacrifice . "
emma_32,1,95,"I honestly said as much to Mr. E. when he was speaking of my future home , and expressing his fears lest the retirement of it should be disagreeable ; and the inferiority of the house too -- knowing what I had been accustomed to -- of course he was not wholly without apprehension . When he was speaking of it in that way , I honestly said that _ the _ _ world _ I could give up -- parties , balls , plays -- for I had no fear of retirement . Blessed with so many resources within myself , the world was not necessary to _ me _ . ","I honestly said as much to Mr. E. when he was speaking of my future home , and expressing his fears lest the retirement of it should be disagreeable ; and the inferiority of the house too -- knowing what I had been accustomed to -- of course he was not wholly without apprehension . When he was speaking of it in that way , I honestly said that _ the _ _ world _ I could give up -- parties , balls , plays -- for I had no fear of retirement . Blessed with so many resources within myself , the world was not necessary to _ me _ . "
emma_32,1,96,I could do very well without it . ,I could do very well without it . 
emma_32,1,97,To those who had no resources it was a different thing ; but my resources made me quite independent . ,To those who had no resources it was a different thing ; but my resources made me quite independent . 
emma_32,1,98,"And as to smaller - sized rooms than I had been used to , I really could not give it a thought . ","And as to smaller - sized rooms than I had been used to , I really could not give it a thought . "
emma_32,1,99,I hoped I was perfectly equal to any sacrifice of that description . ,I hoped I was perfectly equal to any sacrifice of that description . 
emma_32,1,100,"Certainly I had been accustomed to every luxury at Maple Grove ; but I did assure him that two carriages were not necessary to my happiness , nor were spacious apartments . ","Certainly I had been accustomed to every luxury at Maple Grove ; but I did assure him that two carriages were not necessary to my happiness , nor were spacious apartments . "
emma_32,1,101,"` But , ' said I , ` to be quite honest , I do not think I can live without something of a musical society . I condition for nothing else ; but without music , life would be a blank to me . ' ","` But , ' said I , ` to be quite honest , I do not think I can live without something of a musical society . I condition for nothing else ; but without music , life would be a blank to me . ' "
emma_32,1,102,""" ",""" "
emma_32,1,103,""" We can not suppose , "" said Emma , smiling , "" that Mr. Elton would hesitate to assure you of there being a _ very _ musical society in Highbury ; and I hope you will not find he has outstepped the truth more than may be pardoned , in consideration of the motive . ",""" We can not suppose , "" said Emma , smiling , "" that Mr. Elton would hesitate to assure you of there being a _ very _ musical society in Highbury ; and I hope you will not find he has outstepped the truth more than may be pardoned , in consideration of the motive . "
emma_32,1,104,""" ",""" "
emma_32,1,105,""" No , indeed , I have no doubts at all on that head . ",""" No , indeed , I have no doubts at all on that head . "
emma_32,1,106,I am delighted to find myself in such a circle . ,I am delighted to find myself in such a circle . 
emma_32,1,107,I hope we shall have many sweet little concerts together . ,I hope we shall have many sweet little concerts together . 
emma_32,1,108,"I think , Miss Woodhouse , you and I must establish a musical club , and have regular weekly meetings at your house , or ours . Will not it be a good plan ? ","I think , Miss Woodhouse , you and I must establish a musical club , and have regular weekly meetings at your house , or ours . Will not it be a good plan ? "
emma_32,1,109,"If _ we _ exert ourselves , I think we shall not be long in want of allies . ","If _ we _ exert ourselves , I think we shall not be long in want of allies . "
emma_32,1,110,"Something of that nature would be particularly desirable for _ me _ , as an inducement to keep me in practice ; for married women , you know-- there is a sad story against them , in general . ","Something of that nature would be particularly desirable for _ me _ , as an inducement to keep me in practice ; for married women , you know-- there is a sad story against them , in general . "
emma_32,1,111,They are but too apt to give up music . ,They are but too apt to give up music . 
emma_32,1,112,""" "" But you , who are so extremely fond of it -- there can be no danger , surely ? ",""" "" But you , who are so extremely fond of it -- there can be no danger , surely ? "
emma_32,1,113,""" ",""" "
emma_32,1,114,""" I should hope not ; but really when I look around among my acquaintance , I tremble . ",""" I should hope not ; but really when I look around among my acquaintance , I tremble . "
emma_32,1,115,Selina has entirely given up music -- never touches the instrument -- though she played sweetly . ,Selina has entirely given up music -- never touches the instrument -- though she played sweetly . 
emma_32,1,116,"And the same may be said of Mrs. Jeffereys -- Clara Partridge , that was -- and of the two Milmans , now Mrs. Bird and Mrs. James Cooper ; and of more than I can enumerate . ","And the same may be said of Mrs. Jeffereys -- Clara Partridge , that was -- and of the two Milmans , now Mrs. Bird and Mrs. James Cooper ; and of more than I can enumerate . "
emma_32,1,117,"Upon my word it is enough to put one in a fright . I used to be quite angry with Selina ; but really I begin now to comprehend that a married woman has many things to call her attention . I believe I was half an hour this morning shut up with my housekeeper . "" "" But every thing of that kind , "" said Emma , "" will soon be in so regular a train-- "" "" Well , "" said Mrs. Elton , laughing , "" we shall see . "" ","Upon my word it is enough to put one in a fright . I used to be quite angry with Selina ; but really I begin now to comprehend that a married woman has many things to call her attention . I believe I was half an hour this morning shut up with my housekeeper . "" "" But every thing of that kind , "" said Emma , "" will soon be in so regular a train-- "" "" Well , "" said Mrs. Elton , laughing , "" we shall see . "" "
emma_32,1,118,"Emma , finding her so determined upon neglecting her music , had nothing more to say ; and , after a moment 's pause , Mrs. Elton chose another subject . ","Emma , finding her so determined upon neglecting her music , had nothing more to say ; and , after a moment 's pause , Mrs. Elton chose another subject . "
emma_32,1,119,""" We have been calling at Randalls , "" said she , "" and found them both at home ; and very pleasant people they seem to be . ",""" We have been calling at Randalls , "" said she , "" and found them both at home ; and very pleasant people they seem to be . "
emma_32,1,120,I like them extremely . ,I like them extremely . 
emma_32,1,121,"Mr. Weston seems an excellent creature-- quite a first - rate favourite with me already , I assure you . ","Mr. Weston seems an excellent creature-- quite a first - rate favourite with me already , I assure you . "
emma_32,1,122,"And _ she _ appears so truly good -- there is something so motherly and kind - hearted about her , that it wins upon one directly . ","And _ she _ appears so truly good -- there is something so motherly and kind - hearted about her , that it wins upon one directly . "
emma_32,1,123,"She was your governess , I think ? "" ","She was your governess , I think ? "" "
emma_32,1,124,Emma was almost too much astonished to answer ; but Mrs. Elton hardly waited for the affirmative before she went on . ,Emma was almost too much astonished to answer ; but Mrs. Elton hardly waited for the affirmative before she went on . 
emma_32,1,125,""" Having understood as much , I was rather astonished to find her so very lady - like ! ",""" Having understood as much , I was rather astonished to find her so very lady - like ! "
emma_32,1,126,"But she is really quite the gentlewoman . "" ","But she is really quite the gentlewoman . "" "
emma_32,1,127,""" Mrs. Weston 's manners , "" said Emma , "" were always particularly good . ",""" Mrs. Weston 's manners , "" said Emma , "" were always particularly good . "
emma_32,1,128,"Their propriety , simplicity , and elegance , would make them the safest model for any young woman . "" "" And who do you think came in while we were there ? "" Emma was quite at a loss . The tone implied some old acquaintance-- and how could she possibly guess ? "" Knightley ! "" continued Mrs. Elton ; "" Knightley himself!--Was not it lucky?--for , not being within when he called the other day , I had never seen him before ; and of course , as so particular a friend of Mr. E. 's , I had a great curiosity . ","Their propriety , simplicity , and elegance , would make them the safest model for any young woman . "" "" And who do you think came in while we were there ? "" Emma was quite at a loss . The tone implied some old acquaintance-- and how could she possibly guess ? "" Knightley ! "" continued Mrs. Elton ; "" Knightley himself!--Was not it lucky?--for , not being within when he called the other day , I had never seen him before ; and of course , as so particular a friend of Mr. E. 's , I had a great curiosity . "
emma_32,1,129,"` My friend Knightley ' had been so often mentioned , that I was really impatient to see him ; and I must do my caro sposo the justice to say that he need not be ashamed of his friend . ","` My friend Knightley ' had been so often mentioned , that I was really impatient to see him ; and I must do my caro sposo the justice to say that he need not be ashamed of his friend . "
emma_32,1,130,Knightley is quite the gentleman . ,Knightley is quite the gentleman . 
emma_32,1,131,I like him very much . ,I like him very much . 
emma_32,1,132,"Decidedly , I think , a very gentleman - like man . ","Decidedly , I think , a very gentleman - like man . "
emma_32,1,133,""" Happily , it was now time to be gone . ",""" Happily , it was now time to be gone . "
emma_32,1,134,They were off ; and Emma could breathe . ,They were off ; and Emma could breathe . 
emma_32,1,135,""" Insufferable woman ! "" was her immediate exclamation . ",""" Insufferable woman ! "" was her immediate exclamation . "
emma_32,1,136,""" Worse than I had supposed . ",""" Worse than I had supposed . "
emma_32,1,137,Absolutely insufferable ! ,Absolutely insufferable ! 
emma_32,1,138,Knightley!--I could not have believed it . ,Knightley!--I could not have believed it . 
emma_32,1,139,"Knightley!--never seen him in her life before , and call him Knightley!--and discover that he is a gentleman ! ","Knightley!--never seen him in her life before , and call him Knightley!--and discover that he is a gentleman ! "
emma_32,1,140,"A little upstart , vulgar being , with her Mr. E. , and her _ caro _ _ sposo _ , and her resources , and all her airs of pert pretension and underbred finery . ","A little upstart , vulgar being , with her Mr. E. , and her _ caro _ _ sposo _ , and her resources , and all her airs of pert pretension and underbred finery . "
emma_32,1,141,Actually to discover that Mr. Knightley is a gentleman ! ,Actually to discover that Mr. Knightley is a gentleman ! 
emma_32,1,142,"I doubt whether he will return the compliment , and discover her to be a lady . ","I doubt whether he will return the compliment , and discover her to be a lady . "
emma_32,1,143,I could not have believed it ! ,I could not have believed it ! 
emma_32,1,144,And to propose that she and I should unite to form a musical club ! ,And to propose that she and I should unite to form a musical club ! 
emma_32,1,145,One would fancy we were bosom friends ! ,One would fancy we were bosom friends ! 
emma_32,1,146,And Mrs. Weston!-- Astonished that the person who had brought me up should be a gentlewoman ! Worse and worse . ,And Mrs. Weston!-- Astonished that the person who had brought me up should be a gentlewoman ! Worse and worse . 
emma_32,1,147,I never met with her equal . ,I never met with her equal . 
emma_32,1,148,Much beyond my hopes . ,Much beyond my hopes . 
emma_32,1,149,Harriet is disgraced by any comparison . ,Harriet is disgraced by any comparison . 
emma_32,1,150,Oh ! ,Oh ! 
emma_32,1,151,"what would Frank Churchill say to her , if he were here ? ","what would Frank Churchill say to her , if he were here ? "
emma_32,1,152,How angry and how diverted he would be ! ,How angry and how diverted he would be ! 
emma_32,1,153,Ah ! ,Ah ! 
emma_32,1,154,there I am-- thinking of him directly ,there I am-- thinking of him directly 
emma_32,1,155,. ,. 
emma_32,1,156,Always the first person to be thought of ! ,Always the first person to be thought of ! 
emma_32,1,157,How I catch myself out ! ,How I catch myself out ! 
emma_32,1,158,"Frank Churchill comes as regularly into my mind!""-- All this ran so glibly through her thoughts , that by the time her father had arranged himself , after the bustle of the Eltons ' departure , and was ready to speak , she was very tolerably capable of attending . ","Frank Churchill comes as regularly into my mind!""-- All this ran so glibly through her thoughts , that by the time her father had arranged himself , after the bustle of the Eltons ' departure , and was ready to speak , she was very tolerably capable of attending . "
emma_32,1,159,""" Well , my dear , "" he deliberately began , "" considering we never saw her before , she seems a very pretty sort of young lady ; and I dare say she was very much pleased with you . ",""" Well , my dear , "" he deliberately began , "" considering we never saw her before , she seems a very pretty sort of young lady ; and I dare say she was very much pleased with you . "
emma_32,1,160,She speaks a little too quick . ,She speaks a little too quick . 
emma_32,1,161,A little quickness of voice there is which rather hurts the ear . ,A little quickness of voice there is which rather hurts the ear . 
emma_32,1,162,But I believe I am nice ; I do not like strange voices ; and nobody speaks like you and poor Miss Taylor . ,But I believe I am nice ; I do not like strange voices ; and nobody speaks like you and poor Miss Taylor . 
emma_32,1,163,"However , she seems a very obliging , pretty - behaved young lady , and no doubt will make him a very good wife . Though I think he had better not have married . ","However , she seems a very obliging , pretty - behaved young lady , and no doubt will make him a very good wife . Though I think he had better not have married . "
emma_32,1,164,I made the best excuses I could for not having been able to wait on him and Mrs. Elton on this happy occasion ; I said that I hoped I _ should _ in the course of the summer . But I ought to have gone before . ,I made the best excuses I could for not having been able to wait on him and Mrs. Elton on this happy occasion ; I said that I hoped I _ should _ in the course of the summer . But I ought to have gone before . 
emma_32,1,165,Not to wait upon a bride is very remiss . ,Not to wait upon a bride is very remiss . 
emma_32,1,166,Ah ! ,Ah ! 
emma_32,1,167,it shews what a sad invalid I am ! ,it shews what a sad invalid I am ! 
emma_32,1,168,But I do not like the corner into Vicarage Lane . ,But I do not like the corner into Vicarage Lane . 
emma_32,1,169,""" "" I dare say your apologies were accepted , sir . ",""" "" I dare say your apologies were accepted , sir . "
emma_32,1,170,"Mr. Elton knows you . "" ","Mr. Elton knows you . "" "
emma_32,1,171,""" Yes : but a young lady -- a bride -- I ought to have paid my respects to her if possible . ",""" Yes : but a young lady -- a bride -- I ought to have paid my respects to her if possible . "
emma_32,1,172,"It was being very deficient . "" ","It was being very deficient . "" "
emma_32,1,173,""" But , my dear papa , you are no friend to matrimony ; and therefore why should you be so anxious to pay your respects to a _ bride _ ? It ought to be no recommendation to _ you _ . ",""" But , my dear papa , you are no friend to matrimony ; and therefore why should you be so anxious to pay your respects to a _ bride _ ? It ought to be no recommendation to _ you _ . "
emma_32,1,174,It is encouraging people to marry if you make so much of them . ,It is encouraging people to marry if you make so much of them . 
emma_32,1,175,""" ",""" "
emma_32,1,176,""" No , my dear , I never encouraged any body to marry , but I would always wish to pay every proper attention to a lady -- and a bride , especially , is never to be neglected . ",""" No , my dear , I never encouraged any body to marry , but I would always wish to pay every proper attention to a lady -- and a bride , especially , is never to be neglected . "
emma_32,1,177,More is avowedly due to _ her _ . ,More is avowedly due to _ her _ . 
emma_32,1,178,"A bride , you know , my dear , is always the first in company , let the others be who they may . "" ","A bride , you know , my dear , is always the first in company , let the others be who they may . "" "
emma_32,1,179,""" Well , papa , if this is not encouragement to marry , I do not know what is . ",""" Well , papa , if this is not encouragement to marry , I do not know what is . "
emma_32,1,180,And I should never have expected you to be lending your sanction to such vanity - baits for poor young ladies . ,And I should never have expected you to be lending your sanction to such vanity - baits for poor young ladies . 
emma_32,1,181,""" ",""" "
emma_32,1,182,""" My dear , you do not understand me . ",""" My dear , you do not understand me . "
emma_32,1,183,"This is a matter of mere common politeness and good - breeding , and has nothing to do with any encouragement to people to marry . ","This is a matter of mere common politeness and good - breeding , and has nothing to do with any encouragement to people to marry . "
emma_32,1,184,""" Emma had done . ",""" Emma had done . "
emma_32,1,185,"Her father was growing nervous , and could not understand _ her _ . Her mind returned to Mrs. Elton 's offences , and long , very long , did they occupy her . ","Her father was growing nervous , and could not understand _ her _ . Her mind returned to Mrs. Elton 's offences , and long , very long , did they occupy her . "
