fic_id,chapter_id,para_id,text,text_tokenized
sense_2,1,1," 4 "" What a pity it is , Elinor , "" said Marianne , "" that Edward should have no taste for drawing . "," 4 "" What a pity it is , Elinor , "" said Marianne , "" that Edward should have no taste for drawing . "
sense_2,1,2,""" ",""" "
sense_2,1,3,""" No taste for drawing ! "" replied Elinor , "" why should you think so ? ",""" No taste for drawing ! "" replied Elinor , "" why should you think so ? "
sense_2,1,4,"He does not draw himself , indeed , but he has great pleasure in seeing the performances of other people , and I assure you he is by no means deficient in natural taste , though he has not had opportunities of improving it . ","He does not draw himself , indeed , but he has great pleasure in seeing the performances of other people , and I assure you he is by no means deficient in natural taste , though he has not had opportunities of improving it . "
sense_2,1,5,"Had he ever been in the way of learning , I think he would have drawn very well . He distrusts his own judgment in such matters so much , that he is always unwilling to give his opinion on any picture ; but he has an innate propriety and simplicity of taste , which in general direct him perfectly right . ","Had he ever been in the way of learning , I think he would have drawn very well . He distrusts his own judgment in such matters so much , that he is always unwilling to give his opinion on any picture ; but he has an innate propriety and simplicity of taste , which in general direct him perfectly right . "
sense_2,1,6,""" ",""" "
sense_2,1,7,"Marianne was afraid of offending , and said no more on the subject ; but the kind of approbation which Elinor described as excited in him by the drawings of other people , was very far from that rapturous delight , which , in her opinion , could alone be called taste . ","Marianne was afraid of offending , and said no more on the subject ; but the kind of approbation which Elinor described as excited in him by the drawings of other people , was very far from that rapturous delight , which , in her opinion , could alone be called taste . "
sense_2,1,8,"Yet , though smiling within herself at the mistake , she honoured her sister for that blind partiality to Edward which produced it . ","Yet , though smiling within herself at the mistake , she honoured her sister for that blind partiality to Edward which produced it . "
sense_2,1,9,""" I hope , Marianne , "" continued Elinor , "" you do not consider him as deficient in general taste . ",""" I hope , Marianne , "" continued Elinor , "" you do not consider him as deficient in general taste . "
sense_2,1,10,"Indeed , I think I may say that you can not , for your behaviour to him is perfectly cordial , and if THAT were your opinion , I am sure you could never be civil to him . "" ","Indeed , I think I may say that you can not , for your behaviour to him is perfectly cordial , and if THAT were your opinion , I am sure you could never be civil to him . "" "
sense_2,1,11,Marianne hardly knew what to say . ,Marianne hardly knew what to say . 
sense_2,1,12,"She would not wound the feelings of her sister on any account , and yet to say what she did not believe was impossible . ","She would not wound the feelings of her sister on any account , and yet to say what she did not believe was impossible . "
sense_2,1,13,"At length she replied : "" Do not be offended , Elinor , if my praise of him is not in every thing equal to your sense of his merits . ","At length she replied : "" Do not be offended , Elinor , if my praise of him is not in every thing equal to your sense of his merits . "
sense_2,1,14,"I have not had so many opportunities of estimating the minuter propensities of his mind , his inclinations and tastes , as you have ; but I have the highest opinion in the world of his goodness and sense . ","I have not had so many opportunities of estimating the minuter propensities of his mind , his inclinations and tastes , as you have ; but I have the highest opinion in the world of his goodness and sense . "
sense_2,1,15,I think him every thing that is worthy and amiable . ,I think him every thing that is worthy and amiable . 
sense_2,1,16,""" ",""" "
sense_2,1,17,""" I am sure , "" replied Elinor , with a smile , "" that his dearest friends could not be dissatisfied with such commendation as that . ",""" I am sure , "" replied Elinor , with a smile , "" that his dearest friends could not be dissatisfied with such commendation as that . "
sense_2,1,18,"I do not perceive how you could express yourself more warmly . "" Marianne was rejoiced to find her sister so easily pleased . ","I do not perceive how you could express yourself more warmly . "" Marianne was rejoiced to find her sister so easily pleased . "
sense_2,1,19,""" Of his sense and his goodness , "" continued Elinor , "" no one can , I think , be in doubt , who has seen him often enough to engage him in unreserved conversation . ",""" Of his sense and his goodness , "" continued Elinor , "" no one can , I think , be in doubt , who has seen him often enough to engage him in unreserved conversation . "
sense_2,1,20,The excellence of his understanding and his principles can be concealed only by that shyness which too often keeps him silent . ,The excellence of his understanding and his principles can be concealed only by that shyness which too often keeps him silent . 
sense_2,1,21,You know enough of him to do justice to his solid worth . ,You know enough of him to do justice to his solid worth . 
sense_2,1,22,"But of his minuter propensities , as you call them you have from peculiar circumstances been kept more ignorant than myself . ","But of his minuter propensities , as you call them you have from peculiar circumstances been kept more ignorant than myself . "
sense_2,1,23,"He and I have been at times thrown a good deal together , while you have been wholly engrossed on the most affectionate principle by my mother . ","He and I have been at times thrown a good deal together , while you have been wholly engrossed on the most affectionate principle by my mother . "
sense_2,1,24,"I have seen a great deal of him , have studied his sentiments and heard his opinion on subjects of literature and taste ; and , upon the whole , I venture to pronounce that his mind is well - informed , enjoyment of books exceedingly great , his imagination lively , his observation just and correct , and his taste delicate and pure . ","I have seen a great deal of him , have studied his sentiments and heard his opinion on subjects of literature and taste ; and , upon the whole , I venture to pronounce that his mind is well - informed , enjoyment of books exceedingly great , his imagination lively , his observation just and correct , and his taste delicate and pure . "
sense_2,1,25,His abilities in every respect improve as much upon acquaintance as his manners and person . ,His abilities in every respect improve as much upon acquaintance as his manners and person . 
sense_2,1,26,"At first sight , his address is certainly not striking ; and his person can hardly be called handsome , till the expression of his eyes , which are uncommonly good , and the general sweetness of his countenance , is perceived . ","At first sight , his address is certainly not striking ; and his person can hardly be called handsome , till the expression of his eyes , which are uncommonly good , and the general sweetness of his countenance , is perceived . "
sense_2,1,27,"At present , I know him so well , that I think him really handsome ; or at least , almost so . ","At present , I know him so well , that I think him really handsome ; or at least , almost so . "
sense_2,1,28,"What say you , Marianne ? ","What say you , Marianne ? "
sense_2,1,29,""" "" I shall very soon think him handsome , Elinor , if I do not now . ",""" "" I shall very soon think him handsome , Elinor , if I do not now . "
sense_2,1,30,"When you tell me to love him as a brother , I shall no more see imperfection in his face , than I now do in his heart . "" Elinor started at this declaration , and was sorry for the warmth she had been betrayed into , in speaking of him . ","When you tell me to love him as a brother , I shall no more see imperfection in his face , than I now do in his heart . "" Elinor started at this declaration , and was sorry for the warmth she had been betrayed into , in speaking of him . "
sense_2,1,31,She felt that Edward stood very high in her opinion . ,She felt that Edward stood very high in her opinion . 
sense_2,1,32,She believed the regard to be mutual ; but she required greater certainty of it to make Marianne 's conviction of their attachment agreeable to her . ,She believed the regard to be mutual ; but she required greater certainty of it to make Marianne 's conviction of their attachment agreeable to her . 
sense_2,1,33,"She knew that what Marianne and her mother conjectured one moment , they believed the next -- that with them , to wish was to hope , and to hope was to expect . She tried to explain the real state of the case to her sister . ","She knew that what Marianne and her mother conjectured one moment , they believed the next -- that with them , to wish was to hope , and to hope was to expect . She tried to explain the real state of the case to her sister . "
sense_2,1,34,""" I do not attempt to deny , "" said she , "" that I think very highly of him -- that I greatly esteem , that I like him . ",""" I do not attempt to deny , "" said she , "" that I think very highly of him -- that I greatly esteem , that I like him . "
sense_2,1,35,""" ",""" "
sense_2,1,36,"Marianne here burst forth with indignation-- "" Esteem him ! ","Marianne here burst forth with indignation-- "" Esteem him ! "
sense_2,1,37,Like him ! ,Like him ! 
sense_2,1,38,Cold - hearted Elinor ! ,Cold - hearted Elinor ! 
sense_2,1,39,Oh ! worse than cold - hearted ! ,Oh ! worse than cold - hearted ! 
sense_2,1,40,Ashamed of being otherwise . ,Ashamed of being otherwise . 
sense_2,1,41,"Use those words again , and I will leave the room this moment . "" ","Use those words again , and I will leave the room this moment . "" "
sense_2,1,42,"Elinor could not help laughing . "" Excuse me , "" said she ; "" and be assured that I meant no offence to you , by speaking , in so quiet a way , of my own feelings . ","Elinor could not help laughing . "" Excuse me , "" said she ; "" and be assured that I meant no offence to you , by speaking , in so quiet a way , of my own feelings . "
sense_2,1,43,"Believe them to be stronger than I have declared ; believe them , in short , to be such as his merit , and the suspicion -- the hope of his affection for me may warrant , without imprudence or folly . ","Believe them to be stronger than I have declared ; believe them , in short , to be such as his merit , and the suspicion -- the hope of his affection for me may warrant , without imprudence or folly . "
sense_2,1,44,But farther than this you must not believe . ,But farther than this you must not believe . 
sense_2,1,45,I am by no means assured of his regard for me . ,I am by no means assured of his regard for me . 
sense_2,1,46,"There are moments when the extent of it seems doubtful ; and till his sentiments are fully known , you can not wonder at my wishing to avoid any encouragement of my own partiality , by believing or calling it more than it is . ","There are moments when the extent of it seems doubtful ; and till his sentiments are fully known , you can not wonder at my wishing to avoid any encouragement of my own partiality , by believing or calling it more than it is . "
sense_2,1,47,In my heart I feel little -- scarcely any doubt of his preference . ,In my heart I feel little -- scarcely any doubt of his preference . 
sense_2,1,48,But there are other points to be considered besides his inclination . ,But there are other points to be considered besides his inclination . 
sense_2,1,49,He is very far from being independent . ,He is very far from being independent . 
sense_2,1,50,"What his mother really is we can not know ; but , from Fanny 's occasional mention of her conduct and opinions , we have never been disposed to think her amiable ; and I am very much mistaken if Edward is not himself aware that there would be many difficulties in his way , if he were to wish to marry a woman who had not either a great fortune or high rank . ","What his mother really is we can not know ; but , from Fanny 's occasional mention of her conduct and opinions , we have never been disposed to think her amiable ; and I am very much mistaken if Edward is not himself aware that there would be many difficulties in his way , if he were to wish to marry a woman who had not either a great fortune or high rank . "
sense_2,1,51,""" Marianne was astonished to find how much the imagination of her mother and herself had outstripped the truth . ",""" Marianne was astonished to find how much the imagination of her mother and herself had outstripped the truth . "
sense_2,1,52,""" And you really are not engaged to him ! "" said she . ",""" And you really are not engaged to him ! "" said she . "
sense_2,1,53,""" Yet it certainly soon will happen . ",""" Yet it certainly soon will happen . "
sense_2,1,54,But two advantages will proceed from this delay . ,But two advantages will proceed from this delay . 
sense_2,1,55,"I shall not lose you so soon , and Edward will have greater opportunity of improving that natural taste for your favourite pursuit which must be so indispensably necessary to your future felicity . Oh ! ","I shall not lose you so soon , and Edward will have greater opportunity of improving that natural taste for your favourite pursuit which must be so indispensably necessary to your future felicity . Oh ! "
sense_2,1,56,"if he should be so far stimulated by your genius as to learn to draw himself , how delightful it would be ! "" ","if he should be so far stimulated by your genius as to learn to draw himself , how delightful it would be ! "" "
sense_2,1,57,Elinor had given her real opinion to her sister . ,Elinor had given her real opinion to her sister . 
sense_2,1,58,She could not consider her partiality for Edward in so prosperous a state as Marianne had believed it . ,She could not consider her partiality for Edward in so prosperous a state as Marianne had believed it . 
sense_2,1,59,"There was , at times , a want of spirits about him which , if it did not denote indifference , spoke of something almost as unpromising . ","There was , at times , a want of spirits about him which , if it did not denote indifference , spoke of something almost as unpromising . "
sense_2,1,60,"A doubt of her regard , supposing him to feel it , need not give him more than inquietude . ","A doubt of her regard , supposing him to feel it , need not give him more than inquietude . "
sense_2,1,61,It would not be likely to produce that dejection of mind which frequently attended him . ,It would not be likely to produce that dejection of mind which frequently attended him . 
sense_2,1,62,"A more reasonable cause might be found in the dependent situation which forbade the indulgence of his affection . She knew that his mother neither behaved to him so as to make his home comfortable at present , nor to give him any assurance that he might form a home for himself , without strictly attending to her views for his aggrandizement . ","A more reasonable cause might be found in the dependent situation which forbade the indulgence of his affection . She knew that his mother neither behaved to him so as to make his home comfortable at present , nor to give him any assurance that he might form a home for himself , without strictly attending to her views for his aggrandizement . "
sense_2,1,63,"With such a knowledge as this , it was impossible for Elinor to feel easy on the subject . ","With such a knowledge as this , it was impossible for Elinor to feel easy on the subject . "
sense_2,1,64,"She was far from depending on that result of his preference of her , which her mother and sister still considered as certain . Nay , the longer they were together the more doubtful seemed the nature of his regard ; and sometimes , for a few painful minutes , she believed it to be no more than friendship . ","She was far from depending on that result of his preference of her , which her mother and sister still considered as certain . Nay , the longer they were together the more doubtful seemed the nature of his regard ; and sometimes , for a few painful minutes , she believed it to be no more than friendship . "
sense_2,1,65,"But , whatever might really be its limits , it was enough , when perceived by his sister , to make her uneasy , and at the same time , ( which was still more common , ) to make her uncivil . ","But , whatever might really be its limits , it was enough , when perceived by his sister , to make her uneasy , and at the same time , ( which was still more common , ) to make her uncivil . "
sense_2,1,66,"She took the first opportunity of affronting her mother - in - law on the occasion , talking to her so expressively of her brother 's great expectations , of Mrs. Ferrars 's resolution that both her sons should marry well , and of the danger attending any young woman who attempted to DRAW HIM IN ; that Mrs. Dashwood could neither pretend to be unconscious , nor endeavor to be calm . ","She took the first opportunity of affronting her mother - in - law on the occasion , talking to her so expressively of her brother 's great expectations , of Mrs. Ferrars 's resolution that both her sons should marry well , and of the danger attending any young woman who attempted to DRAW HIM IN ; that Mrs. Dashwood could neither pretend to be unconscious , nor endeavor to be calm . "
sense_2,1,67,"She gave her an answer which marked her contempt , and instantly left the room , resolving that , whatever might be the inconvenience or expense of so sudden a removal , her beloved Elinor should not be exposed another week to such insinuations . In this state of her spirits , a letter was delivered to her from the post , which contained a proposal particularly well timed . It was the offer of a small house , on very easy terms , belonging to a relation of her own , a gentleman of consequence and property in Devonshire . ","She gave her an answer which marked her contempt , and instantly left the room , resolving that , whatever might be the inconvenience or expense of so sudden a removal , her beloved Elinor should not be exposed another week to such insinuations . In this state of her spirits , a letter was delivered to her from the post , which contained a proposal particularly well timed . It was the offer of a small house , on very easy terms , belonging to a relation of her own , a gentleman of consequence and property in Devonshire . "
sense_2,1,68,"The letter was from this gentleman himself , and written in the true spirit of friendly accommodation . He understood that she was in need of a dwelling ; and though the house he now offered her was merely a cottage , he assured her that everything should be done to it which she might think necessary , if the situation pleased her . ","The letter was from this gentleman himself , and written in the true spirit of friendly accommodation . He understood that she was in need of a dwelling ; and though the house he now offered her was merely a cottage , he assured her that everything should be done to it which she might think necessary , if the situation pleased her . "
sense_2,1,69,"He earnestly pressed her , after giving the particulars of the house and garden , to come with her daughters to Barton Park , the place of his own residence , from whence she might judge , herself , whether Barton Cottage , for the houses were in the same parish , could , by any alteration , be made comfortable to her . ","He earnestly pressed her , after giving the particulars of the house and garden , to come with her daughters to Barton Park , the place of his own residence , from whence she might judge , herself , whether Barton Cottage , for the houses were in the same parish , could , by any alteration , be made comfortable to her . "
sense_2,1,70,He seemed really anxious to accommodate them and the whole of his letter was written in so friendly a style as could not fail of giving pleasure to his cousin ; more especially at a moment when she was suffering under the cold and unfeeling behaviour of her nearer connections . ,He seemed really anxious to accommodate them and the whole of his letter was written in so friendly a style as could not fail of giving pleasure to his cousin ; more especially at a moment when she was suffering under the cold and unfeeling behaviour of her nearer connections . 
sense_2,1,71,She needed no time for deliberation or inquiry . ,She needed no time for deliberation or inquiry . 
sense_2,1,72,Her resolution was formed as she read . ,Her resolution was formed as she read . 
sense_2,1,73,"The situation of Barton , in a county so far distant from Sussex as Devonshire , which , but a few hours before , would have been a sufficient objection to outweigh every possible advantage belonging to the place , was now its first recommendation . ","The situation of Barton , in a county so far distant from Sussex as Devonshire , which , but a few hours before , would have been a sufficient objection to outweigh every possible advantage belonging to the place , was now its first recommendation . "
sense_2,1,74,"To quit the neighbourhood of Norland was no longer an evil ; it was an object of desire ; it was a blessing , in comparison of the misery of continuing her daughter - in - law 's guest ; and to remove for ever from that beloved place would be less painful than to inhabit or visit it while such a woman was its mistress . ","To quit the neighbourhood of Norland was no longer an evil ; it was an object of desire ; it was a blessing , in comparison of the misery of continuing her daughter - in - law 's guest ; and to remove for ever from that beloved place would be less painful than to inhabit or visit it while such a woman was its mistress . "
sense_2,1,75,"She instantly wrote Sir John Middleton her acknowledgment of his kindness , and her acceptance of his proposal ; and then hastened to shew both letters to her daughters , that she might be secure of their approbation before her answer were sent . Elinor had always thought it would be more prudent for them to settle at some distance from Norland , than immediately amongst their present acquaintance . ","She instantly wrote Sir John Middleton her acknowledgment of his kindness , and her acceptance of his proposal ; and then hastened to shew both letters to her daughters , that she might be secure of their approbation before her answer were sent . Elinor had always thought it would be more prudent for them to settle at some distance from Norland , than immediately amongst their present acquaintance . "
sense_2,1,76,"On THAT head , therefore , it was not for her to oppose her mother 's intention of removing into Devonshire . ","On THAT head , therefore , it was not for her to oppose her mother 's intention of removing into Devonshire . "
sense_2,1,77,"The house , too , as described by Sir John , was on so simple a scale , and the rent so uncommonly moderate , as to leave her no right of objection on either point ; and , therefore , though it was not a plan which brought any charm to her fancy , though it was a removal from the vicinity of Norland beyond her wishes , she made no attempt to dissuade her mother from sending a letter of acquiescence . ","The house , too , as described by Sir John , was on so simple a scale , and the rent so uncommonly moderate , as to leave her no right of objection on either point ; and , therefore , though it was not a plan which brought any charm to her fancy , though it was a removal from the vicinity of Norland beyond her wishes , she made no attempt to dissuade her mother from sending a letter of acquiescence . "
sense_2,2,1," 5 No sooner was her answer dispatched , than Mrs. Dashwood indulged herself in the pleasure of announcing to her son - in - law and his wife that she was provided with a house , and should incommode them no longer than till every thing were ready for her inhabiting it . "," 5 No sooner was her answer dispatched , than Mrs. Dashwood indulged herself in the pleasure of announcing to her son - in - law and his wife that she was provided with a house , and should incommode them no longer than till every thing were ready for her inhabiting it . "
sense_2,2,2,They heard her with surprise . ,They heard her with surprise . 
sense_2,2,3,Mrs. John Dashwood said nothing ; but her husband civilly hoped that she would not be settled far from Norland . ,Mrs. John Dashwood said nothing ; but her husband civilly hoped that she would not be settled far from Norland . 
sense_2,2,4,"She had great satisfaction in replying that she was going into Devonshire.--Edward turned hastily towards her , on hearing this , and , in a voice of surprise and concern , which required no explanation to her , repeated , "" Devonshire ! ","She had great satisfaction in replying that she was going into Devonshire.--Edward turned hastily towards her , on hearing this , and , in a voice of surprise and concern , which required no explanation to her , repeated , "" Devonshire ! "
sense_2,2,5,"Are you , indeed , going there ? ","Are you , indeed , going there ? "
sense_2,2,6,So far from hence ! ,So far from hence ! 
sense_2,2,7,"And to what part of it ? "" ","And to what part of it ? "" "
sense_2,2,8,She explained the situation . ,She explained the situation . 
sense_2,2,9,It was within four miles northward of Exeter . ,It was within four miles northward of Exeter . 
