fic_id,chapter_id,para_id,text,text_tokenized
mansfield_13,1,1, XXVI William ’s desire of seeing Fanny dance made more than a momentary impression on his uncle . , XXVI William ’s desire of seeing Fanny dance made more than a momentary impression on his uncle . 
mansfield_13,1,2,"The hope of an opportunity , which Sir Thomas had then given , was not given to be thought of no more ","The hope of an opportunity , which Sir Thomas had then given , was not given to be thought of no more "
mansfield_13,1,3,. ,. 
mansfield_13,1,4,"He remained steadily inclined to gratify so amiable a feeling ; to gratify anybody else who might wish to see Fanny dance , and to give pleasure to the young people in general ; and having thought the matter over , and taken his resolution in quiet independence , the result of it appeared the next morning at breakfast , when , after recalling and commending what his nephew had said , he added , “ I do not like , William , that you should leave Northamptonshire without this indulgence . ","He remained steadily inclined to gratify so amiable a feeling ; to gratify anybody else who might wish to see Fanny dance , and to give pleasure to the young people in general ; and having thought the matter over , and taken his resolution in quiet independence , the result of it appeared the next morning at breakfast , when , after recalling and commending what his nephew had said , he added , “ I do not like , William , that you should leave Northamptonshire without this indulgence . "
mansfield_13,1,5,It would give me pleasure to see you both dance . ,It would give me pleasure to see you both dance . 
mansfield_13,1,6,You spoke of the balls at Northampton . ,You spoke of the balls at Northampton . 
mansfield_13,1,7,Your cousins have occasionally attended them ; but they would not altogether suit us now . ,Your cousins have occasionally attended them ; but they would not altogether suit us now . 
mansfield_13,1,8,The fatigue would be too much for your aunt . ,The fatigue would be too much for your aunt . 
mansfield_13,1,9,I ,I 
mansfield_13,1,10,believe we must not think of a Northampton ball . ,believe we must not think of a Northampton ball . 
mansfield_13,1,11,"A dance at home would be more eligible ; and if — ” “ Ah , my dear Sir Thomas ! ” interrupted Mrs. Norris , “ I knew what was coming . ","A dance at home would be more eligible ; and if — ” “ Ah , my dear Sir Thomas ! ” interrupted Mrs. Norris , “ I knew what was coming . "
mansfield_13,1,12,I knew what you were going to say . ,I knew what you were going to say . 
mansfield_13,1,13,"If dear Julia were at home , or dearest Mrs. Rushworth at Sotherton , to afford a reason , an occasion for such a thing , you would be tempted to give the young people a dance at Mansfield . ","If dear Julia were at home , or dearest Mrs. Rushworth at Sotherton , to afford a reason , an occasion for such a thing , you would be tempted to give the young people a dance at Mansfield . "
mansfield_13,1,14,I know you would . ,I know you would . 
mansfield_13,1,15,"If _ they _ were at home to grace the ball , a ball you would have this very Christmas . ","If _ they _ were at home to grace the ball , a ball you would have this very Christmas . "
mansfield_13,1,16,"Thank your uncle , William , thank your uncle ! ” ","Thank your uncle , William , thank your uncle ! ” "
mansfield_13,1,17,"“ My daughters , ” replied Sir Thomas , gravely interposing , “ have their pleasures at Brighton , and I hope are very happy ; but the dance which I think of giving at Mansfield will be for their cousins . ","“ My daughters , ” replied Sir Thomas , gravely interposing , “ have their pleasures at Brighton , and I hope are very happy ; but the dance which I think of giving at Mansfield will be for their cousins . "
mansfield_13,1,18,"Could we be all assembled , our satisfaction would undoubtedly be more complete , but the absence of some is not to debar the others of amusement . ","Could we be all assembled , our satisfaction would undoubtedly be more complete , but the absence of some is not to debar the others of amusement . "
mansfield_13,1,19,” ,” 
mansfield_13,1,20,Mrs. Norris had not another word to say . ,Mrs. Norris had not another word to say . 
mansfield_13,1,21,"She saw decision in his looks , ","She saw decision in his looks , "
mansfield_13,1,22,and her surprise and vexation required some minutes ’ silence to be settled into composure . ,and her surprise and vexation required some minutes ’ silence to be settled into composure . 
mansfield_13,1,23,A ball at such a time ! ,A ball at such a time ! 
mansfield_13,1,24,His daughters absent and herself not consulted ! ,His daughters absent and herself not consulted ! 
mansfield_13,1,25,"There was comfort , however , soon at hand . ","There was comfort , however , soon at hand . "
mansfield_13,1,26,"_ She _ must be the doer of everything : Lady Bertram would of course be spared all thought and exertion , and it would all fall upon _ her _ . ","_ She _ must be the doer of everything : Lady Bertram would of course be spared all thought and exertion , and it would all fall upon _ her _ . "
mansfield_13,1,27,"She should have to do the honours of the evening ; and this reflection quickly restored so much of her good - humour as enabled her to join in with the others , before their happiness and thanks were all expressed . ","She should have to do the honours of the evening ; and this reflection quickly restored so much of her good - humour as enabled her to join in with the others , before their happiness and thanks were all expressed . "
mansfield_13,1,28,"Edmund , William , and Fanny did , in their different ways , look and speak as much grateful pleasure in the promised ball as Sir Thomas could desire . ","Edmund , William , and Fanny did , in their different ways , look and speak as much grateful pleasure in the promised ball as Sir Thomas could desire . "
mansfield_13,1,29,Edmund ’s feelings were for the other two . ,Edmund ’s feelings were for the other two . 
mansfield_13,1,30,His father had never conferred a favour or shewn a kindness more to his satisfaction . ,His father had never conferred a favour or shewn a kindness more to his satisfaction . 
mansfield_13,1,31,"Lady Bertram was perfectly quiescent and contented , and had no objections to make . ","Lady Bertram was perfectly quiescent and contented , and had no objections to make . "
mansfield_13,1,32,"Sir Thomas engaged for its giving her very little trouble ; and she assured him “ that she was not at all afraid of the trouble ; indeed , she could not imagine there would be any . ” ","Sir Thomas engaged for its giving her very little trouble ; and she assured him “ that she was not at all afraid of the trouble ; indeed , she could not imagine there would be any . ” "
mansfield_13,1,33,"Mrs. Norris was ready with her suggestions as to the rooms he would think fittest to be used , but found it all prearranged ; and when she would have conjectured and hinted about the day , it appeared that the day was settled too . ","Mrs. Norris was ready with her suggestions as to the rooms he would think fittest to be used , but found it all prearranged ; and when she would have conjectured and hinted about the day , it appeared that the day was settled too . "
mansfield_13,1,34,"Sir Thomas had been amusing himself with shaping a very complete outline of the business ; and as soon as she would listen quietly , could read his list of the families to be invited , from whom he calculated , with all necessary allowance for the shortness of the notice , to collect young people enough to form twelve or fourteen couple : and could detail the considerations which had induced him to ","Sir Thomas had been amusing himself with shaping a very complete outline of the business ; and as soon as she would listen quietly , could read his list of the families to be invited , from whom he calculated , with all necessary allowance for the shortness of the notice , to collect young people enough to form twelve or fourteen couple : and could detail the considerations which had induced him to "
mansfield_13,1,35,fix on the 22nd as the most eligible day ,fix on the 22nd as the most eligible day 
mansfield_13,1,36,. ,. 
mansfield_13,1,37,William was required to be at Portsmouth on the 24th ; the 22nd would therefore be the last day of his visit ; but where the days were so few it would be unwise to fix on any earlier . ,William was required to be at Portsmouth on the 24th ; the 22nd would therefore be the last day of his visit ; but where the days were so few it would be unwise to fix on any earlier . 
mansfield_13,1,38,"Mrs. Norris was obliged to be satisfied with thinking just the same , and with having been on the point of proposing the 22nd herself , as by far the best day for the purpose . ","Mrs. Norris was obliged to be satisfied with thinking just the same , and with having been on the point of proposing the 22nd herself , as by far the best day for the purpose . "
mansfield_13,1,39,"The ball was now a settled thing , and before the evening a proclaimed thing to all whom it concerned . ","The ball was now a settled thing , and before the evening a proclaimed thing to all whom it concerned . "
mansfield_13,1,40,"Invitations were sent with despatch , and many a young lady went to bed that night with her head full of happy cares as well as Fanny . ","Invitations were sent with despatch , and many a young lady went to bed that night with her head full of happy cares as well as Fanny . "
mansfield_13,1,41,"To her the cares were sometimes almost beyond the happiness ; for young and inexperienced , with small means of choice and no confidence in her own taste ","To her the cares were sometimes almost beyond the happiness ; for young and inexperienced , with small means of choice and no confidence in her own taste "
mansfield_13,1,42,", the “ how she should be dressed ” was a point of painful solicitude ; and the almost solitary ornament in her possession , a very pretty amber cross which William had brought her from Sicily , was the greatest distress of all , for she had nothing but a bit of ribbon to fasten it to ; and though she had worn it in that manner once , would it be allowable at such a time in the midst of all the rich ornaments which she supposed all the other young ladies would appear in ? ",", the “ how she should be dressed ” was a point of painful solicitude ; and the almost solitary ornament in her possession , a very pretty amber cross which William had brought her from Sicily , was the greatest distress of all , for she had nothing but a bit of ribbon to fasten it to ; and though she had worn it in that manner once , would it be allowable at such a time in the midst of all the rich ornaments which she supposed all the other young ladies would appear in ? "
mansfield_13,1,43,And yet not to wear it ! ,And yet not to wear it ! 
mansfield_13,1,44,"William had wanted to buy her a gold chain too , but the purchase had been beyond his means , and therefore not to wear the cross might be mortifying him . ","William had wanted to buy her a gold chain too , but the purchase had been beyond his means , and therefore not to wear the cross might be mortifying him . "
mansfield_13,1,45,These were anxious considerations ; enough to sober her spirits even under the prospect of a ball given principally for her gratification . ,These were anxious considerations ; enough to sober her spirits even under the prospect of a ball given principally for her gratification . 
mansfield_13,1,46,"The preparations meanwhile went on , and Lady Bertram continued to sit on her sofa without any inconvenience from them . ","The preparations meanwhile went on , and Lady Bertram continued to sit on her sofa without any inconvenience from them . "
mansfield_13,1,47,"She had some extra visits from the housekeeper , and her maid was rather hurried in making ","She had some extra visits from the housekeeper , and her maid was rather hurried in making "
mansfield_13,1,48,up a new dress for her ,up a new dress for her 
mansfield_13,1,49,": Sir Thomas gave orders , and Mrs. Norris ran about ; but all this gave _ her _ no trouble , and as she had foreseen , “ there was , in fact , no trouble in the business . ” ",": Sir Thomas gave orders , and Mrs. Norris ran about ; but all this gave _ her _ no trouble , and as she had foreseen , “ there was , in fact , no trouble in the business . ” "
mansfield_13,1,50,"Edmund was at this time particularly full of cares : his mind being deeply occupied in the consideration of two important events now at hand , which were to fix his fate in life — ordination and matrimony — events of such a serious character as to make the ball , which would be very quickly followed by one of them , appear of less moment in his eyes than in those of any other person in the house . ","Edmund was at this time particularly full of cares : his mind being deeply occupied in the consideration of two important events now at hand , which were to fix his fate in life — ordination and matrimony — events of such a serious character as to make the ball , which would be very quickly followed by one of them , appear of less moment in his eyes than in those of any other person in the house . "
mansfield_13,1,51,"On the 23rd he was going to a friend near Peterborough , in the same situation as himself , and they were to receive ordination in the course of the Christmas week . ","On the 23rd he was going to a friend near Peterborough , in the same situation as himself , and they were to receive ordination in the course of the Christmas week . "
mansfield_13,1,52,"Half his destiny would then be determined , but the other half might not be so very smoothly wooed . ","Half his destiny would then be determined , but the other half might not be so very smoothly wooed . "
mansfield_13,1,53,"His duties would be established , but the wife who was to share , and animate , and reward those duties , might yet be unattainable . ","His duties would be established , but the wife who was to share , and animate , and reward those duties , might yet be unattainable . "
mansfield_13,1,54,"He knew his own mind , but he ","He knew his own mind , but he "
mansfield_13,1,55,was not always perfectly assured of knowing Miss Crawford ’s . ,was not always perfectly assured of knowing Miss Crawford ’s . 
mansfield_13,1,56,"There were points on which they did not quite agree ; there were moments in which she did not seem propitious ; and though trusting altogether to her affection , so far as to be resolved — almost resolved — on bringing it to a decision within a very short time , as soon as the variety of business before him were arranged , and he knew what he had to offer her , he had many anxious feelings , many doubting hours as to the result . ","There were points on which they did not quite agree ; there were moments in which she did not seem propitious ; and though trusting altogether to her affection , so far as to be resolved — almost resolved — on bringing it to a decision within a very short time , as soon as the variety of business before him were arranged , and he knew what he had to offer her , he had many anxious feelings , many doubting hours as to the result . "
mansfield_13,1,57,"His conviction of her regard for him was sometimes very strong ; he could look back on a long course of encouragement , and she was as perfect in disinterested attachment as in everything else . ","His conviction of her regard for him was sometimes very strong ; he could look back on a long course of encouragement , and she was as perfect in disinterested attachment as in everything else . "
mansfield_13,1,58,"But at other times doubt and alarm intermingled with his hopes ; and when he thought of her acknowledged disinclination for privacy and retirement , her decided preference of a London life , what could he expect but a determined ","But at other times doubt and alarm intermingled with his hopes ; and when he thought of her acknowledged disinclination for privacy and retirement , her decided preference of a London life , what could he expect but a determined "
mansfield_13,1,59,rejection ? ,rejection ? 
mansfield_13,1,60,"unless it were an acceptance even more to be deprecated , demanding such sacrifices of situation and employment on his side as conscience must forbid . ","unless it were an acceptance even more to be deprecated , demanding such sacrifices of situation and employment on his side as conscience must forbid . "
mansfield_13,1,61,The issue of all depended on one question . ,The issue of all depended on one question . 
mansfield_13,1,62,Did she love him well enough to forego what had used to be essential points ? ,Did she love him well enough to forego what had used to be essential points ? 
mansfield_13,1,63,Did she love him well enough to make them no longer essential ? ,Did she love him well enough to make them no longer essential ? 
mansfield_13,1,64,"And this question , which he was continually repeating to himself , though oftenest answered with a “ Yes , ” had sometimes its “ No . ” ","And this question , which he was continually repeating to himself , though oftenest answered with a “ Yes , ” had sometimes its “ No . ” "
mansfield_13,1,65,"Miss Crawford was soon to leave Mansfield , and on this circumstance the “ no ” and the “ yes ” had been very recently in alternation . He had seen her eyes sparkle as she spoke of the dear friend ’s letter , which claimed a long visit from her in London , and of the kindness of Henry , in engaging to remain where he was till January , that he might convey her thither ; he had heard her speak of the pleasure of such a journey with an animation which had “ no ” in every tone . ","Miss Crawford was soon to leave Mansfield , and on this circumstance the “ no ” and the “ yes ” had been very recently in alternation . He had seen her eyes sparkle as she spoke of the dear friend ’s letter , which claimed a long visit from her in London , and of the kindness of Henry , in engaging to remain where he was till January , that he might convey her thither ; he had heard her speak of the pleasure of such a journey with an animation which had “ no ” in every tone . "
mansfield_13,1,66,"But this had occurred on the first day of its being settled , within the first hour of the burst of such enjoyment , when nothing but the friends she was to visit was before her . ","But this had occurred on the first day of its being settled , within the first hour of the burst of such enjoyment , when nothing but the friends she was to visit was before her . "
mansfield_13,1,67,"He had since heard her express herself differently , with other feelings , more chequered feelings : he had heard her tell Mrs. Grant that she should leave her with regret ; that she began to believe neither the friends nor the pleasures she was going to were worth those she left behind ; and that though she felt she must go , and knew she should enjoy herself when once away , she was already looking forward to being at Mansfield again . Was there not a “ yes ” in all this ? ","He had since heard her express herself differently , with other feelings , more chequered feelings : he had heard her tell Mrs. Grant that she should leave her with regret ; that she began to believe neither the friends nor the pleasures she was going to were worth those she left behind ; and that though she felt she must go , and knew she should enjoy herself when once away , she was already looking forward to being at Mansfield again . Was there not a “ yes ” in all this ? "
mansfield_13,1,68,"With such matters to ponder over , and arrange , and re - arrange , Edmund could not , on his own account , think very much of the evening which the rest of the family were looking forward to with a more equal degree of strong interest . ","With such matters to ponder over , and arrange , and re - arrange , Edmund could not , on his own account , think very much of the evening which the rest of the family were looking forward to with a more equal degree of strong interest . "
mansfield_13,1,69,Independent of his two cousins ’ enjoyment in it ,Independent of his two cousins ’ enjoyment in it 
mansfield_13,1,70,", the evening was to him of no higher value than any other appointed meeting of the two families might be . ",", the evening was to him of no higher value than any other appointed meeting of the two families might be . "
mansfield_13,1,71,"In every meeting there was a hope of receiving farther confirmation of Miss Crawford ’s attachment ; but the whirl of a ballroom , perhaps , was not particularly favourable to the excitement or expression of serious feelings . ","In every meeting there was a hope of receiving farther confirmation of Miss Crawford ’s attachment ; but the whirl of a ballroom , perhaps , was not particularly favourable to the excitement or expression of serious feelings . "
mansfield_13,1,72,"To engage her early for the two first dances was all the command of individual happiness which he felt in his power , and the only preparation for the ball which he could enter into , in spite of all that was passing around him on the subject , from morning till night . ","To engage her early for the two first dances was all the command of individual happiness which he felt in his power , and the only preparation for the ball which he could enter into , in spite of all that was passing around him on the subject , from morning till night . "
mansfield_13,1,73,"Thursday was the day of the ball ; and on Wednesday morning Fanny , still unable to satisfy herself as to what she ought to wear , determined to seek the counsel of the more enlightened , and apply to Mrs. Grant and her sister , whose acknowledged taste would certainly bear her blameless ; ","Thursday was the day of the ball ; and on Wednesday morning Fanny , still unable to satisfy herself as to what she ought to wear , determined to seek the counsel of the more enlightened , and apply to Mrs. Grant and her sister , whose acknowledged taste would certainly bear her blameless ; "
mansfield_13,1,74,"and as Edmund and William were gone to Northampton , and she had reason to think Mr. Crawford likewise out , she walked down to the Parsonage without much fear of wanting an opportunity for private discussion ; and the privacy of such a discussion was a most important part of it to Fanny , being more than half - ashamed of her own solicitude . She met Miss Crawford within a few yards of the Parsonage , just setting out to call on her , and as it seemed to her that her friend , though obliged to insist on turning back , was unwilling to lose her walk , she explained her business at once , and observed , that if she would be so kind as to give her opinion , it might be all talked over as well without doors as within . ","and as Edmund and William were gone to Northampton , and she had reason to think Mr. Crawford likewise out , she walked down to the Parsonage without much fear of wanting an opportunity for private discussion ; and the privacy of such a discussion was a most important part of it to Fanny , being more than half - ashamed of her own solicitude . She met Miss Crawford within a few yards of the Parsonage , just setting out to call on her , and as it seemed to her that her friend , though obliged to insist on turning back , was unwilling to lose her walk , she explained her business at once , and observed , that if she would be so kind as to give her opinion , it might be all talked over as well without doors as within . "
mansfield_13,1,75,"Miss Crawford appeared gratified by the application , and after a moment ’s thought , urged Fanny ’s returning with her in a much more cordial manner than before , and proposed their going up into her room , where they might have a comfortable coze , without disturbing Dr. and Mrs. Grant , who were together in the drawing - room . ","Miss Crawford appeared gratified by the application , and after a moment ’s thought , urged Fanny ’s returning with her in a much more cordial manner than before , and proposed their going up into her room , where they might have a comfortable coze , without disturbing Dr. and Mrs. Grant , who were together in the drawing - room . "
mansfield_13,1,76,"It was just the plan to suit Fanny ; and with a great deal of gratitude on her side for such ready and kind attention , they proceeded indoors , and upstairs , and were soon deep in the interesting subject . ","It was just the plan to suit Fanny ; and with a great deal of gratitude on her side for such ready and kind attention , they proceeded indoors , and upstairs , and were soon deep in the interesting subject . "
mansfield_13,1,77,"Miss Crawford , pleased with the appeal , gave her all her best judgment and taste , made everything easy by her suggestions , and tried to make everything agreeable by her encouragement . ","Miss Crawford , pleased with the appeal , gave her all her best judgment and taste , made everything easy by her suggestions , and tried to make everything agreeable by her encouragement . "
mansfield_13,1,78,The dress being settled in all its grander parts—“But what shall you have by way of necklace ? ” ,The dress being settled in all its grander parts—“But what shall you have by way of necklace ? ” 
mansfield_13,1,79,said Miss Crawford . ,said Miss Crawford . 
mansfield_13,1,80,“ Shall not you wear your brother ’s cross ? ” ,“ Shall not you wear your brother ’s cross ? ” 
