fic_id,chapter_id,para_id,text,text_tokenized
mansfield_7,2,162,"and when , from taking notice of her work , and wishing _ she _ could work as well , and begging for the pattern , and supposing Fanny was now preparing for her _ appearance _ , as of course she would come out when her cousin was married , Miss Crawford proceeded to inquire if she had heard lately from her brother at sea , and said that she had quite a curiosity to see him , and imagined him a very fine young man , and advised Fanny to get his picture drawn before he went to sea again — she could not help admitting it to be very agreeable flattery , or help listening , and answering with more animation than she had intended . ","and when , from taking notice of her work , and wishing _ she _ could work as well , and begging for the pattern , and supposing Fanny was now preparing for her _ appearance _ , as of course she would come out when her cousin was married , Miss Crawford proceeded to inquire if she had heard lately from her brother at sea , and said that she had quite a curiosity to see him , and imagined him a very fine young man , and advised Fanny to get his picture drawn before he went to sea again — she could not help admitting it to be very agreeable flattery , or help listening , and answering with more animation than she had intended . "
mansfield_7,2,163,"The consultation upon the play still went on , and Miss Crawford ’s attention was first called from Fanny by Tom Bertram ’s telling her , with infinite regret , that he found it absolutely impossible for him to undertake the part of Anhalt in addition to the Butler : he had been most anxiously trying to make it out to be feasible , but it would not do ; he must give it up . ","The consultation upon the play still went on , and Miss Crawford ’s attention was first called from Fanny by Tom Bertram ’s telling her , with infinite regret , that he found it absolutely impossible for him to undertake the part of Anhalt in addition to the Butler : he had been most anxiously trying to make it out to be feasible , but it would not do ; he must give it up . "
mansfield_7,2,164,"“ But there will not be the smallest difficulty in filling it , ” he added . ","“ But there will not be the smallest difficulty in filling it , ” he added . "
mansfield_7,2,165,“ We have but to speak the word ; we may pick and chuse . ,“ We have but to speak the word ; we may pick and chuse . 
mansfield_7,2,166,"I could name , at this moment , at least six young men within six miles of us , who are wild to be admitted into our company , and there are one or two that would not disgrace us : I should not be afraid to trust either of the Olivers or Charles Maddox . ","I could name , at this moment , at least six young men within six miles of us , who are wild to be admitted into our company , and there are one or two that would not disgrace us : I should not be afraid to trust either of the Olivers or Charles Maddox . "
mansfield_7,2,167,"Tom Oliver is a very clever fellow , and Charles Maddox is as gentlemanlike a man as you will see anywhere , so I will take my horse early to - morrow morning and ride over to Stoke , and settle with one of them . ","Tom Oliver is a very clever fellow , and Charles Maddox is as gentlemanlike a man as you will see anywhere , so I will take my horse early to - morrow morning and ride over to Stoke , and settle with one of them . "
mansfield_7,2,168,” ,” 
mansfield_7,2,169,"While he spoke , Maria was looking apprehensively round at Edmund in full expectation that he must oppose such an enlargement of the plan as this : so contrary to all their first protestations ; but Edmund said nothing . ","While he spoke , Maria was looking apprehensively round at Edmund in full expectation that he must oppose such an enlargement of the plan as this : so contrary to all their first protestations ; but Edmund said nothing . "
mansfield_7,2,170,"After a moment ’s thought , Miss Crawford calmly replied , “ As far as I am concerned , I can have no objection to anything that you all think eligible . ","After a moment ’s thought , Miss Crawford calmly replied , “ As far as I am concerned , I can have no objection to anything that you all think eligible . "
mansfield_7,2,171,Have I ever seen either of the gentlemen ? ,Have I ever seen either of the gentlemen ? 
mansfield_7,2,172,"Yes , Mr. Charles Maddox dined at my sister ’s one day , did not he , Henry ? ","Yes , Mr. Charles Maddox dined at my sister ’s one day , did not he , Henry ? "
mansfield_7,2,173,A quiet - looking young man . ,A quiet - looking young man . 
mansfield_7,2,174,I remember him . ,I remember him . 
mansfield_7,2,175,"Let _ him _ be applied to , if you please , for it will be less unpleasant to me than to have a perfect stranger . ” ","Let _ him _ be applied to , if you please , for it will be less unpleasant to me than to have a perfect stranger . ” "
mansfield_7,2,176,Charles Maddox was to be the man . ,Charles Maddox was to be the man . 
mansfield_7,2,177,"Tom repeated his resolution of going to him early on the morrow ; and though Julia , who had scarcely opened her lips before , observed , in a sarcastic manner , and with a glance first at Maria and then at Edmund , that “ the Mansfield theatricals would enliven the whole neighbourhood exceedingly , ” Edmund still held his peace , and shewed his feelings only by a determined gravity . ","Tom repeated his resolution of going to him early on the morrow ; and though Julia , who had scarcely opened her lips before , observed , in a sarcastic manner , and with a glance first at Maria and then at Edmund , that “ the Mansfield theatricals would enliven the whole neighbourhood exceedingly , ” Edmund still held his peace , and shewed his feelings only by a determined gravity . "
mansfield_7,2,178,"“ I am not very sanguine as to our play , ” said Miss Crawford , in an undervoice to Fanny , after some consideration ; “ and I can tell Mr. Maddox that I shall shorten some of _ his _ speeches , and a great many of _ my _ _ own _ , before we rehearse together . ","“ I am not very sanguine as to our play , ” said Miss Crawford , in an undervoice to Fanny , after some consideration ; “ and I can tell Mr. Maddox that I shall shorten some of _ his _ speeches , and a great many of _ my _ _ own _ , before we rehearse together . "
mansfield_7,2,179,"It will be very disagreeable , and by no means what I expected . ” ","It will be very disagreeable , and by no means what I expected . ” "
