fic_id,chapter_id,para_id,text,text_tokenized
mansfield_10,1,81,"Her sensations were indefinable , and so were they a few minutes afterwards upon hearing Henry Crawford , who had a chair between herself and Tom , ask the latter in an undervoice whether there were any plans for resuming the play after the present happy interruption ( with a courteous glance at Sir Thomas ) , because , in that case , he should make a point of returning to Mansfield at any time required by the party : he was going away immediately , being to meet his uncle at Bath without delay ; but if there were any prospect of a renewal of Lovers ’ Vows , he should hold himself positively engaged , he should break through every other claim , he should absolutely condition with his uncle for attending them whenever he might be wanted . ","Her sensations were indefinable , and so were they a few minutes afterwards upon hearing Henry Crawford , who had a chair between herself and Tom , ask the latter in an undervoice whether there were any plans for resuming the play after the present happy interruption ( with a courteous glance at Sir Thomas ) , because , in that case , he should make a point of returning to Mansfield at any time required by the party : he was going away immediately , being to meet his uncle at Bath without delay ; but if there were any prospect of a renewal of Lovers ’ Vows , he should hold himself positively engaged , he should break through every other claim , he should absolutely condition with his uncle for attending them whenever he might be wanted . "
mansfield_10,1,82,The play should not be lost by _ his _ absence . ,The play should not be lost by _ his _ absence . 
mansfield_10,1,83,"“ From Bath , Norfolk , London , York , wherever I may be , ” said he ; “ I will attend you from any place in England , at an hour ’s notice . ” It was well at that moment that Tom had to speak , and not his sister . ","“ From Bath , Norfolk , London , York , wherever I may be , ” said he ; “ I will attend you from any place in England , at an hour ’s notice . ” It was well at that moment that Tom had to speak , and not his sister . "
mansfield_10,1,84,"He could immediately say with easy fluency , “ I am sorry you are going ; but as to our play , _ that _ is all over — entirely at an end ” ( looking significantly at his father ) . ","He could immediately say with easy fluency , “ I am sorry you are going ; but as to our play , _ that _ is all over — entirely at an end ” ( looking significantly at his father ) . "
mansfield_10,1,85,"“ The painter was sent off yesterday , and very little will remain of the theatre to - morrow . ","“ The painter was sent off yesterday , and very little will remain of the theatre to - morrow . "
mansfield_10,1,86,I knew how _ that _ would be from the first . ,I knew how _ that _ would be from the first . 
mansfield_10,1,87,It is early for Bath . ,It is early for Bath . 
mansfield_10,1,88,You will find nobody there . ” ,You will find nobody there . ” 
mansfield_10,1,89,"“ It is about my uncle ’s usual time . ” “ When do you think of going ? ” “ I may , perhaps , get as far as Banbury to - day . ” ","“ It is about my uncle ’s usual time . ” “ When do you think of going ? ” “ I may , perhaps , get as far as Banbury to - day . ” "
mansfield_10,1,90,"“ Whose stables do you use at Bath ? ” was the next question ; and while this branch of the subject was under discussion , Maria , who wanted neither pride nor resolution , was preparing to encounter her share of it with tolerable calmness . ","“ Whose stables do you use at Bath ? ” was the next question ; and while this branch of the subject was under discussion , Maria , who wanted neither pride nor resolution , was preparing to encounter her share of it with tolerable calmness . "
mansfield_10,1,91,"To her he soon turned , repeating much of what he had already said , with only a softened air and stronger expressions of regret . ","To her he soon turned , repeating much of what he had already said , with only a softened air and stronger expressions of regret . "
mansfield_10,1,92,But what availed his expressions or his air ? ,But what availed his expressions or his air ? 
mansfield_10,1,93,"He was going , and , if not voluntarily going , voluntarily intending to stay away ; for , excepting what might be due to his uncle , his engagements were all self - imposed . He might talk of necessity , but she knew his independence . ","He was going , and , if not voluntarily going , voluntarily intending to stay away ; for , excepting what might be due to his uncle , his engagements were all self - imposed . He might talk of necessity , but she knew his independence . "
mansfield_10,1,94,The hand which had so pressed hers to his heart ! the hand and the heart were alike motionless and passive now ! ,The hand which had so pressed hers to his heart ! the hand and the heart were alike motionless and passive now ! 
mansfield_10,1,95,"Her spirit supported her , but the agony of her mind was severe . ","Her spirit supported her , but the agony of her mind was severe . "
mansfield_10,1,96,"She had not long to endure what arose from listening to language which his actions contradicted , or to bury the tumult of her feelings under the restraint of society ; for general civilities soon called his notice from her , and the farewell visit , as it then became openly acknowledged , was a very short one . ","She had not long to endure what arose from listening to language which his actions contradicted , or to bury the tumult of her feelings under the restraint of society ; for general civilities soon called his notice from her , and the farewell visit , as it then became openly acknowledged , was a very short one . "
mansfield_10,1,97,"He was gone — he had touched her hand for the last time , he had made his parting bow , and she might seek directly all that solitude could do for her . Henry Crawford was gone , gone from the house , and within two hours afterwards from the parish ; and so ended all the hopes his selfish vanity had raised in Maria and Julia Bertram . ","He was gone — he had touched her hand for the last time , he had made his parting bow , and she might seek directly all that solitude could do for her . Henry Crawford was gone , gone from the house , and within two hours afterwards from the parish ; and so ended all the hopes his selfish vanity had raised in Maria and Julia Bertram . "
mansfield_10,1,98,Julia could rejoice that he was gone . ,Julia could rejoice that he was gone . 
mansfield_10,1,99,"His presence was beginning to be odious to her ; and if Maria gained him not , she was now cool enough to dispense with any other revenge . ","His presence was beginning to be odious to her ; and if Maria gained him not , she was now cool enough to dispense with any other revenge . "
mansfield_10,1,100,She did not want exposure to be added to desertion . ,She did not want exposure to be added to desertion . 
mansfield_10,1,101,"Henry Crawford gone , she could even pity her sister . ","Henry Crawford gone , she could even pity her sister . "
mansfield_10,1,102,With a purer spirit did Fanny rejoice in the intelligence . ,With a purer spirit did Fanny rejoice in the intelligence . 
mansfield_10,1,103,"She heard it at dinner , and felt it a blessing . ","She heard it at dinner , and felt it a blessing . "
mansfield_10,1,104,"By all the others it was mentioned with regret ; and his merits honoured with due gradation of feeling — from the sincerity of Edmund ’s too partial regard , to the unconcern of his mother speaking entirely by rote . ","By all the others it was mentioned with regret ; and his merits honoured with due gradation of feeling — from the sincerity of Edmund ’s too partial regard , to the unconcern of his mother speaking entirely by rote . "
mansfield_10,1,105,"Mrs. Norris began to look about her , and wonder that his falling in love with Julia had come to nothing ; and could almost fear that she had been remiss herself in forwarding it ; but with so many to care for , how was it possible for even _ her _ activity to keep pace with her wishes ? ","Mrs. Norris began to look about her , and wonder that his falling in love with Julia had come to nothing ; and could almost fear that she had been remiss herself in forwarding it ; but with so many to care for , how was it possible for even _ her _ activity to keep pace with her wishes ? "
mansfield_10,1,106,"Another day or two , and Mr. Yates was gone likewise . ","Another day or two , and Mr. Yates was gone likewise . "
mansfield_10,1,107,"In _ his _ departure Sir Thomas felt the chief interest : wanting to be alone with his family , the presence of a stranger superior to Mr. Yates must have been irksome ; but of him , trifling and confident , idle and expensive , it was every way vexatious . ","In _ his _ departure Sir Thomas felt the chief interest : wanting to be alone with his family , the presence of a stranger superior to Mr. Yates must have been irksome ; but of him , trifling and confident , idle and expensive , it was every way vexatious . "
mansfield_10,1,108,"In himself he was wearisome , but as the friend of Tom and the admirer of Julia he became offensive . ","In himself he was wearisome , but as the friend of Tom and the admirer of Julia he became offensive . "
mansfield_10,1,109,"Sir Thomas had been quite indifferent to Mr. Crawford ’s going or staying : but his good wishes for Mr. Yates ’s having a pleasant journey , as he walked with him to the hall - door , were given with genuine satisfaction . ","Sir Thomas had been quite indifferent to Mr. Crawford ’s going or staying : but his good wishes for Mr. Yates ’s having a pleasant journey , as he walked with him to the hall - door , were given with genuine satisfaction . "
mansfield_10,1,110,"Mr. Yates had staid to see the destruction of every theatrical preparation at Mansfield , the removal of everything appertaining to the play : he left the house in all the soberness of its general character ; and ","Mr. Yates had staid to see the destruction of every theatrical preparation at Mansfield , the removal of everything appertaining to the play : he left the house in all the soberness of its general character ; and "
mansfield_10,1,111,"Sir Thomas hoped , in seeing him out of it , to be rid of the worst object connected with the scheme , and the last that must be inevitably reminding him of its existence . ","Sir Thomas hoped , in seeing him out of it , to be rid of the worst object connected with the scheme , and the last that must be inevitably reminding him of its existence . "
mansfield_10,1,112,Mrs. Norris contrived to remove one article from his sight that might have distressed him . ,Mrs. Norris contrived to remove one article from his sight that might have distressed him . 
mansfield_10,1,113,"The curtain , over which she had presided with such talent and such success , went off with her to her cottage , where she happened to be particularly in want of green baize . ","The curtain , over which she had presided with such talent and such success , went off with her to her cottage , where she happened to be particularly in want of green baize . "
mansfield_10,2,1, XXI , XXI 
mansfield_10,2,2,"Sir Thomas ’s return made a striking change in the ways of the family , independent of Lovers ’ Vows . ","Sir Thomas ’s return made a striking change in the ways of the family , independent of Lovers ’ Vows . "
mansfield_10,2,3,"Under his government , Mansfield was an altered place . ","Under his government , Mansfield was an altered place . "
mansfield_10,2,4,"Some members of their society sent away , and the spirits of many others saddened — it was all sameness and gloom compared with the past — a sombre family party rarely enlivened . ","Some members of their society sent away , and the spirits of many others saddened — it was all sameness and gloom compared with the past — a sombre family party rarely enlivened . "
mansfield_10,2,5,There was little intercourse with the Parsonage . ,There was little intercourse with the Parsonage . 
mansfield_10,2,6,"Sir Thomas , drawing back from intimacies in general , was particularly disinclined , at this time , for any engagements but in one quarter . ","Sir Thomas , drawing back from intimacies in general , was particularly disinclined , at this time , for any engagements but in one quarter . "
mansfield_10,2,7,The Rushworths were the only addition to his own domestic circle which he could solicit . ,The Rushworths were the only addition to his own domestic circle which he could solicit . 
mansfield_10,2,8,"Edmund did not wonder that such should be his father ’s feelings , nor could he regret anything but the exclusion of the Grants . ","Edmund did not wonder that such should be his father ’s feelings , nor could he regret anything but the exclusion of the Grants . "
mansfield_10,2,9,"“ But they , ” he observed to Fanny , “ have a claim . ","“ But they , ” he observed to Fanny , “ have a claim . "
mansfield_10,2,10,They seem to belong to us ; they ,They seem to belong to us ; they 
mansfield_10,2,11,seem to be part of ourselves . ,seem to be part of ourselves . 
mansfield_10,2,12,I could wish my father were more sensible of their very great attention to my mother and sisters while he was away . ,I could wish my father were more sensible of their very great attention to my mother and sisters while he was away . 
mansfield_10,2,13,I am afraid they may feel themselves neglected . ,I am afraid they may feel themselves neglected . 
mansfield_10,2,14,"But the truth is , that my father hardly knows them . ","But the truth is , that my father hardly knows them . "
mansfield_10,2,15,They had not been here a twelvemonth when he left England . ,They had not been here a twelvemonth when he left England . 
mansfield_10,2,16,"If he knew them better , he would value their society as it deserves ; for they are in fact exactly the sort of people he would like . ","If he knew them better , he would value their society as it deserves ; for they are in fact exactly the sort of people he would like . "
mansfield_10,2,17,"We are sometimes a little in want of animation among ourselves : my sisters seem out of spirits , and Tom is certainly not at his ease . ","We are sometimes a little in want of animation among ourselves : my sisters seem out of spirits , and Tom is certainly not at his ease . "
mansfield_10,2,18,"Dr. and Mrs. Grant would enliven us , and make our evenings pass away with more enjoyment even to my father . ","Dr. and Mrs. Grant would enliven us , and make our evenings pass away with more enjoyment even to my father . "
mansfield_10,2,19,” ,” 
mansfield_10,2,20,"“ Do you think so ? ” said Fanny : “ in my opinion , my uncle would not like _ any _ addition . ","“ Do you think so ? ” said Fanny : “ in my opinion , my uncle would not like _ any _ addition . "
mansfield_10,2,21,"I think he values the very quietness you speak of , and that the repose of his own family circle is all he wants . ","I think he values the very quietness you speak of , and that the repose of his own family circle is all he wants . "
mansfield_10,2,22,And it does not appear to me that we are more serious than we used to be — I mean before my uncle went abroad . ,And it does not appear to me that we are more serious than we used to be — I mean before my uncle went abroad . 
mansfield_10,2,23,"As well as I can recollect , it was always much the same . ","As well as I can recollect , it was always much the same . "
mansfield_10,2,24,"There was never much laughing in his presence ; or , if there is any difference , it is not more , I think , than such an absence has a tendency to produce at first . ","There was never much laughing in his presence ; or , if there is any difference , it is not more , I think , than such an absence has a tendency to produce at first . "
mansfield_10,2,25,There must be a sort of shyness ; ,There must be a sort of shyness ; 
mansfield_10,2,26,"but I can not recollect that our evenings formerly were ever merry , except when my uncle was in town . ","but I can not recollect that our evenings formerly were ever merry , except when my uncle was in town . "
mansfield_10,2,27,"No young people ’s are , I suppose , when those they look up to are at home ” . ","No young people ’s are , I suppose , when those they look up to are at home ” . "
mansfield_10,2,28,"“ I believe you are right , Fanny , ” was his reply , after a short consideration . ","“ I believe you are right , Fanny , ” was his reply , after a short consideration . "
mansfield_10,2,29,"“ I believe our evenings are rather returned to what they were , than assuming a new character . ","“ I believe our evenings are rather returned to what they were , than assuming a new character . "
mansfield_10,2,30,The novelty was in their being lively . ,The novelty was in their being lively . 
mansfield_10,2,31,"Yet , how strong the impression that only a few weeks will give ! ","Yet , how strong the impression that only a few weeks will give ! "
mansfield_10,2,32,"I have been feeling as if we had never lived so before . ” “ I suppose I am graver than other people , ” said Fanny . ","I have been feeling as if we had never lived so before . ” “ I suppose I am graver than other people , ” said Fanny . "
mansfield_10,2,33,“ The evenings do not appear long to me . ,“ The evenings do not appear long to me . 
mansfield_10,2,34,I love to hear my uncle talk of the West Indies . ,I love to hear my uncle talk of the West Indies . 
mansfield_10,2,35,I could listen to him for an hour together . ,I could listen to him for an hour together . 
mansfield_10,2,36,"It entertains _ me _ more than many other things have done ; but then I am unlike other people , I dare say . ” ","It entertains _ me _ more than many other things have done ; but then I am unlike other people , I dare say . ” "
mansfield_10,2,37,“ Why should you dare say _ that _ ? ” ( smiling ) . ,“ Why should you dare say _ that _ ? ” ( smiling ) . 
mansfield_10,2,38,“ Do you want to be told that you are only unlike other people in being more wise and discreet ? ,“ Do you want to be told that you are only unlike other people in being more wise and discreet ? 
mansfield_10,2,39,"But when did you , or anybody , ever get a compliment from me , Fanny ? ","But when did you , or anybody , ever get a compliment from me , Fanny ? "
mansfield_10,2,40,Go to my father if you want to be complimented . ,Go to my father if you want to be complimented . 
mansfield_10,2,41,He will satisfy you . ,He will satisfy you . 
mansfield_10,2,42,"Ask your uncle what he thinks , and you will hear compliments enough : and ","Ask your uncle what he thinks , and you will hear compliments enough : and "
mansfield_10,2,43,"though they may be chiefly on your person , you must put up with it , and trust to his seeing as much beauty of mind in time . ” Such language was so new to Fanny that it quite embarrassed her . “ Your uncle thinks you very pretty , dear Fanny — and that is the long and the short of the matter . ","though they may be chiefly on your person , you must put up with it , and trust to his seeing as much beauty of mind in time . ” Such language was so new to Fanny that it quite embarrassed her . “ Your uncle thinks you very pretty , dear Fanny — and that is the long and the short of the matter . "
mansfield_10,2,44,"Anybody but myself would have made something more of it , and anybody but you would resent that you had not been thought very pretty before ; but the truth is , that your uncle never did admire you till now — and now he does . ","Anybody but myself would have made something more of it , and anybody but you would resent that you had not been thought very pretty before ; but the truth is , that your uncle never did admire you till now — and now he does . "
mansfield_10,2,45,Your complexion is so improved!—and you have gained so much countenance!—and your figure ,Your complexion is so improved!—and you have gained so much countenance!—and your figure 
mansfield_10,2,46,"— nay , Fanny , do not turn away about it — it is but an uncle . ","— nay , Fanny , do not turn away about it — it is but an uncle . "
mansfield_10,2,47,If you can not bear an uncle ’s admiration ,If you can not bear an uncle ’s admiration 
mansfield_10,2,48,", what is to become of you ? ",", what is to become of you ? "
mansfield_10,2,49,You must really begin to harden yourself to the idea of being worth looking at . ,You must really begin to harden yourself to the idea of being worth looking at . 
mansfield_10,2,50,You must try not to mind growing up into a pretty woman . ,You must try not to mind growing up into a pretty woman . 
mansfield_10,2,51,” ,” 
mansfield_10,2,52,“ Oh ! ,“ Oh ! 
mansfield_10,2,53,"do n’t talk so , do n’t talk so , ” cried Fanny , distressed by more feelings than he was aware of ; but seeing that she was distressed , he had done with the subject , and only added more seriously — “ Your uncle is disposed to be pleased with you in every respect ; and ","do n’t talk so , do n’t talk so , ” cried Fanny , distressed by more feelings than he was aware of ; but seeing that she was distressed , he had done with the subject , and only added more seriously — “ Your uncle is disposed to be pleased with you in every respect ; and "
mansfield_10,2,54,I only wish you would talk to him more . ,I only wish you would talk to him more . 
mansfield_10,2,55,You are one of those who are too silent in the evening circle . ” ,You are one of those who are too silent in the evening circle . ” 
mansfield_10,2,56,“ But I do talk to him more than I used . ,“ But I do talk to him more than I used . 
mansfield_10,2,57,I am sure I do . ,I am sure I do . 
mansfield_10,2,58,Did not you hear me ask him about the slave - trade last night ? ” ,Did not you hear me ask him about the slave - trade last night ? ” 
mansfield_10,2,59,“ I did — and was in hopes the question would be followed up by others . ,“ I did — and was in hopes the question would be followed up by others . 
mansfield_10,2,60,It would have pleased your uncle to be inquired of farther . ” ,It would have pleased your uncle to be inquired of farther . ” 
mansfield_10,2,61,“ And I longed to do it — but there was such a dead silence ! ,“ And I longed to do it — but there was such a dead silence ! 
mansfield_10,2,62,"And while my cousins were sitting by without speaking a word , or seeming at all interested in the subject , I did not like — I thought it would appear as if I wanted to set myself off at their expense , by shewing a curiosity and pleasure in his information which he must wish his own daughters to feel . ” ","And while my cousins were sitting by without speaking a word , or seeming at all interested in the subject , I did not like — I thought it would appear as if I wanted to set myself off at their expense , by shewing a curiosity and pleasure in his information which he must wish his own daughters to feel . ” "
mansfield_10,2,63,“ Miss Crawford was very right in what she said of you the other day : that you seemed almost as fearful of notice and praise as other women were of neglect . ,“ Miss Crawford was very right in what she said of you the other day : that you seemed almost as fearful of notice and praise as other women were of neglect . 
mansfield_10,2,64,"We were talking of you at the Parsonage , and those were her words . ","We were talking of you at the Parsonage , and those were her words . "
mansfield_10,2,65,She has great discernment . ,She has great discernment . 
mansfield_10,2,66,I know nobody who distinguishes characters better . ,I know nobody who distinguishes characters better . 
mansfield_10,2,67,For so young a woman it is remarkable ! ,For so young a woman it is remarkable ! 
mansfield_10,2,68,"She certainly understands _ you _ better than you are understood by the greater part of those who have known you so long ; and with regard to some others , I can perceive , from occasional lively hints , the unguarded expressions of the moment , that she could define _ many _ as accurately , did not delicacy forbid it . ","She certainly understands _ you _ better than you are understood by the greater part of those who have known you so long ; and with regard to some others , I can perceive , from occasional lively hints , the unguarded expressions of the moment , that she could define _ many _ as accurately , did not delicacy forbid it . "
mansfield_10,2,69,I wonder what she thinks of my father ! ,I wonder what she thinks of my father ! 
mansfield_10,2,70,"She must admire him as a fine - looking man , with most gentlemanlike , dignified , consistent manners ; but perhaps , having seen him so seldom , his reserve may be a little repulsive . ","She must admire him as a fine - looking man , with most gentlemanlike , dignified , consistent manners ; but perhaps , having seen him so seldom , his reserve may be a little repulsive . "
mansfield_10,2,71,"Could they be much together , I feel sure of their liking each other . ","Could they be much together , I feel sure of their liking each other . "
mansfield_10,2,72,He would enjoy her liveliness and she has talents to value his powers . ,He would enjoy her liveliness and she has talents to value his powers . 
mansfield_10,2,73,I wish they met more frequently ! ,I wish they met more frequently ! 
mansfield_10,2,74,I hope she does not suppose there is any dislike on his side . ” ,I hope she does not suppose there is any dislike on his side . ” 
