fic_id,chapter_id,para_id,text,text_tokenized
mansfield_2,2,173,"Miss Augusta ought not to have been noticed for the next six months ; and Miss Sneyd , I believe , has never forgiven me . ","Miss Augusta ought not to have been noticed for the next six months ; and Miss Sneyd , I believe , has never forgiven me . "
mansfield_2,2,174,” “ That was bad indeed . ,” “ That was bad indeed . 
mansfield_2,2,175,Poor Miss Sneyd . ,Poor Miss Sneyd . 
mansfield_2,2,176,"Though I have no younger sister , I feel for her . ","Though I have no younger sister , I feel for her . "
mansfield_2,2,177,To be neglected before one ’s time must be very vexatious ; but it was entirely the mother ’s fault . ,To be neglected before one ’s time must be very vexatious ; but it was entirely the mother ’s fault . 
mansfield_2,2,178,Miss Augusta should have been with her governess . ,Miss Augusta should have been with her governess . 
mansfield_2,2,179,Such half - and - half doings never prosper . ,Such half - and - half doings never prosper . 
mansfield_2,2,180,But now I must be satisfied about Miss Price . ,But now I must be satisfied about Miss Price . 
mansfield_2,2,181,Does she go to balls ? ,Does she go to balls ? 
mansfield_2,2,182,"Does she dine out every where , as well as at my sister ’s ? ” “ No , ” replied Edmund ; “ I do not think she has ever been to a ball . ","Does she dine out every where , as well as at my sister ’s ? ” “ No , ” replied Edmund ; “ I do not think she has ever been to a ball . "
mansfield_2,2,183,"My mother seldom goes into company herself , and dines nowhere but with Mrs. Grant , and Fanny stays at home with _ her _ . ” ","My mother seldom goes into company herself , and dines nowhere but with Mrs. Grant , and Fanny stays at home with _ her _ . ” "
mansfield_2,2,184,“ Oh ! ,“ Oh ! 
mansfield_2,2,185,then the point is clear . ,then the point is clear . 
mansfield_2,2,186,Miss Price is not out . ” ,Miss Price is not out . ” 
