fic_id,chapter_id,para_id,text,text_tokenized
mansfield_7,1,120,"When you have studied the character , I am sure you will feel it suit you . ","When you have studied the character , I am sure you will feel it suit you . "
mansfield_7,1,121,"Tragedy may be your choice , but it will certainly appear that comedy chuses _ you _ . ","Tragedy may be your choice , but it will certainly appear that comedy chuses _ you _ . "
mansfield_7,1,122,You will be to visit me in prison with a basket of provisions ,You will be to visit me in prison with a basket of provisions 
mansfield_7,1,123,; you will not refuse to visit me in prison ? ,; you will not refuse to visit me in prison ? 
mansfield_7,1,124,I think I see you coming in with your basket . ” The influence of his voice was felt . ,I think I see you coming in with your basket . ” The influence of his voice was felt . 
mansfield_7,1,125,"Julia wavered ; but was he only trying to soothe and pacify her , and make her overlook the previous affront ? ","Julia wavered ; but was he only trying to soothe and pacify her , and make her overlook the previous affront ? "
mansfield_7,1,126,She distrusted him . ,She distrusted him . 
mansfield_7,1,127,The slight had been most determined . ,The slight had been most determined . 
mansfield_7,1,128,"He was , perhaps , but at treacherous play with her . ","He was , perhaps , but at treacherous play with her . "
mansfield_7,1,129,"She looked suspiciously at her sister ; Maria ’s countenance was to decide it : if she were vexed and alarmed — but Maria looked all serenity and satisfaction , and Julia well knew that on this ground Maria could not be happy but at her expense . ","She looked suspiciously at her sister ; Maria ’s countenance was to decide it : if she were vexed and alarmed — but Maria looked all serenity and satisfaction , and Julia well knew that on this ground Maria could not be happy but at her expense . "
mansfield_7,1,130,"With hasty indignation , therefore , and a tremulous voice , she said to him , “ You do not seem afraid of not keeping your countenance when I come in with a basket of provisions — though one might have supposed — but it is only as Agatha that I was to be so overpowering ! ” ","With hasty indignation , therefore , and a tremulous voice , she said to him , “ You do not seem afraid of not keeping your countenance when I come in with a basket of provisions — though one might have supposed — but it is only as Agatha that I was to be so overpowering ! ” "
mansfield_7,1,131,"She stopped — Henry Crawford looked rather foolish , and as if he did not know what to say . ","She stopped — Henry Crawford looked rather foolish , and as if he did not know what to say . "
mansfield_7,1,132,Tom Bertram began again — “ Miss Crawford must be Amelia . ,Tom Bertram began again — “ Miss Crawford must be Amelia . 
mansfield_7,1,133,She will be an excellent Amelia . ,She will be an excellent Amelia . 
mansfield_7,1,134,” ,” 
mansfield_7,1,135,"“ Do not be afraid of _ my _ wanting the character , ” cried Julia , with angry quickness : “ I am _ not _ to be Agatha , and I am sure I will do nothing else ; and as to Amelia , it is of all parts in the world the most disgusting to me . ","“ Do not be afraid of _ my _ wanting the character , ” cried Julia , with angry quickness : “ I am _ not _ to be Agatha , and I am sure I will do nothing else ; and as to Amelia , it is of all parts in the world the most disgusting to me . "
mansfield_7,1,136,I quite detest her . ,I quite detest her . 
mansfield_7,1,137,"An odious , little , pert , unnatural , impudent girl . ","An odious , little , pert , unnatural , impudent girl . "
mansfield_7,1,138,"I have always protested against comedy , and this is comedy in its worst form . ” ","I have always protested against comedy , and this is comedy in its worst form . ” "
mansfield_7,1,139,"And so saying , she walked hastily out of the room , leaving awkward feelings to more than one , but exciting small compassion in any except Fanny , who had been a quiet auditor of the whole , and who could not think of her as under the agitations of _ jealousy _ without great pity . ","And so saying , she walked hastily out of the room , leaving awkward feelings to more than one , but exciting small compassion in any except Fanny , who had been a quiet auditor of the whole , and who could not think of her as under the agitations of _ jealousy _ without great pity . "
mansfield_7,1,140,"A short silence succeeded her leaving them ; but her brother soon returned to business and Lovers ’ Vows , and was eagerly looking over the play , with Mr. Yates ’s help , to ascertain what scenery would be necessary — while Maria and Henry Crawford conversed together in an under - voice , and the declaration with which she began of , “ I am sure I would give up the part to Julia most willingly , but that though I shall probably do it very ill , I feel persuaded _ she _ would do it worse , ” was doubtless receiving all the compliments it called for . ","A short silence succeeded her leaving them ; but her brother soon returned to business and Lovers ’ Vows , and was eagerly looking over the play , with Mr. Yates ’s help , to ascertain what scenery would be necessary — while Maria and Henry Crawford conversed together in an under - voice , and the declaration with which she began of , “ I am sure I would give up the part to Julia most willingly , but that though I shall probably do it very ill , I feel persuaded _ she _ would do it worse , ” was doubtless receiving all the compliments it called for . "
mansfield_7,1,141,"When this had lasted some time , the division of the party was completed by Tom Bertram and Mr. Yates walking off together to consult farther in the room now beginning to be called _ the _ _ Theatre _ , and Miss Bertram ’s resolving to go down to the Parsonage herself with the offer of Amelia to Miss Crawford ; and Fanny remained alone . ","When this had lasted some time , the division of the party was completed by Tom Bertram and Mr. Yates walking off together to consult farther in the room now beginning to be called _ the _ _ Theatre _ , and Miss Bertram ’s resolving to go down to the Parsonage herself with the offer of Amelia to Miss Crawford ; and Fanny remained alone . "
mansfield_7,1,142,"The first use she made of her solitude was to take up the volume which had been left on the table , and begin to acquaint herself with the play of which she had heard so much . ","The first use she made of her solitude was to take up the volume which had been left on the table , and begin to acquaint herself with the play of which she had heard so much . "
mansfield_7,1,143,"Her curiosity was all awake , and she ran through it with an eagerness which was suspended only by intervals of astonishment , that it could be chosen in the present instance , that it could be proposed and accepted in a private theatre ! ","Her curiosity was all awake , and she ran through it with an eagerness which was suspended only by intervals of astonishment , that it could be chosen in the present instance , that it could be proposed and accepted in a private theatre ! "
mansfield_7,1,144,"Agatha and Amelia appeared to her in their different ways so totally improper for home representation — the situation of one , and the language of the other , so unfit to be expressed by any woman of modesty , that she could hardly suppose her cousins could be aware of what they were engaging in ; and longed to have them roused as soon as possible by the remonstrance which Edmund would certainly make . ","Agatha and Amelia appeared to her in their different ways so totally improper for home representation — the situation of one , and the language of the other , so unfit to be expressed by any woman of modesty , that she could hardly suppose her cousins could be aware of what they were engaging in ; and longed to have them roused as soon as possible by the remonstrance which Edmund would certainly make . "
mansfield_7,2,1, XV , XV 
mansfield_7,2,2,"Miss Crawford accepted the part very readily ; and soon after Miss Bertram ’s return from the Parsonage , Mr. Rushworth arrived , and another character was consequently cast . ","Miss Crawford accepted the part very readily ; and soon after Miss Bertram ’s return from the Parsonage , Mr. Rushworth arrived , and another character was consequently cast . "
mansfield_7,2,3,"He had the offer of Count Cassel and Anhalt , and at first did not know which to chuse , and wanted Miss Bertram to direct him ; but upon being made to understand the different style of the characters , and which was which , and recollecting that he had once seen the play in London , and had thought Anhalt a very stupid fellow , he soon decided for the Count . ","He had the offer of Count Cassel and Anhalt , and at first did not know which to chuse , and wanted Miss Bertram to direct him ; but upon being made to understand the different style of the characters , and which was which , and recollecting that he had once seen the play in London , and had thought Anhalt a very stupid fellow , he soon decided for the Count . "
mansfield_7,2,4,"Miss Bertram approved the decision , for the less he had to learn the better ; and though she could not sympathise in his wish that the Count and Agatha might be to act together , nor wait very patiently while he was slowly turning over the ","Miss Bertram approved the decision , for the less he had to learn the better ; and though she could not sympathise in his wish that the Count and Agatha might be to act together , nor wait very patiently while he was slowly turning over the "
mansfield_7,2,5,leaves with the hope of still discovering such a scene ,leaves with the hope of still discovering such a scene 
mansfield_7,2,6,", she very kindly took his part in hand , and curtailed every speech that admitted being shortened ; besides pointing out the necessity of his being very much dressed , and chusing his colours . ",", she very kindly took his part in hand , and curtailed every speech that admitted being shortened ; besides pointing out the necessity of his being very much dressed , and chusing his colours . "
mansfield_7,2,7,"Mr. Rushworth liked the idea of his finery very well , though affecting to despise it ; and was too much engaged with what his own appearance would be to think of the others , or draw any of those conclusions , or feel any of that displeasure which Maria had been half prepared for . Thus much was settled before Edmund , who had been out all the morning , knew anything of the matter ; but when he entered the drawing - room before dinner , the buzz of discussion was high between Tom , Maria , and Mr. Yates ; and Mr. Rushworth stepped forward with great alacrity to tell him the agreeable news . ","Mr. Rushworth liked the idea of his finery very well , though affecting to despise it ; and was too much engaged with what his own appearance would be to think of the others , or draw any of those conclusions , or feel any of that displeasure which Maria had been half prepared for . Thus much was settled before Edmund , who had been out all the morning , knew anything of the matter ; but when he entered the drawing - room before dinner , the buzz of discussion was high between Tom , Maria , and Mr. Yates ; and Mr. Rushworth stepped forward with great alacrity to tell him the agreeable news . "
mansfield_7,2,8,"“ We have got a play , ” said he . ","“ We have got a play , ” said he . "
mansfield_7,2,9,"“ It is to be Lovers ’ Vows ; and I am to be Count Cassel , and am to come in first with a blue dress and a pink satin cloak , and afterwards am to have another fine fancy suit , by way of a shooting - dress . ","“ It is to be Lovers ’ Vows ; and I am to be Count Cassel , and am to come in first with a blue dress and a pink satin cloak , and afterwards am to have another fine fancy suit , by way of a shooting - dress . "
mansfield_7,2,10,I do not know how I shall like it . ” ,I do not know how I shall like it . ” 
mansfield_7,2,11,"Fanny ’s eyes followed Edmund , and her heart beat for him as she heard this speech , and saw his look , and felt what his sensations must be . ","Fanny ’s eyes followed Edmund , and her heart beat for him as she heard this speech , and saw his look , and felt what his sensations must be . "
mansfield_7,2,12,"“ Lovers ’ Vows ! ” in a tone of the greatest amazement , was his only reply to Mr. Rushworth , and he turned towards his brother and sisters as if hardly doubting a contradiction . ","“ Lovers ’ Vows ! ” in a tone of the greatest amazement , was his only reply to Mr. Rushworth , and he turned towards his brother and sisters as if hardly doubting a contradiction . "
mansfield_7,2,13,"“ Yes , ” cried Mr. Yates . ","“ Yes , ” cried Mr. Yates . "
mansfield_7,2,14,"“ After all our debatings and difficulties , we find there is nothing that will suit us altogether so well , nothing so unexceptionable , as Lovers ’ Vows . ","“ After all our debatings and difficulties , we find there is nothing that will suit us altogether so well , nothing so unexceptionable , as Lovers ’ Vows . "
mansfield_7,2,15,The wonder is that it should not have been thought of before . ,The wonder is that it should not have been thought of before . 
mansfield_7,2,16,"My stupidity was abominable , for here we have all the advantage of what I saw at Ecclesford ; and it is so useful to have anything of a model ! ","My stupidity was abominable , for here we have all the advantage of what I saw at Ecclesford ; and it is so useful to have anything of a model ! "
mansfield_7,2,17,We have cast almost every part . ” ,We have cast almost every part . ” 
mansfield_7,2,18,"“ But what do you do for women ? ” said Edmund gravely , and looking at Maria . ","“ But what do you do for women ? ” said Edmund gravely , and looking at Maria . "
mansfield_7,2,19,"Maria blushed in spite of herself as she answered , “ I take the part which Lady Ravenshaw was to have done , and ” ( with a bolder eye ) “ Miss Crawford is to be Amelia . ” “ I should not have thought it the sort of play to be so easily filled up , with _ us _ , ” replied Edmund , turning away to the fire , where sat his mother , aunt , and Fanny , and seating himself with a look of great vexation . ","Maria blushed in spite of herself as she answered , “ I take the part which Lady Ravenshaw was to have done , and ” ( with a bolder eye ) “ Miss Crawford is to be Amelia . ” “ I should not have thought it the sort of play to be so easily filled up , with _ us _ , ” replied Edmund , turning away to the fire , where sat his mother , aunt , and Fanny , and seating himself with a look of great vexation . "
mansfield_7,2,20,"Mr. Rushworth followed him to say , “ I come in three times , and have two - and - forty speeches . ","Mr. Rushworth followed him to say , “ I come in three times , and have two - and - forty speeches . "
mansfield_7,2,21,"That ’s something , is not it ? ","That ’s something , is not it ? "
mansfield_7,2,22,But I do not much like the idea of being so fine . ,But I do not much like the idea of being so fine . 
mansfield_7,2,23,I shall hardly know myself in a blue dress and a pink satin cloak . ” ,I shall hardly know myself in a blue dress and a pink satin cloak . ” 
mansfield_7,2,24,Edmund could not answer him . ,Edmund could not answer him . 
mansfield_7,2,25,"In a few minutes Mr. Bertram was called out of the room to satisfy some doubts of the carpenter ; and being accompanied by Mr. Yates , and followed soon afterwards by Mr. Rushworth , Edmund almost immediately took the opportunity of saying , “ I can not , before Mr. Yates , speak what I feel as to this play , without reflecting on his friends at Ecclesford ; but I must now , my dear Maria , tell _ you _ , that I think it exceedingly unfit for private representation , and that I hope you will give it up . ","In a few minutes Mr. Bertram was called out of the room to satisfy some doubts of the carpenter ; and being accompanied by Mr. Yates , and followed soon afterwards by Mr. Rushworth , Edmund almost immediately took the opportunity of saying , “ I can not , before Mr. Yates , speak what I feel as to this play , without reflecting on his friends at Ecclesford ; but I must now , my dear Maria , tell _ you _ , that I think it exceedingly unfit for private representation , and that I hope you will give it up . "
mansfield_7,2,26,I can not but suppose you _ will _ when you have read it carefully over . ,I can not but suppose you _ will _ when you have read it carefully over . 
mansfield_7,2,27,"Read only the first act aloud to either your mother or aunt , and see how you can approve it . ","Read only the first act aloud to either your mother or aunt , and see how you can approve it . "
mansfield_7,2,28,"It will not be necessary to send you to your _ father ’s _ judgment , I am convinced . ” ","It will not be necessary to send you to your _ father ’s _ judgment , I am convinced . ” "
mansfield_7,2,29,"“ We see things very differently , ” cried Maria . ","“ We see things very differently , ” cried Maria . "
mansfield_7,2,30,"“ I am perfectly acquainted with the play , I assure you ; and with a very few omissions , and so forth , which will be made , of course , I can see nothing objectionable in it ; and _ I _ am not the _ only _ young woman you find who thinks it very fit for private representation . ” ","“ I am perfectly acquainted with the play , I assure you ; and with a very few omissions , and so forth , which will be made , of course , I can see nothing objectionable in it ; and _ I _ am not the _ only _ young woman you find who thinks it very fit for private representation . ” "
mansfield_7,2,31,"“ I am sorry for it , ” was his answer ; “ but in this matter it is _ you _ who are to lead . ","“ I am sorry for it , ” was his answer ; “ but in this matter it is _ you _ who are to lead . "
mansfield_7,2,32,_ You _ must set the example . ,_ You _ must set the example . 
mansfield_7,2,33,"If others have blundered , it is your place to put them right , and shew them what true delicacy is . ","If others have blundered , it is your place to put them right , and shew them what true delicacy is . "
mansfield_7,2,34,"In all points of decorum _ your _ conduct must be law to the rest of the party . ” This picture of her consequence had some effect , for no one loved better to lead than Maria ; and with far more good - humour she answered , “ I am much obliged to you , Edmund ; you mean very well , I am sure : but I still think you see things too strongly ; and I really can not undertake to harangue all the rest upon a subject of this kind . ","In all points of decorum _ your _ conduct must be law to the rest of the party . ” This picture of her consequence had some effect , for no one loved better to lead than Maria ; and with far more good - humour she answered , “ I am much obliged to you , Edmund ; you mean very well , I am sure : but I still think you see things too strongly ; and I really can not undertake to harangue all the rest upon a subject of this kind . "
mansfield_7,2,35,"_ There _ would be the greatest indecorum , I think . ” ","_ There _ would be the greatest indecorum , I think . ” "
mansfield_7,2,36,“ Do you imagine that I could have such an idea in my head ? ,“ Do you imagine that I could have such an idea in my head ? 
mansfield_7,2,37,No ; let your conduct be the only harangue . ,No ; let your conduct be the only harangue . 
mansfield_7,2,38,"Say that , on examining the part , you feel yourself unequal to it ; that you find it requiring more exertion and confidence than you can be supposed to have . ","Say that , on examining the part , you feel yourself unequal to it ; that you find it requiring more exertion and confidence than you can be supposed to have . "
mansfield_7,2,39,"Say this with firmness , and it will be quite enough . ","Say this with firmness , and it will be quite enough . "
mansfield_7,2,40,All who can distinguish will understand your motive . ,All who can distinguish will understand your motive . 
mansfield_7,2,41,"The play will be given up , and your delicacy honoured as it ought . ","The play will be given up , and your delicacy honoured as it ought . "
mansfield_7,2,42,” ,” 
mansfield_7,2,43,"“ Do not act anything improper , my dear , ” said Lady Bertram . ","“ Do not act anything improper , my dear , ” said Lady Bertram . "
mansfield_7,2,44,"“ Sir Thomas would not like it.—Fanny , ring the bell ; I must have my dinner.—To be sure , Julia is dressed by this time . ","“ Sir Thomas would not like it.—Fanny , ring the bell ; I must have my dinner.—To be sure , Julia is dressed by this time . "
mansfield_7,2,45,” ,” 
mansfield_7,2,46,"“ I am convinced , madam , ” said Edmund , preventing Fanny , “ that Sir Thomas would not like it . ” “ There , my dear , do you hear what Edmund says ? ” “ If I were to decline the part , ” said Maria , with renewed zeal , “ Julia would certainly take it . ” “ What ! ” cried Edmund , “ if she knew your reasons ! ” ","“ I am convinced , madam , ” said Edmund , preventing Fanny , “ that Sir Thomas would not like it . ” “ There , my dear , do you hear what Edmund says ? ” “ If I were to decline the part , ” said Maria , with renewed zeal , “ Julia would certainly take it . ” “ What ! ” cried Edmund , “ if she knew your reasons ! ” "
mansfield_7,2,47,“ Oh ! ,“ Oh ! 
mansfield_7,2,48,she might think the difference between us — the difference in our situations — that _ she _ need not be so scrupulous as _ I _ might feel necessary . ,she might think the difference between us — the difference in our situations — that _ she _ need not be so scrupulous as _ I _ might feel necessary . 
mansfield_7,2,49,I am sure she would argue so . ,I am sure she would argue so . 
mansfield_7,2,50,"No ; you must excuse me ; I can not retract my consent ; it is too far settled , everybody would be so disappointed , Tom would be quite angry ; and if we are so very nice , we shall never act anything . ” ","No ; you must excuse me ; I can not retract my consent ; it is too far settled , everybody would be so disappointed , Tom would be quite angry ; and if we are so very nice , we shall never act anything . ” "
mansfield_7,2,51,"“ I was just going to say the very same thing , ” said Mrs. Norris . ","“ I was just going to say the very same thing , ” said Mrs. Norris . "
mansfield_7,2,52,"“ If every play is to be objected to , you will act nothing , and the preparations will be all so much money thrown away , and I am sure _ that _ would be a discredit to us all . ","“ If every play is to be objected to , you will act nothing , and the preparations will be all so much money thrown away , and I am sure _ that _ would be a discredit to us all . "
mansfield_7,2,53,"I do not know the play ; but , as Maria says , if there is anything a little too warm ( and it is so with most of them ) it can be easily left out . ","I do not know the play ; but , as Maria says , if there is anything a little too warm ( and it is so with most of them ) it can be easily left out . "
mansfield_7,2,54,"We must not be over - precise , Edmund . ","We must not be over - precise , Edmund . "
mansfield_7,2,55,"As Mr. Rushworth is to act too , there can be no harm . ","As Mr. Rushworth is to act too , there can be no harm . "
mansfield_7,2,56,"I only wish Tom had known his own mind when the carpenters began , for there was the loss of half a day ’s work about those side - doors . ","I only wish Tom had known his own mind when the carpenters began , for there was the loss of half a day ’s work about those side - doors . "
mansfield_7,2,57,"The curtain will be a good job , however . ","The curtain will be a good job , however . "
mansfield_7,2,58,"The maids do their work very well , and I think we shall be able to send back some dozens of the rings . ","The maids do their work very well , and I think we shall be able to send back some dozens of the rings . "
mansfield_7,2,59,There is no occasion to put them so very close together . ,There is no occasion to put them so very close together . 
mansfield_7,2,60,"I _ am _ of some use , I hope , in preventing waste and making the most of things . ","I _ am _ of some use , I hope , in preventing waste and making the most of things . "
mansfield_7,2,61,There should ,There should 
mansfield_7,2,62,always be one steady head to superintend so many young ones . ,always be one steady head to superintend so many young ones . 
mansfield_7,2,63,I forgot to tell Tom of something that happened to me this very day . ,I forgot to tell Tom of something that happened to me this very day . 
mansfield_7,2,64,"I had been looking about me in the poultry - yard , and was just coming out , when who should I see but Dick Jackson making up to the servants ’ hall - door with two bits of deal board in his hand , bringing them to father , you may be sure ; mother had chanced to send him of a message to father , and then father had bid him bring up them two bits of board , for he could not no how do without them . ","I had been looking about me in the poultry - yard , and was just coming out , when who should I see but Dick Jackson making up to the servants ’ hall - door with two bits of deal board in his hand , bringing them to father , you may be sure ; mother had chanced to send him of a message to father , and then father had bid him bring up them two bits of board , for he could not no how do without them . "
