fic_id,chapter_id,para_id,text,text_tokenized
mansfield_2,1,47,"He could allow his sister to be the best judge of her own happiness , but he was not pleased that her happiness should centre in a large income ; nor could he refrain from ","He could allow his sister to be the best judge of her own happiness , but he was not pleased that her happiness should centre in a large income ; nor could he refrain from "
mansfield_2,1,48,"often saying to himself , in Mr. Rushworth ’s company—“If this man had not twelve thousand a year , he would be a very stupid fellow . ” ","often saying to himself , in Mr. Rushworth ’s company—“If this man had not twelve thousand a year , he would be a very stupid fellow . ” "
mansfield_2,1,49,"Sir Thomas , however , was truly happy in the prospect of an alliance so unquestionably advantageous , and of which he heard nothing but the perfectly good and agreeable . ","Sir Thomas , however , was truly happy in the prospect of an alliance so unquestionably advantageous , and of which he heard nothing but the perfectly good and agreeable . "
mansfield_2,1,50,"It was a connexion exactly of the right sort — in the same county , and the same interest — and his most hearty concurrence was conveyed as soon as possible . ","It was a connexion exactly of the right sort — in the same county , and the same interest — and his most hearty concurrence was conveyed as soon as possible . "
mansfield_2,1,51,"He only conditioned that the marriage should not take place before his return , which he was again looking eagerly forward to . ","He only conditioned that the marriage should not take place before his return , which he was again looking eagerly forward to . "
mansfield_2,1,52,"He wrote in April , and had strong hopes of settling everything to his entire satisfaction , and leaving Antigua before the end of the summer . ","He wrote in April , and had strong hopes of settling everything to his entire satisfaction , and leaving Antigua before the end of the summer . "
mansfield_2,1,53,"Such was the state of affairs in the month of July ; and Fanny had just reached her eighteenth year , when the society of the village received an addition in the brother and sister of Mrs. Grant , a Mr. and Miss Crawford , the children of her mother by a second marriage . ","Such was the state of affairs in the month of July ; and Fanny had just reached her eighteenth year , when the society of the village received an addition in the brother and sister of Mrs. Grant , a Mr. and Miss Crawford , the children of her mother by a second marriage . "
mansfield_2,1,54,They were young people of fortune . ,They were young people of fortune . 
mansfield_2,1,55,"The son had a good estate in Norfolk , the daughter twenty thousand pounds . ","The son had a good estate in Norfolk , the daughter twenty thousand pounds . "
mansfield_2,1,56,"As children , their sister had been always very fond of them ; but , as her own marriage had been soon followed by the death of their common parent , which left them to the care of a brother of their father , of whom Mrs. Grant knew nothing , she had scarcely seen them since . ","As children , their sister had been always very fond of them ; but , as her own marriage had been soon followed by the death of their common parent , which left them to the care of a brother of their father , of whom Mrs. Grant knew nothing , she had scarcely seen them since . "
mansfield_2,1,57,In their uncle ’s house they had found a kind home . ,In their uncle ’s house they had found a kind home . 
mansfield_2,1,58,"Admiral and Mrs. Crawford , though agreeing in nothing else , were united in affection for these children , or , at least , were no farther adverse in their feelings than that each had their favourite , to whom they showed the greatest fondness of the two . ","Admiral and Mrs. Crawford , though agreeing in nothing else , were united in affection for these children , or , at least , were no farther adverse in their feelings than that each had their favourite , to whom they showed the greatest fondness of the two . "
mansfield_2,1,59,The Admiral ,The Admiral 
mansfield_2,1,60,"delighted in the boy , Mrs. Crawford doted on the girl ; and it was the lady ’s death which now obliged her _ protegee _ , after some months ’ further trial at her uncle ’s house , to find another home . Admiral Crawford was a man of vicious conduct , who chose , instead of retaining his niece , to bring his mistress under his own roof ; and to this Mrs. Grant was indebted for her sister ’s proposal of coming to her , a measure quite as welcome on one side as it could be expedient on the other ; for Mrs. Grant , having by this time run through the usual resources of ladies residing in the country without a family of children — having more than filled her favourite sitting - room with pretty furniture , and made a choice collection of plants and poultry — was very much in want of some variety at home . ","delighted in the boy , Mrs. Crawford doted on the girl ; and it was the lady ’s death which now obliged her _ protegee _ , after some months ’ further trial at her uncle ’s house , to find another home . Admiral Crawford was a man of vicious conduct , who chose , instead of retaining his niece , to bring his mistress under his own roof ; and to this Mrs. Grant was indebted for her sister ’s proposal of coming to her , a measure quite as welcome on one side as it could be expedient on the other ; for Mrs. Grant , having by this time run through the usual resources of ladies residing in the country without a family of children — having more than filled her favourite sitting - room with pretty furniture , and made a choice collection of plants and poultry — was very much in want of some variety at home . "
mansfield_2,1,61,"The arrival , therefore , of a sister whom she had always loved , and now hoped to retain with her as long as she remained single , was highly agreeable ; and her chief anxiety was lest Mansfield should not satisfy the habits of a young woman who had been mostly used to London . ","The arrival , therefore , of a sister whom she had always loved , and now hoped to retain with her as long as she remained single , was highly agreeable ; and her chief anxiety was lest Mansfield should not satisfy the habits of a young woman who had been mostly used to London . "
mansfield_2,1,62,"Miss Crawford was not entirely free from similar apprehensions , though they arose principally from doubts of her sister ’s style of living and tone of society ; and it was not till after she had tried in vain to persuade her brother to settle with her at his own country house , that she could resolve to hazard herself among her other relations . ","Miss Crawford was not entirely free from similar apprehensions , though they arose principally from doubts of her sister ’s style of living and tone of society ; and it was not till after she had tried in vain to persuade her brother to settle with her at his own country house , that she could resolve to hazard herself among her other relations . "
mansfield_2,1,63,"To anything like a permanence of abode , or limitation of society , Henry Crawford had , unluckily , a great dislike : he could not accommodate his sister in an article of such importance ; but he escorted her , with the utmost kindness , into Northamptonshire , and as readily engaged to fetch her away again , at half an hour ’s notice , whenever she were weary of the place . ","To anything like a permanence of abode , or limitation of society , Henry Crawford had , unluckily , a great dislike : he could not accommodate his sister in an article of such importance ; but he escorted her , with the utmost kindness , into Northamptonshire , and as readily engaged to fetch her away again , at half an hour ’s notice , whenever she were weary of the place . "
mansfield_2,1,64,The meeting was very satisfactory on each side . ,The meeting was very satisfactory on each side . 
mansfield_2,1,65,"Miss Crawford found a sister without preciseness or rusticity , a sister ’s husband who looked the gentleman , and a house commodious and well fitted up ; and Mrs. Grant received in those whom she hoped to love better than ever a young man and woman of very prepossessing appearance . ","Miss Crawford found a sister without preciseness or rusticity , a sister ’s husband who looked the gentleman , and a house commodious and well fitted up ; and Mrs. Grant received in those whom she hoped to love better than ever a young man and woman of very prepossessing appearance . "
mansfield_2,1,66,"Mary Crawford was remarkably pretty ; Henry , though not handsome , had air and countenance ; the manners of both were lively and pleasant , and Mrs. Grant immediately gave them credit for everything else . ","Mary Crawford was remarkably pretty ; Henry , though not handsome , had air and countenance ; the manners of both were lively and pleasant , and Mrs. Grant immediately gave them credit for everything else . "
mansfield_2,1,67,"She was delighted with each , but Mary was her dearest object ; and having never been able to glory in beauty of her own ","She was delighted with each , but Mary was her dearest object ; and having never been able to glory in beauty of her own "
mansfield_2,1,68,", she thoroughly enjoyed the power of being proud of her sister ’s . ",", she thoroughly enjoyed the power of being proud of her sister ’s . "
mansfield_2,1,69,"She had not waited her arrival to look out for a suitable match for her : she had fixed on Tom Bertram ; the eldest son of a baronet was not too good for a girl of twenty thousand pounds , with all the elegance and accomplishments which Mrs. Grant foresaw in her ; and being a warm - hearted , unreserved woman , Mary had not been three hours in the house before she told her what she had planned . ","She had not waited her arrival to look out for a suitable match for her : she had fixed on Tom Bertram ; the eldest son of a baronet was not too good for a girl of twenty thousand pounds , with all the elegance and accomplishments which Mrs. Grant foresaw in her ; and being a warm - hearted , unreserved woman , Mary had not been three hours in the house before she told her what she had planned . "
mansfield_2,1,70,"Miss Crawford was glad to find a family of such consequence so very near them , and not at all displeased either at her sister ’s early care , or the choice it had fallen on . Matrimony was her object , provided she could marry well : and having seen Mr. Bertram in town , she knew that objection could no more be made to his person than to his situation in life . ","Miss Crawford was glad to find a family of such consequence so very near them , and not at all displeased either at her sister ’s early care , or the choice it had fallen on . Matrimony was her object , provided she could marry well : and having seen Mr. Bertram in town , she knew that objection could no more be made to his person than to his situation in life . "
mansfield_2,1,71,"While she treated it as a joke , therefore , she did not forget to think of it seriously . ","While she treated it as a joke , therefore , she did not forget to think of it seriously . "
mansfield_2,1,72,The scheme was soon repeated to Henry . ,The scheme was soon repeated to Henry . 
mansfield_2,1,73,"“ And now , ” added Mrs. Grant , “ I have thought of something to make it complete . ","“ And now , ” added Mrs. Grant , “ I have thought of something to make it complete . "
mansfield_2,1,74,"I should dearly love to settle you both in this country ; and therefore , Henry , you shall marry the youngest Miss Bertram , a nice , handsome , good - humoured , accomplished girl , who will make you very happy . ","I should dearly love to settle you both in this country ; and therefore , Henry , you shall marry the youngest Miss Bertram , a nice , handsome , good - humoured , accomplished girl , who will make you very happy . "
mansfield_2,1,75,” ,” 
mansfield_2,1,76,Henry bowed and thanked her . ,Henry bowed and thanked her . 
mansfield_2,1,77,"“ My dear sister , ” said Mary , “ if you can persuade him into anything of the sort , it will be a fresh matter of delight to me to find myself allied to anybody so clever , and I shall only regret that you have ","“ My dear sister , ” said Mary , “ if you can persuade him into anything of the sort , it will be a fresh matter of delight to me to find myself allied to anybody so clever , and I shall only regret that you have "
mansfield_2,1,78,not half a dozen daughters to dispose of ,not half a dozen daughters to dispose of 
mansfield_2,1,79,. ,. 
mansfield_2,1,80,If you can persuade Henry to marry ,If you can persuade Henry to marry 
mansfield_2,1,81,", you must have the address of a Frenchwoman . ",", you must have the address of a Frenchwoman . "
mansfield_2,1,82,All that English abilities can do has been tried already . ,All that English abilities can do has been tried already . 
mansfield_2,1,83,"I have three very particular friends who have been all dying for him in their turn ; and the pains which they , their mothers ( very clever women ) , as well as my dear aunt and myself , have taken to reason , coax , or trick him into marrying , is inconceivable ! ","I have three very particular friends who have been all dying for him in their turn ; and the pains which they , their mothers ( very clever women ) , as well as my dear aunt and myself , have taken to reason , coax , or trick him into marrying , is inconceivable ! "
mansfield_2,1,84,He is the most horrible flirt that can be imagined . ,He is the most horrible flirt that can be imagined . 
mansfield_2,1,85,"If your Miss Bertrams do not like to have their hearts broke , let them avoid Henry . ","If your Miss Bertrams do not like to have their hearts broke , let them avoid Henry . "
mansfield_2,1,86,” ,” 
mansfield_2,1,87,"“ My dear brother , I will not believe this of you . ” ","“ My dear brother , I will not believe this of you . ” "
mansfield_2,1,88,"“ No , I am sure you are too good . ","“ No , I am sure you are too good . "
mansfield_2,1,89,You will be kinder than Mary . ,You will be kinder than Mary . 
mansfield_2,1,90,You will allow for the doubts of youth and inexperience . ,You will allow for the doubts of youth and inexperience . 
mansfield_2,1,91,"I am of a cautious temper , and unwilling to risk my happiness in a hurry . ","I am of a cautious temper , and unwilling to risk my happiness in a hurry . "
mansfield_2,1,92,Nobody can think more highly of the matrimonial state than myself . ,Nobody can think more highly of the matrimonial state than myself . 
mansfield_2,1,93,I consider the blessing of a wife as most justly described in those discreet lines of the poet—‘Heaven ’s _ last _ best gift . ’ ,I consider the blessing of a wife as most justly described in those discreet lines of the poet—‘Heaven ’s _ last _ best gift . ’ 
mansfield_2,1,94,"” “ There , Mrs. Grant , you see how he dwells on one word , and only look at his smile . ","” “ There , Mrs. Grant , you see how he dwells on one word , and only look at his smile . "
mansfield_2,1,95,I assure you he is very detestable ; the Admiral ’s lessons have quite spoiled him . ” ,I assure you he is very detestable ; the Admiral ’s lessons have quite spoiled him . ” 
mansfield_2,1,96,"“ I pay very little regard , ” said Mrs. Grant , “ to what any young person says on the subject of marriage . ","“ I pay very little regard , ” said Mrs. Grant , “ to what any young person says on the subject of marriage . "
mansfield_2,1,97,If they profess a disinclination for it ,If they profess a disinclination for it 
mansfield_2,1,98,", I only set it down that they have not yet seen the right person . ” ",", I only set it down that they have not yet seen the right person . ” "
mansfield_2,1,99,Dr. Grant laughingly congratulated Miss Crawford on feeling no disinclination to the state herself . ,Dr. Grant laughingly congratulated Miss Crawford on feeling no disinclination to the state herself . 
mansfield_2,1,100,“ Oh yes ! ,“ Oh yes ! 
mansfield_2,1,101,I am not at all ashamed of it . ,I am not at all ashamed of it . 
mansfield_2,1,102,I would have everybody marry if they can do it properly : I do not like to have people throw themselves away ; but everybody should marry as soon as they can do it to ,I would have everybody marry if they can do it properly : I do not like to have people throw themselves away ; but everybody should marry as soon as they can do it to 
mansfield_2,1,103,advantage ,advantage 
mansfield_2,1,104,. ,. 
mansfield_2,1,105,” ,” 
mansfield_2,2,1, V , V 
mansfield_2,2,2,The young people were pleased with each other from the first . ,The young people were pleased with each other from the first . 
mansfield_2,2,3,On each side ,On each side 
mansfield_2,2,4,"there was much to attract , and their acquaintance soon promised as early an intimacy as good manners would warrant . ","there was much to attract , and their acquaintance soon promised as early an intimacy as good manners would warrant . "
mansfield_2,2,5,Miss Crawford ’s beauty did her no disservice with the Miss Bertrams . ,Miss Crawford ’s beauty did her no disservice with the Miss Bertrams . 
mansfield_2,2,6,"They were too handsome themselves to dislike any woman for being so too , and were almost as much charmed as their brothers with her lively dark eye , clear brown complexion , and general prettiness . ","They were too handsome themselves to dislike any woman for being so too , and were almost as much charmed as their brothers with her lively dark eye , clear brown complexion , and general prettiness . "
mansfield_2,2,7,"Had she been tall , full formed , and fair , it might have been more of a trial : but as it was , there could be no comparison ; and she was most allowably a sweet , pretty girl , while they were the finest young women in the country . ","Had she been tall , full formed , and fair , it might have been more of a trial : but as it was , there could be no comparison ; and she was most allowably a sweet , pretty girl , while they were the finest young women in the country . "
mansfield_2,2,8,"Her brother was not handsome : no , when they first saw him he was absolutely plain , black and plain ; but still he was the gentleman , with a pleasing address . ","Her brother was not handsome : no , when they first saw him he was absolutely plain , black and plain ; but still he was the gentleman , with a pleasing address . "
mansfield_2,2,9,"The second meeting proved him not so very plain : he was plain , to be sure , but then he had so much countenance , and his teeth were so good , and he was so well made , that one soon forgot he was plain ; and after a third interview , after dining in company with him at the Parsonage , he was no longer allowed to be called so by anybody . ","The second meeting proved him not so very plain : he was plain , to be sure , but then he had so much countenance , and his teeth were so good , and he was so well made , that one soon forgot he was plain ; and after a third interview , after dining in company with him at the Parsonage , he was no longer allowed to be called so by anybody . "
mansfield_2,2,10,"He was , in fact , the most agreeable young man the sisters had ever known , and they were equally delighted with him . ","He was , in fact , the most agreeable young man the sisters had ever known , and they were equally delighted with him . "
mansfield_2,2,11,"Miss Bertram ’s engagement made him in equity the property of Julia , of which Julia was fully aware ; and before he had been at Mansfield a week , she was quite ready to be fallen in love with . ","Miss Bertram ’s engagement made him in equity the property of Julia , of which Julia was fully aware ; and before he had been at Mansfield a week , she was quite ready to be fallen in love with . "
mansfield_2,2,12,Maria ’s notions on the subject were more confused and indistinct . ,Maria ’s notions on the subject were more confused and indistinct . 
mansfield_2,2,13,She did not want to see or understand . ,She did not want to see or understand . 
mansfield_2,2,14,“ There could be no harm in her liking an agreeable man — everybody knew her situation — Mr. Crawford must take care of himself . ” ,“ There could be no harm in her liking an agreeable man — everybody knew her situation — Mr. Crawford must take care of himself . ” 
mansfield_2,2,15,Mr. Crawford did not mean to be in any danger ! ,Mr. Crawford did not mean to be in any danger ! 
mansfield_2,2,16,"the Miss Bertrams were worth pleasing , and were ready to be pleased ; and he began with no object but of making them like him . ","the Miss Bertrams were worth pleasing , and were ready to be pleased ; and he began with no object but of making them like him . "
mansfield_2,2,17,He did not want them to die of love ; but with sense and temper which ought to have made him judge and feel better ,He did not want them to die of love ; but with sense and temper which ought to have made him judge and feel better 
mansfield_2,2,18,", he allowed himself great latitude on such points . “ I like your Miss Bertrams exceedingly , sister , ” said he , as he returned from attending them to their carriage after the said dinner visit ; “ they are very elegant , agreeable girls . ” ",", he allowed himself great latitude on such points . “ I like your Miss Bertrams exceedingly , sister , ” said he , as he returned from attending them to their carriage after the said dinner visit ; “ they are very elegant , agreeable girls . ” "
mansfield_2,2,19,"“ So they are indeed , and I am delighted to hear you say it . ","“ So they are indeed , and I am delighted to hear you say it . "
mansfield_2,2,20,But you like Julia best . ” ,But you like Julia best . ” 
mansfield_2,2,21,“ Oh yes ! ,“ Oh yes ! 
mansfield_2,2,22,I like Julia best . ” ,I like Julia best . ” 
mansfield_2,2,23,“ But do you really ? ,“ But do you really ? 
mansfield_2,2,24,for Miss Bertram is in general thought the ,for Miss Bertram is in general thought the 
mansfield_2,2,25,handsomest ,handsomest 
mansfield_2,2,26,. ,. 
mansfield_2,2,27,” ,” 
mansfield_2,2,28,“ So I should suppose . ,“ So I should suppose . 
mansfield_2,2,29,"She has the advantage in every feature , and I prefer her countenance ; but I like Julia best ; Miss Bertram is certainly the handsomest , and I have found her the most agreeable , but I shall always like Julia best , because you order me . ” ","She has the advantage in every feature , and I prefer her countenance ; but I like Julia best ; Miss Bertram is certainly the handsomest , and I have found her the most agreeable , but I shall always like Julia best , because you order me . ” "
mansfield_2,2,30,"“ I shall not talk to you , Henry , but I know you _ will _ like her best at last . ” ","“ I shall not talk to you , Henry , but I know you _ will _ like her best at last . ” "
mansfield_2,2,31,“ Do not I tell you that I like her best _ at _ _ first _ ? ” ,“ Do not I tell you that I like her best _ at _ _ first _ ? ” 
mansfield_2,2,32,"“ And besides , Miss Bertram is engaged . ","“ And besides , Miss Bertram is engaged . "
mansfield_2,2,33,"Remember that , my dear brother . ","Remember that , my dear brother . "
mansfield_2,2,34,"Her choice is made . ” “ Yes , and I like her the better for it . ","Her choice is made . ” “ Yes , and I like her the better for it . "
mansfield_2,2,35,An engaged woman is always more agreeable than a disengaged . ,An engaged woman is always more agreeable than a disengaged . 
mansfield_2,2,36,She is satisfied with herself . ,She is satisfied with herself . 
mansfield_2,2,37,"Her cares are over , and she feels that she may exert all her powers of pleasing without suspicion . ","Her cares are over , and she feels that she may exert all her powers of pleasing without suspicion . "
mansfield_2,2,38,All is safe with a lady engaged : no harm can be done . ” ,All is safe with a lady engaged : no harm can be done . ” 
mansfield_2,2,39,"“ Why , as to that , Mr. Rushworth is a very good sort of young man , and it is a great match for her . ” ","“ Why , as to that , Mr. Rushworth is a very good sort of young man , and it is a great match for her . ” "
mansfield_2,2,40,“ But Miss Bertram does not care three straws for him ; _ that _ is your opinion of your intimate friend . ,“ But Miss Bertram does not care three straws for him ; _ that _ is your opinion of your intimate friend . 
mansfield_2,2,41,_ I _ do not subscribe to it . ,_ I _ do not subscribe to it . 
mansfield_2,2,42,I am sure Miss Bertram is very much attached to Mr. Rushworth . ,I am sure Miss Bertram is very much attached to Mr. Rushworth . 
mansfield_2,2,43,"I could see it in her eyes , when he was mentioned . ","I could see it in her eyes , when he was mentioned . "
mansfield_2,2,44,I think too well of Miss Bertram to suppose she would ever give her hand without her heart . ,I think too well of Miss Bertram to suppose she would ever give her hand without her heart . 
mansfield_2,2,45,” ,” 
mansfield_2,2,46,"“ Mary , how shall we manage him ? ” “ We must leave him to himself , I believe . ","“ Mary , how shall we manage him ? ” “ We must leave him to himself , I believe . "
mansfield_2,2,47,Talking does no good . ,Talking does no good . 
mansfield_2,2,48,He will ,He will 
mansfield_2,2,49,be taken in at last . ,be taken in at last . 
mansfield_2,2,50,” ,” 
