fic_id,chapter_id,para_id,text,text_tokenized
mansfield_14,1,82,"“ Well , then , ” replied Miss Crawford , laughing , “ I must suppose it to be purely for the pleasure of conveying your brother , and of talking of you by the way . ” ","“ Well , then , ” replied Miss Crawford , laughing , “ I must suppose it to be purely for the pleasure of conveying your brother , and of talking of you by the way . ” "
mansfield_14,1,83,"Fanny was confused , but it was the confusion of discontent ; ","Fanny was confused , but it was the confusion of discontent ; "
mansfield_14,1,84,"while Miss Crawford wondered she did not smile , and thought her over - anxious , or thought her odd , or thought her anything rather than insensible of ","while Miss Crawford wondered she did not smile , and thought her over - anxious , or thought her odd , or thought her anything rather than insensible of "
mansfield_14,1,85,pleasure in Henry ’s attentions ,pleasure in Henry ’s attentions 
mansfield_14,1,86,. ,. 
mansfield_14,1,87,Fanny had a good deal of enjoyment in the course of the evening ; but Henry ’s attentions had very little to do with it . ,Fanny had a good deal of enjoyment in the course of the evening ; but Henry ’s attentions had very little to do with it . 
mansfield_14,1,88,"She would much rather _ not _ have been asked by him again so very soon , and she wished she had not been obliged to suspect that his previous inquiries of Mrs. Norris , about the supper hour , were all for the sake of securing her at that part of the evening . ","She would much rather _ not _ have been asked by him again so very soon , and she wished she had not been obliged to suspect that his previous inquiries of Mrs. Norris , about the supper hour , were all for the sake of securing her at that part of the evening . "
mansfield_14,1,89,"But it was not to be avoided : he made her feel that she was the object of all ; though she could not say that it was unpleasantly done , that there was indelicacy or ostentation in his manner ; and sometimes , when he talked of William , he was really not unagreeable , and shewed even a warmth of heart which did him credit . ","But it was not to be avoided : he made her feel that she was the object of all ; though she could not say that it was unpleasantly done , that there was indelicacy or ostentation in his manner ; and sometimes , when he talked of William , he was really not unagreeable , and shewed even a warmth of heart which did him credit . "
mansfield_14,1,90,But still his attentions made no part of her satisfaction . ,But still his attentions made no part of her satisfaction . 
mansfield_14,1,91,"She was happy whenever she looked at William , and saw how perfectly he was enjoying himself , in every five minutes that she could walk about with him and hear his account of his partners ; she was happy in knowing herself admired ; and she was happy in having the two dances with Edmund still to look forward to , during the greatest part of the evening , her hand being so eagerly sought after that her indefinite engagement with _ him _ was in continual perspective . ","She was happy whenever she looked at William , and saw how perfectly he was enjoying himself , in every five minutes that she could walk about with him and hear his account of his partners ; she was happy in knowing herself admired ; and she was happy in having the two dances with Edmund still to look forward to , during the greatest part of the evening , her hand being so eagerly sought after that her indefinite engagement with _ him _ was in continual perspective . "
mansfield_14,1,92,"She was happy even when they did take place ; but not from any flow of spirits on his side , or any such expressions of tender gallantry as had blessed the morning . His mind was fagged , and her happiness sprung from being the friend with whom it could find repose . ","She was happy even when they did take place ; but not from any flow of spirits on his side , or any such expressions of tender gallantry as had blessed the morning . His mind was fagged , and her happiness sprung from being the friend with whom it could find repose . "
mansfield_14,1,93,"“ I am worn out with civility , ” said he . ","“ I am worn out with civility , ” said he . "
mansfield_14,1,94,"“ I have been talking incessantly all night , and with nothing to say . ","“ I have been talking incessantly all night , and with nothing to say . "
mansfield_14,1,95,"But with _ you _ , Fanny , there may be peace . ","But with _ you _ , Fanny , there may be peace . "
mansfield_14,1,96,You will not want to be talked to . ,You will not want to be talked to . 
mansfield_14,1,97,Let us have the luxury of silence . ” ,Let us have the luxury of silence . ” 
mansfield_14,1,98,Fanny would hardly even speak her agreement . ,Fanny would hardly even speak her agreement . 
mansfield_14,1,99,"A weariness , arising probably , in great measure , from the same feelings which he had acknowledged in the morning , was peculiarly to be respected , and they went down their two dances together with such sober tranquillity as might satisfy any looker - on that Sir Thomas had been bringing up no wife for his younger son . ","A weariness , arising probably , in great measure , from the same feelings which he had acknowledged in the morning , was peculiarly to be respected , and they went down their two dances together with such sober tranquillity as might satisfy any looker - on that Sir Thomas had been bringing up no wife for his younger son . "
mansfield_14,1,100,The evening had afforded Edmund little pleasure . ,The evening had afforded Edmund little pleasure . 
mansfield_14,1,101,"Miss Crawford had been in gay spirits when they first danced together , but it was not her gaiety that could do him good : it rather sank than raised his comfort ; and afterwards , for he found himself still impelled to seek her again , she had absolutely pained him by her manner of speaking of the profession to which he was now on the point of belonging . ","Miss Crawford had been in gay spirits when they first danced together , but it was not her gaiety that could do him good : it rather sank than raised his comfort ; and afterwards , for he found himself still impelled to seek her again , she had absolutely pained him by her manner of speaking of the profession to which he was now on the point of belonging . "
mansfield_14,1,102,"They had talked , and they had been silent ; he had reasoned , she had ridiculed ; and they had parted at last with mutual vexation . ","They had talked , and they had been silent ; he had reasoned , she had ridiculed ; and they had parted at last with mutual vexation . "
mansfield_14,1,103,"Fanny , not able to refrain entirely from observing them , had seen enough to be tolerably satisfied . ","Fanny , not able to refrain entirely from observing them , had seen enough to be tolerably satisfied . "
mansfield_14,1,104,It was barbarous to be happy when Edmund was suffering . ,It was barbarous to be happy when Edmund was suffering . 
mansfield_14,1,105,Yet some happiness must and would arise from the very conviction that he did suffer . ,Yet some happiness must and would arise from the very conviction that he did suffer . 
mansfield_14,1,106,"When her two dances with him were over , her inclination and strength for more were pretty well at an end ; and Sir Thomas , having seen her walk rather than dance down the shortening set , breathless , and with her hand at her side , gave his orders for her sitting down entirely . ","When her two dances with him were over , her inclination and strength for more were pretty well at an end ; and Sir Thomas , having seen her walk rather than dance down the shortening set , breathless , and with her hand at her side , gave his orders for her sitting down entirely . "
mansfield_14,1,107,From that time Mr. Crawford sat down likewise . ,From that time Mr. Crawford sat down likewise . 
mansfield_14,1,108,"“ Poor Fanny ! ” cried William , coming for a moment to visit her , and working away his partner ’s fan as if for life , “ how soon she is knocked up ! ","“ Poor Fanny ! ” cried William , coming for a moment to visit her , and working away his partner ’s fan as if for life , “ how soon she is knocked up ! "
mansfield_14,1,109,"Why , the sport is but just begun . ","Why , the sport is but just begun . "
mansfield_14,1,110,I hope we shall keep it up these two hours . ,I hope we shall keep it up these two hours . 
mansfield_14,1,111,How can you be tired so soon ? ” ,How can you be tired so soon ? ” 
mansfield_14,1,112,“ So soon ! ,“ So soon ! 
mansfield_14,1,113,"my good friend , ” said Sir Thomas , producing his watch with all necessary caution ; “ it is three o’clock , and your sister is not used to these sort of hours . ” ","my good friend , ” said Sir Thomas , producing his watch with all necessary caution ; “ it is three o’clock , and your sister is not used to these sort of hours . ” "
mansfield_14,1,114,"“ Well , then , Fanny , you shall not get up to - morrow before I go . ","“ Well , then , Fanny , you shall not get up to - morrow before I go . "
mansfield_14,1,115,"Sleep as long as you can , and never mind me . ” ","Sleep as long as you can , and never mind me . ” "
mansfield_14,1,116,“ Oh ! ,“ Oh ! 
mansfield_14,1,117,William . ,William . 
mansfield_14,1,118,” ,” 
mansfield_14,1,119,“ What ! ,“ What ! 
mansfield_14,1,120,Did she think of being up before you set off ? ” ,Did she think of being up before you set off ? ” 
mansfield_14,1,121,“ Oh ! ,“ Oh ! 
mansfield_14,1,122,"yes , sir , ” cried Fanny , rising eagerly from her seat to be nearer her uncle ; “ I must get up and breakfast with him . ","yes , sir , ” cried Fanny , rising eagerly from her seat to be nearer her uncle ; “ I must get up and breakfast with him . "
mansfield_14,1,123,"It will be the last time , you know ; the last morning . ” ","It will be the last time , you know ; the last morning . ” "
mansfield_14,1,124,“ You had better not . ,“ You had better not . 
mansfield_14,1,125,He is to have breakfasted and be gone by half - past nine . ,He is to have breakfasted and be gone by half - past nine . 
mansfield_14,1,126,"Mr. Crawford , I think you call for him at half - past nine ? ” ","Mr. Crawford , I think you call for him at half - past nine ? ” "
mansfield_14,1,127,"Fanny was too urgent , however , and had too many tears in her eyes for denial ; and it ended in a gracious “ Well , well ! ” which was permission . ","Fanny was too urgent , however , and had too many tears in her eyes for denial ; and it ended in a gracious “ Well , well ! ” which was permission . "
mansfield_14,1,128,"“ Yes , half - past nine , ” said Crawford to William as the latter was leaving them , “ and I shall be punctual , for there will be no kind sister to get up for _ me _ . ” ","“ Yes , half - past nine , ” said Crawford to William as the latter was leaving them , “ and I shall be punctual , for there will be no kind sister to get up for _ me _ . ” "
mansfield_14,1,129,"And in a lower tone to Fanny , “ I shall have only a desolate house to hurry from . ","And in a lower tone to Fanny , “ I shall have only a desolate house to hurry from . "
mansfield_14,1,130,Your brother will find my ideas of time and his own very different to - morrow . ,Your brother will find my ideas of time and his own very different to - morrow . 
mansfield_14,1,131,” ,” 
mansfield_14,1,132,"After a short consideration , Sir Thomas asked Crawford to join the early breakfast party in that house instead of eating alone : he should himself be of it ; and the readiness with which his invitation was accepted convinced him that the suspicions whence , he must confess to himself , this very ball had in great measure sprung , were well founded . ","After a short consideration , Sir Thomas asked Crawford to join the early breakfast party in that house instead of eating alone : he should himself be of it ; and the readiness with which his invitation was accepted convinced him that the suspicions whence , he must confess to himself , this very ball had in great measure sprung , were well founded . "
mansfield_14,1,133,Mr. Crawford was in love with Fanny . ,Mr. Crawford was in love with Fanny . 
mansfield_14,1,134,He had a pleasing anticipation of what would be . ,He had a pleasing anticipation of what would be . 
mansfield_14,1,135,"His niece , meanwhile , did not thank him for what he had just done . ","His niece , meanwhile , did not thank him for what he had just done . "
mansfield_14,1,136,She had hoped to have William all to herself the last morning . ,She had hoped to have William all to herself the last morning . 
mansfield_14,1,137,It would have been an unspeakable indulgence . ,It would have been an unspeakable indulgence . 
mansfield_14,1,138,"But though her wishes were overthrown , there was no spirit of murmuring within her . ","But though her wishes were overthrown , there was no spirit of murmuring within her . "
mansfield_14,1,139,"On the contrary , she was so totally unused to have her pleasure consulted , or to have anything take place at all in the way she could desire , that she was more disposed to wonder and rejoice in having carried her point so far , than to repine at the counteraction which followed . ","On the contrary , she was so totally unused to have her pleasure consulted , or to have anything take place at all in the way she could desire , that she was more disposed to wonder and rejoice in having carried her point so far , than to repine at the counteraction which followed . "
mansfield_14,1,140,"Shortly afterward , Sir Thomas was again interfering a little with her inclination , by advising her to go immediately to bed . ","Shortly afterward , Sir Thomas was again interfering a little with her inclination , by advising her to go immediately to bed . "
mansfield_14,1,141,"“ Advise ” was his word , but it was the advice of absolute power , and she had only to rise , and , with Mr. Crawford ’s very cordial adieus , pass quietly away ; stopping at the entrance - door , like the Lady of Branxholm Hall , “ one moment and no more , ” to view the happy scene , and take a last look at the five or six determined couple who were still hard at work ; and then , creeping slowly up the principal staircase , pursued by the ceaseless country - dance , feverish with hopes and fears , soup and negus , sore - footed and fatigued , restless and agitated , yet feeling , in spite of everything , that a ball was indeed delightful . In thus sending her away , Sir Thomas perhaps might not be thinking ","“ Advise ” was his word , but it was the advice of absolute power , and she had only to rise , and , with Mr. Crawford ’s very cordial adieus , pass quietly away ; stopping at the entrance - door , like the Lady of Branxholm Hall , “ one moment and no more , ” to view the happy scene , and take a last look at the five or six determined couple who were still hard at work ; and then , creeping slowly up the principal staircase , pursued by the ceaseless country - dance , feverish with hopes and fears , soup and negus , sore - footed and fatigued , restless and agitated , yet feeling , in spite of everything , that a ball was indeed delightful . In thus sending her away , Sir Thomas perhaps might not be thinking "
mansfield_14,1,142,merely of her health ,merely of her health 
mansfield_14,1,143,. ,. 
mansfield_14,1,144,"It might occur to him that Mr. Crawford had been sitting by her long enough , or he might mean to recommend her as a wife by shewing her persuadableness . ","It might occur to him that Mr. Crawford had been sitting by her long enough , or he might mean to recommend her as a wife by shewing her persuadableness . "
mansfield_14,2,1, XXIX , XXIX 
mansfield_14,2,2,"The ball was over , and the breakfast was soon over too ; the last kiss was given , and William was gone . ","The ball was over , and the breakfast was soon over too ; the last kiss was given , and William was gone . "
mansfield_14,2,3,"Mr. Crawford had , as he foretold , been very punctual , and short and pleasant had been the meal . ","Mr. Crawford had , as he foretold , been very punctual , and short and pleasant had been the meal . "
mansfield_14,2,4,"After seeing William to the last moment , Fanny walked back to the breakfast - room with a very saddened heart to grieve over the melancholy change ; and there her uncle kindly left her to cry in peace , conceiving , perhaps , that the deserted chair of each young man might exercise her tender enthusiasm , and that the remaining cold pork bones and mustard in William ’s plate might but divide ","After seeing William to the last moment , Fanny walked back to the breakfast - room with a very saddened heart to grieve over the melancholy change ; and there her uncle kindly left her to cry in peace , conceiving , perhaps , that the deserted chair of each young man might exercise her tender enthusiasm , and that the remaining cold pork bones and mustard in William ’s plate might but divide "
mansfield_14,2,5,her feelings ,her feelings 
mansfield_14,2,6,with the broken egg - shells in Mr. Crawford ’s ,with the broken egg - shells in Mr. Crawford ’s 
mansfield_14,2,7,. ,. 
mansfield_14,2,8,"She sat and cried _ con _ _ amore _ as her uncle intended , but it was _ con _ _ amore _ fraternal and no other . ","She sat and cried _ con _ _ amore _ as her uncle intended , but it was _ con _ _ amore _ fraternal and no other . "
mansfield_14,2,9,"William was gone , and she now felt as if she had wasted half his visit in idle cares and selfish solicitudes unconnected with him . ","William was gone , and she now felt as if she had wasted half his visit in idle cares and selfish solicitudes unconnected with him . "
mansfield_14,2,10,"Fanny ’s disposition was such that she could never even think of her aunt Norris in the meagreness and cheerlessness of her own small house , without reproaching herself for some little want of attention to her when they had been last together ; much less could her feelings acquit her of having done and said and thought everything by William that was due to him for a whole fortnight . It was a heavy , melancholy day . ","Fanny ’s disposition was such that she could never even think of her aunt Norris in the meagreness and cheerlessness of her own small house , without reproaching herself for some little want of attention to her when they had been last together ; much less could her feelings acquit her of having done and said and thought everything by William that was due to him for a whole fortnight . It was a heavy , melancholy day . "
mansfield_14,2,11,"Soon after the second breakfast , Edmund bade them good - bye for a week , and mounted his horse for Peterborough , and then all were gone . ","Soon after the second breakfast , Edmund bade them good - bye for a week , and mounted his horse for Peterborough , and then all were gone . "
mansfield_14,2,12,"Nothing remained of last night but remembrances , which she had nobody to share in . ","Nothing remained of last night but remembrances , which she had nobody to share in . "
mansfield_14,2,13,"She talked to her aunt Bertram — she must talk to somebody of the ball ; but her aunt had seen so little of what had passed , and had so little curiosity , that it was heavy work . ","She talked to her aunt Bertram — she must talk to somebody of the ball ; but her aunt had seen so little of what had passed , and had so little curiosity , that it was heavy work . "
mansfield_14,2,14,Lady Bertram was not certain of anybody ’s dress or anybody ’s place at supper but her own . ,Lady Bertram was not certain of anybody ’s dress or anybody ’s place at supper but her own . 
mansfield_14,2,15,"“ She could not recollect what it was that she had heard about one of the Miss Maddoxes , or what it was that Lady Prescott had noticed in Fanny : she was not sure whether Colonel Harrison had been talking of Mr. Crawford or of William when he said he was the finest young man in the room — somebody had whispered something to her ","“ She could not recollect what it was that she had heard about one of the Miss Maddoxes , or what it was that Lady Prescott had noticed in Fanny : she was not sure whether Colonel Harrison had been talking of Mr. Crawford or of William when he said he was the finest young man in the room — somebody had whispered something to her "
mansfield_14,2,16,"; she had forgot to ask Sir Thomas what it could be . ” And these were her longest speeches and clearest communications : the rest was only a languid “ Yes , yes ; very well ; did you ? ","; she had forgot to ask Sir Thomas what it could be . ” And these were her longest speeches and clearest communications : the rest was only a languid “ Yes , yes ; very well ; did you ? "
mansfield_14,2,17,did he ? ,did he ? 
mansfield_14,2,18,I did not see _ that _ ; I should not know one from the other . ” ,I did not see _ that _ ; I should not know one from the other . ” 
mansfield_14,2,19,This was very bad . ,This was very bad . 
mansfield_14,2,20,"It was only better than Mrs. Norris ’s sharp answers would have been ; but she being gone home with all the supernumerary jellies to nurse a sick maid , there was peace and good - humour in their little party , though it could not boast much beside . ","It was only better than Mrs. Norris ’s sharp answers would have been ; but she being gone home with all the supernumerary jellies to nurse a sick maid , there was peace and good - humour in their little party , though it could not boast much beside . "
mansfield_14,2,21,The evening was heavy like the day . ,The evening was heavy like the day . 
mansfield_14,2,22,"“ I can not think what is the matter with me , ” said Lady Bertram , when the tea - things were removed . ","“ I can not think what is the matter with me , ” said Lady Bertram , when the tea - things were removed . "
mansfield_14,2,23,“ I feel quite stupid . ,“ I feel quite stupid . 
mansfield_14,2,24,It must be sitting up so late last night . ,It must be sitting up so late last night . 
mansfield_14,2,25,"Fanny , you must do something to keep me awake . ","Fanny , you must do something to keep me awake . "
mansfield_14,2,26,I can not work . ,I can not work . 
mansfield_14,2,27,Fetch the cards ; I feel so very stupid . ” ,Fetch the cards ; I feel so very stupid . ” 
mansfield_14,2,28,"The cards were brought , and Fanny played at cribbage with her aunt till bedtime ; and as Sir Thomas was reading to himself , no sounds were heard in the room for the next two hours beyond the reckonings of the game—“And _ that _ makes thirty - one ; four in hand and eight in crib . ","The cards were brought , and Fanny played at cribbage with her aunt till bedtime ; and as Sir Thomas was reading to himself , no sounds were heard in the room for the next two hours beyond the reckonings of the game—“And _ that _ makes thirty - one ; four in hand and eight in crib . "
mansfield_14,2,29,"You are to deal , ma’am ; shall I deal for you ? ” Fanny thought and thought again of the difference which twenty - four hours had made in that room , and all that part of the house . ","You are to deal , ma’am ; shall I deal for you ? ” Fanny thought and thought again of the difference which twenty - four hours had made in that room , and all that part of the house . "
mansfield_14,2,30,"Last night it had been hope and smiles , bustle and motion , noise and brilliancy , in the drawing - room , and out of the drawing - room , and everywhere . ","Last night it had been hope and smiles , bustle and motion , noise and brilliancy , in the drawing - room , and out of the drawing - room , and everywhere . "
mansfield_14,2,31,"Now it was languor , and all but solitude . ","Now it was languor , and all but solitude . "
mansfield_14,2,32,A good night ’s rest improved her spirits . ,A good night ’s rest improved her spirits . 
mansfield_14,2,33,"She could think of William the next day more cheerfully ; and as the morning afforded her an opportunity of talking over Thursday night with Mrs. Grant and Miss Crawford , in a very handsome style , with all the heightenings of imagination , and all the laughs of playfulness which are so essential to the shade of a departed ball , she could afterwards bring her mind without much effort into its everyday state , and easily conform to the tranquillity of the present quiet week . They were indeed a smaller party than she had ever known there for a whole day together , and _ he _ was gone on whom the comfort and cheerfulness of every family meeting and every meal chiefly depended . ","She could think of William the next day more cheerfully ; and as the morning afforded her an opportunity of talking over Thursday night with Mrs. Grant and Miss Crawford , in a very handsome style , with all the heightenings of imagination , and all the laughs of playfulness which are so essential to the shade of a departed ball , she could afterwards bring her mind without much effort into its everyday state , and easily conform to the tranquillity of the present quiet week . They were indeed a smaller party than she had ever known there for a whole day together , and _ he _ was gone on whom the comfort and cheerfulness of every family meeting and every meal chiefly depended . "
mansfield_14,2,34,But this must be learned to be endured . ,But this must be learned to be endured . 
mansfield_14,2,35,He would soon be always gone ; and ,He would soon be always gone ; and 
