fic_id,chapter_id,para_id,text,text_tokenized
mansfield_7,1,1, XIV Fanny seemed nearer being right than Edmund had supposed . , XIV Fanny seemed nearer being right than Edmund had supposed . 
mansfield_7,1,2,"The business of finding a play that would suit everybody proved to be no trifle ; and the carpenter had received his orders and taken his measurements , had suggested and removed at least two sets of difficulties , and having made the necessity of an enlargement of plan and expense fully evident , was already at work , while a play was still to seek . ","The business of finding a play that would suit everybody proved to be no trifle ; and the carpenter had received his orders and taken his measurements , had suggested and removed at least two sets of difficulties , and having made the necessity of an enlargement of plan and expense fully evident , was already at work , while a play was still to seek . "
mansfield_7,1,3,Other preparations were also in hand . ,Other preparations were also in hand . 
mansfield_7,1,4,"An enormous roll of green baize had arrived from Northampton , and been cut out by Mrs. Norris ( with a saving by her good management of full three - quarters of a yard ) , and was actually forming into a curtain by the housemaids , and still the play was wanting ; and as two or three days passed away in this manner , Edmund began almost to hope that none might ever be found . There were , in fact , so many things to be attended to , so many people to be pleased , so many best characters required , and , above all , such a need that the play should be at once both tragedy and comedy , that there did seem as little chance of a decision as anything pursued by youth and zeal could hold out . ","An enormous roll of green baize had arrived from Northampton , and been cut out by Mrs. Norris ( with a saving by her good management of full three - quarters of a yard ) , and was actually forming into a curtain by the housemaids , and still the play was wanting ; and as two or three days passed away in this manner , Edmund began almost to hope that none might ever be found . There were , in fact , so many things to be attended to , so many people to be pleased , so many best characters required , and , above all , such a need that the play should be at once both tragedy and comedy , that there did seem as little chance of a decision as anything pursued by youth and zeal could hold out . "
mansfield_7,1,5,"On the tragic side were the Miss Bertrams , Henry Crawford , and Mr. Yates ; on the comic , Tom Bertram , not _ quite _ alone , because it was evident that Mary Crawford ’s wishes , though politely kept back , inclined the same way : but his determinateness and his power seemed to make allies unnecessary ; and , independent of this great irreconcilable difference , they wanted a piece containing very few characters in the whole , but every character first - rate , and three principal women . ","On the tragic side were the Miss Bertrams , Henry Crawford , and Mr. Yates ; on the comic , Tom Bertram , not _ quite _ alone , because it was evident that Mary Crawford ’s wishes , though politely kept back , inclined the same way : but his determinateness and his power seemed to make allies unnecessary ; and , independent of this great irreconcilable difference , they wanted a piece containing very few characters in the whole , but every character first - rate , and three principal women . "
mansfield_7,1,6,All the best plays were run over in vain . ,All the best plays were run over in vain . 
mansfield_7,1,7,"Neither Hamlet , nor Macbeth , nor Othello , nor Douglas , nor The Gamester , presented anything that could satisfy even the tragedians ; and The Rivals , The School for Scandal , Wheel of Fortune , Heir at Law , and a long et cetera , ","Neither Hamlet , nor Macbeth , nor Othello , nor Douglas , nor The Gamester , presented anything that could satisfy even the tragedians ; and The Rivals , The School for Scandal , Wheel of Fortune , Heir at Law , and a long et cetera , "
mansfield_7,1,8,were successively dismissed with yet warmer objections . ,were successively dismissed with yet warmer objections . 
mansfield_7,1,9,"No piece could be proposed that did not supply somebody with a difficulty , and on one side or the other it was a continual repetition of , “ Oh no , _ that _ will never do ! ","No piece could be proposed that did not supply somebody with a difficulty , and on one side or the other it was a continual repetition of , “ Oh no , _ that _ will never do ! "
mansfield_7,1,10,Let us have no ranting tragedies . ,Let us have no ranting tragedies . 
mansfield_7,1,11,Too many characters . ,Too many characters . 
mansfield_7,1,12,Not a tolerable woman ’s part in the play . ,Not a tolerable woman ’s part in the play . 
mansfield_7,1,13,"Anything but _ that _ , my dear Tom . ","Anything but _ that _ , my dear Tom . "
mansfield_7,1,14,It would be impossible to fill it up . ,It would be impossible to fill it up . 
mansfield_7,1,15,One could not expect anybody to take such a part . ,One could not expect anybody to take such a part . 
mansfield_7,1,16,Nothing but buffoonery from beginning to end . ,Nothing but buffoonery from beginning to end . 
mansfield_7,1,17,"_ That _ might do , perhaps , but for the low parts . ","_ That _ might do , perhaps , but for the low parts . "
mansfield_7,1,18,"If I _ must _ give my opinion , I have always thought it the most insipid play in the English language . ","If I _ must _ give my opinion , I have always thought it the most insipid play in the English language . "
mansfield_7,1,19,"_ I _ do not wish to make objections ; I shall be happy to be of any use , but I think we could not chuse worse . ","_ I _ do not wish to make objections ; I shall be happy to be of any use , but I think we could not chuse worse . "
mansfield_7,1,20,” ,” 
mansfield_7,1,21,"Fanny looked on and listened , not unamused to observe the selfishness which , more or less disguised , seemed to govern them all , and wondering how it would end . ","Fanny looked on and listened , not unamused to observe the selfishness which , more or less disguised , seemed to govern them all , and wondering how it would end . "
mansfield_7,1,22,"For her own gratification she could have wished that something might be acted , for she had never seen even half a play , but everything of higher consequence was against it . ","For her own gratification she could have wished that something might be acted , for she had never seen even half a play , but everything of higher consequence was against it . "
mansfield_7,1,23,"“ This will never do , ” said Tom Bertram at last . ","“ This will never do , ” said Tom Bertram at last . "
mansfield_7,1,24,“ We are wasting time most abominably . ,“ We are wasting time most abominably . 
mansfield_7,1,25,Something must be fixed on . ,Something must be fixed on . 
mansfield_7,1,26,"No matter what , so that something is chosen . ","No matter what , so that something is chosen . "
mansfield_7,1,27,We must not be so nice . ,We must not be so nice . 
mansfield_7,1,28,A few characters too many must not frighten us . ,A few characters too many must not frighten us . 
mansfield_7,1,29,We must _ double _ them . ,We must _ double _ them . 
mansfield_7,1,30,We must descend a little . ,We must descend a little . 
mansfield_7,1,31,"If a part is insignificant , the greater our credit in making anything of it . ","If a part is insignificant , the greater our credit in making anything of it . "
mansfield_7,1,32,From this moment I make no difficulties . ,From this moment I make no difficulties . 
mansfield_7,1,33,"I take any part you chuse to give me , so as it be comic . ","I take any part you chuse to give me , so as it be comic . "
mansfield_7,1,34,"Let it but be comic , I condition for nothing more . ” For about the fifth time he then proposed the Heir at Law , doubting only whether to prefer Lord Duberley or Dr. Pangloss for himself ; and very earnestly , but very unsuccessfully , trying to persuade the others that there were some fine tragic parts in the rest of the Dramatis Personæ . The pause which followed this fruitless effort was ended by the same speaker , who , taking up one of the many volumes of plays that lay on the table , and turning it over , suddenly exclaimed—“Lovers ’ Vows ! ","Let it but be comic , I condition for nothing more . ” For about the fifth time he then proposed the Heir at Law , doubting only whether to prefer Lord Duberley or Dr. Pangloss for himself ; and very earnestly , but very unsuccessfully , trying to persuade the others that there were some fine tragic parts in the rest of the Dramatis Personæ . The pause which followed this fruitless effort was ended by the same speaker , who , taking up one of the many volumes of plays that lay on the table , and turning it over , suddenly exclaimed—“Lovers ’ Vows ! "
mansfield_7,1,35,And why should not Lovers ’ Vows do for _ us _ as well as for the Ravenshaws ? ,And why should not Lovers ’ Vows do for _ us _ as well as for the Ravenshaws ? 
mansfield_7,1,36,How came it never to be thought of before ? ,How came it never to be thought of before ? 
mansfield_7,1,37,It strikes me as if it would do exactly . ,It strikes me as if it would do exactly . 
mansfield_7,1,38,What say you all ? ,What say you all ? 
mansfield_7,1,39,"Here are two capital tragic parts for Yates and Crawford , and here is the rhyming Butler for me , if nobody else wants it ; a trifling part , but the sort of thing I should not dislike , and , as I said before , I am determined to take anything and do ","Here are two capital tragic parts for Yates and Crawford , and here is the rhyming Butler for me , if nobody else wants it ; a trifling part , but the sort of thing I should not dislike , and , as I said before , I am determined to take anything and do "
mansfield_7,1,40,my best ,my best 
mansfield_7,1,41,. ,. 
mansfield_7,1,42,"And as for the rest , they may be filled up by anybody . ","And as for the rest , they may be filled up by anybody . "
mansfield_7,1,43,It is only Count Cassel and Anhalt . ” ,It is only Count Cassel and Anhalt . ” 
mansfield_7,1,44,The suggestion was generally welcome . ,The suggestion was generally welcome . 
mansfield_7,1,45,"Everybody was growing weary of indecision , and the first idea with everybody was , that nothing had been proposed before so likely to suit them all . ","Everybody was growing weary of indecision , and the first idea with everybody was , that nothing had been proposed before so likely to suit them all . "
mansfield_7,1,46,"Mr. Yates was particularly pleased : he had been sighing and longing to do the Baron at Ecclesford , had grudged every rant of Lord Ravenshaw ’s , and been forced to re - rant it all in his own room . ","Mr. Yates was particularly pleased : he had been sighing and longing to do the Baron at Ecclesford , had grudged every rant of Lord Ravenshaw ’s , and been forced to re - rant it all in his own room . "
mansfield_7,1,47,"The storm through Baron Wildenheim was the height of his theatrical ambition ; and with the advantage of knowing half the scenes by heart already , he did now , with the greatest alacrity , offer his services for the part . ","The storm through Baron Wildenheim was the height of his theatrical ambition ; and with the advantage of knowing half the scenes by heart already , he did now , with the greatest alacrity , offer his services for the part . "
mansfield_7,1,48,"To do him justice , however , he did not resolve to appropriate it ; for remembering that there was some very good ranting - ground in Frederick , he professed an equal willingness for that . ","To do him justice , however , he did not resolve to appropriate it ; for remembering that there was some very good ranting - ground in Frederick , he professed an equal willingness for that . "
mansfield_7,1,49,Henry Crawford was ready to take either . ,Henry Crawford was ready to take either . 
mansfield_7,1,50,"Whichever Mr. Yates did not chuse would perfectly satisfy him , and a short parley of compliment ensued . ","Whichever Mr. Yates did not chuse would perfectly satisfy him , and a short parley of compliment ensued . "
mansfield_7,1,51,"Miss Bertram , feeling all the interest of an Agatha in the question , took on her to decide it , by observing to Mr. Yates that this was a point in which height and figure ought to be considered , and that _ his _ being the tallest , seemed to fit him peculiarly for the Baron . ","Miss Bertram , feeling all the interest of an Agatha in the question , took on her to decide it , by observing to Mr. Yates that this was a point in which height and figure ought to be considered , and that _ his _ being the tallest , seemed to fit him peculiarly for the Baron . "
mansfield_7,1,52,"She was acknowledged to be quite right , and the two parts being accepted accordingly , she was certain of the proper Frederick . ","She was acknowledged to be quite right , and the two parts being accepted accordingly , she was certain of the proper Frederick . "
mansfield_7,1,53,"Three of the characters were now cast , besides Mr. Rushworth , who was always answered for by Maria as willing to do anything ; when Julia , meaning , like her sister , to be Agatha , began to be scrupulous on Miss Crawford ’s account . ","Three of the characters were now cast , besides Mr. Rushworth , who was always answered for by Maria as willing to do anything ; when Julia , meaning , like her sister , to be Agatha , began to be scrupulous on Miss Crawford ’s account . "
mansfield_7,1,54,"“ This is not behaving well by the absent , ” said she . ","“ This is not behaving well by the absent , ” said she . "
mansfield_7,1,55,“ Here are not women enough . ,“ Here are not women enough . 
mansfield_7,1,56,"Amelia and Agatha may do for Maria and me , but here is nothing for your sister , Mr. Crawford . ” ","Amelia and Agatha may do for Maria and me , but here is nothing for your sister , Mr. Crawford . ” "
mansfield_7,1,57,"Mr. Crawford desired _ that _ might not be thought of : he was very sure his sister had no wish of acting but as she might be useful , and that she would not allow herself to be considered in the present case . ","Mr. Crawford desired _ that _ might not be thought of : he was very sure his sister had no wish of acting but as she might be useful , and that she would not allow herself to be considered in the present case . "
mansfield_7,1,58,"But this was immediately opposed by Tom Bertram , who asserted the part of Amelia to be in every respect the property of Miss Crawford , if she would accept it . ","But this was immediately opposed by Tom Bertram , who asserted the part of Amelia to be in every respect the property of Miss Crawford , if she would accept it . "
mansfield_7,1,59,"“ It falls as naturally , as necessarily to her , ” said he , “ as Agatha does to one or other of my sisters . ","“ It falls as naturally , as necessarily to her , ” said he , “ as Agatha does to one or other of my sisters . "
mansfield_7,1,60,"It can be no sacrifice on their side , for it is highly comic . ” ","It can be no sacrifice on their side , for it is highly comic . ” "
mansfield_7,1,61,A short silence followed . ,A short silence followed . 
mansfield_7,1,62,"Each sister looked anxious ; for each felt the best claim to Agatha , and was hoping to have it pressed on her by the rest . ","Each sister looked anxious ; for each felt the best claim to Agatha , and was hoping to have it pressed on her by the rest . "
mansfield_7,1,63,"Henry Crawford , who meanwhile had taken up the play , and with seeming carelessness was turning over the first act , ","Henry Crawford , who meanwhile had taken up the play , and with seeming carelessness was turning over the first act , "
mansfield_7,1,64,soon settled the business . ,soon settled the business . 
mansfield_7,1,65,"“ I must entreat Miss _ Julia _ Bertram , ” said he , “ not to engage in the part of Agatha , or it will be the ruin of all my solemnity . ","“ I must entreat Miss _ Julia _ Bertram , ” said he , “ not to engage in the part of Agatha , or it will be the ruin of all my solemnity . "
mansfield_7,1,66,"You must not , indeed you must not ” ( turning to her ) . ","You must not , indeed you must not ” ( turning to her ) . "
mansfield_7,1,67,“ I could not stand your countenance dressed up in woe and paleness . ,“ I could not stand your countenance dressed up in woe and paleness . 
mansfield_7,1,68,"The many laughs we have had together would infallibly come across me , and Frederick and his knapsack would be obliged to run away . ” Pleasantly , courteously , it was spoken ; but the manner was lost in the matter to Julia ’s feelings . ","The many laughs we have had together would infallibly come across me , and Frederick and his knapsack would be obliged to run away . ” Pleasantly , courteously , it was spoken ; but the manner was lost in the matter to Julia ’s feelings . "
mansfield_7,1,69,"She saw a glance at Maria which confirmed the injury to herself : it was a scheme , a trick ; she was slighted , Maria was preferred ; the smile of triumph which Maria was trying to suppress shewed how well it was understood ; and before Julia could command herself enough to speak , her brother gave his weight against her too , by saying , “ Oh yes ! ","She saw a glance at Maria which confirmed the injury to herself : it was a scheme , a trick ; she was slighted , Maria was preferred ; the smile of triumph which Maria was trying to suppress shewed how well it was understood ; and before Julia could command herself enough to speak , her brother gave his weight against her too , by saying , “ Oh yes ! "
mansfield_7,1,70,Maria must be Agatha . ,Maria must be Agatha . 
mansfield_7,1,71,Maria will be the best Agatha . ,Maria will be the best Agatha . 
mansfield_7,1,72,"Though Julia fancies she prefers tragedy , I would not trust her in it . ","Though Julia fancies she prefers tragedy , I would not trust her in it . "
mansfield_7,1,73,There is nothing of tragedy about her . ,There is nothing of tragedy about her . 
mansfield_7,1,74,She has not the look of it . ,She has not the look of it . 
mansfield_7,1,75,"Her features are not tragic features , and she walks too quick , and speaks too quick , and would not keep her countenance . ","Her features are not tragic features , and she walks too quick , and speaks too quick , and would not keep her countenance . "
mansfield_7,1,76,"She had better do the old countrywoman : the Cottager ’s wife ; you had , indeed , Julia . ","She had better do the old countrywoman : the Cottager ’s wife ; you had , indeed , Julia . "
mansfield_7,1,77,"Cottager ’s wife is a very pretty part , I assure you . ","Cottager ’s wife is a very pretty part , I assure you . "
mansfield_7,1,78,The old lady relieves the high - flown benevolence of her husband with a good deal of spirit . ,The old lady relieves the high - flown benevolence of her husband with a good deal of spirit . 
mansfield_7,1,79,You shall be Cottager ’s wife . ” ,You shall be Cottager ’s wife . ” 
mansfield_7,1,80,“ Cottager ’s wife ! ” cried Mr. Yates . ,“ Cottager ’s wife ! ” cried Mr. Yates . 
mansfield_7,1,81,“ What are you talking of ? ,“ What are you talking of ? 
mansfield_7,1,82,"The most trivial , paltry , insignificant part ; the merest commonplace ; not ","The most trivial , paltry , insignificant part ; the merest commonplace ; not "
mansfield_7,1,83,a tolerable speech in the whole . ,a tolerable speech in the whole . 
mansfield_7,1,84,Your sister do that ! ,Your sister do that ! 
mansfield_7,1,85,It is an insult to ,It is an insult to 
mansfield_7,1,86,propose ,propose 
mansfield_7,1,87,it ,it 
mansfield_7,1,88,. ,. 
mansfield_7,1,89,At Ecclesford the governess was to have done it . ,At Ecclesford the governess was to have done it . 
mansfield_7,1,90,We all agreed that it could not be offered to anybody else . ,We all agreed that it could not be offered to anybody else . 
mansfield_7,1,91,"A little more justice , Mr. Manager , if you please . ","A little more justice , Mr. Manager , if you please . "
mansfield_7,1,92,"You do not deserve the office , if you can not appreciate the talents of your company a little better . ” ","You do not deserve the office , if you can not appreciate the talents of your company a little better . ” "
mansfield_7,1,93,"“ Why , as to _ that _ , my good friend , till I and my company have really acted there must be some guesswork ; but I mean no disparagement to Julia . ","“ Why , as to _ that _ , my good friend , till I and my company have really acted there must be some guesswork ; but I mean no disparagement to Julia . "
mansfield_7,1,94,"We can not have two Agathas , and we must have one Cottager ’s wife ; and I am sure I set her the example of moderation myself in being satisfied with the old Butler . ","We can not have two Agathas , and we must have one Cottager ’s wife ; and I am sure I set her the example of moderation myself in being satisfied with the old Butler . "
mansfield_7,1,95,"If the part is trifling she will have more credit in making something of it ; and if she is so desperately bent against everything humorous , let her take Cottager ’s speeches instead of Cottager ’s wife ’s , and so change the parts all through ; _ he _ ","If the part is trifling she will have more credit in making something of it ; and if she is so desperately bent against everything humorous , let her take Cottager ’s speeches instead of Cottager ’s wife ’s , and so change the parts all through ; _ he _ "
mansfield_7,1,96,"is solemn and pathetic enough , I am sure . ","is solemn and pathetic enough , I am sure . "
mansfield_7,1,97,"It could make no difference in the play , and as for Cottager himself , when he has got his wife ’s speeches , _ I _ would undertake him with all my heart . ” “ With all your partiality for Cottager ’s wife , ” said Henry Crawford , “ it will be impossible to make anything of it fit for your sister , and we must not suffer her good - nature to be imposed on . ","It could make no difference in the play , and as for Cottager himself , when he has got his wife ’s speeches , _ I _ would undertake him with all my heart . ” “ With all your partiality for Cottager ’s wife , ” said Henry Crawford , “ it will be impossible to make anything of it fit for your sister , and we must not suffer her good - nature to be imposed on . "
mansfield_7,1,98,We must not _ allow _ her to accept the part . ,We must not _ allow _ her to accept the part . 
mansfield_7,1,99,She must not be left to her own complaisance . ,She must not be left to her own complaisance . 
mansfield_7,1,100,Her talents will be wanted in Amelia . ,Her talents will be wanted in Amelia . 
mansfield_7,1,101,Amelia is a character more difficult to be well represented than even Agatha . ,Amelia is a character more difficult to be well represented than even Agatha . 
mansfield_7,1,102,I ,I 
mansfield_7,1,103,consider Amelia is the most difficult character in the whole piece . ,consider Amelia is the most difficult character in the whole piece . 
mansfield_7,1,104,"It requires great powers , great nicety , to give her playfulness and simplicity without extravagance . ","It requires great powers , great nicety , to give her playfulness and simplicity without extravagance . "
mansfield_7,1,105,I have seen good actresses fail in the part . ,I have seen good actresses fail in the part . 
mansfield_7,1,106,"Simplicity , indeed , is beyond the reach of almost every actress by profession . ","Simplicity , indeed , is beyond the reach of almost every actress by profession . "
mansfield_7,1,107,It requires a delicacy of feeling which they have not . ,It requires a delicacy of feeling which they have not . 
mansfield_7,1,108,It requires a gentlewoman — a Julia Bertram . ,It requires a gentlewoman — a Julia Bertram . 
mansfield_7,1,109,"You _ will _ undertake it , I hope ? ” turning to her with a look of anxious entreaty , which softened her a little ; but while she hesitated what to say , her brother again interposed with Miss Crawford ’s better claim . ","You _ will _ undertake it , I hope ? ” turning to her with a look of anxious entreaty , which softened her a little ; but while she hesitated what to say , her brother again interposed with Miss Crawford ’s better claim . "
mansfield_7,1,110,"“ No , no , Julia must not be Amelia . ","“ No , no , Julia must not be Amelia . "
mansfield_7,1,111,It is not at all the part for her . ,It is not at all the part for her . 
mansfield_7,1,112,She would not like it . ,She would not like it . 
mansfield_7,1,113,She would not do well . ,She would not do well . 
mansfield_7,1,114,She is too tall and robust . ,She is too tall and robust . 
mansfield_7,1,115,"Amelia should be a small , light , girlish , skipping figure . ","Amelia should be a small , light , girlish , skipping figure . "
mansfield_7,1,116,"It is fit for Miss Crawford , and Miss Crawford only . ","It is fit for Miss Crawford , and Miss Crawford only . "
mansfield_7,1,117,"She looks the part , and I am persuaded will do it admirably . ” ","She looks the part , and I am persuaded will do it admirably . ” "
mansfield_7,1,118,"Without attending to this , Henry Crawford continued his supplication . ","Without attending to this , Henry Crawford continued his supplication . "
mansfield_7,1,119,"“ You must oblige us , ” said he , “ indeed you must . ","“ You must oblige us , ” said he , “ indeed you must . "
