fic_id,chapter_id,para_id,text,text_tokenized
mansfield_13,1,81,"And as she spoke she was undoing a small parcel , which Fanny had observed in her hand when they met . ","And as she spoke she was undoing a small parcel , which Fanny had observed in her hand when they met . "
mansfield_13,1,82,"Fanny acknowledged her wishes and doubts on this point : she did not know how either to wear the cross , or to refrain from wearing it . ","Fanny acknowledged her wishes and doubts on this point : she did not know how either to wear the cross , or to refrain from wearing it . "
mansfield_13,1,83,"She was answered by having a small trinket - box placed before her , and being requested to chuse from among several gold chains and necklaces . ","She was answered by having a small trinket - box placed before her , and being requested to chuse from among several gold chains and necklaces . "
mansfield_13,1,84,"Such had been the parcel with which Miss Crawford was provided , and such the object of her intended visit : and in the kindest manner she now urged Fanny ’s taking one for the cross and to keep for her sake , saying everything she could think of to obviate the scruples which were making Fanny start back at first with a look of horror at the proposal . ","Such had been the parcel with which Miss Crawford was provided , and such the object of her intended visit : and in the kindest manner she now urged Fanny ’s taking one for the cross and to keep for her sake , saying everything she could think of to obviate the scruples which were making Fanny start back at first with a look of horror at the proposal . "
mansfield_13,1,85,"“ You see what a collection I have , ” said she ; “ more by half than I ever use or think of . ","“ You see what a collection I have , ” said she ; “ more by half than I ever use or think of . "
mansfield_13,1,86,I do not offer them as new . ,I do not offer them as new . 
mansfield_13,1,87,I offer nothing but an old necklace . ,I offer nothing but an old necklace . 
mansfield_13,1,88,"You must forgive the liberty , and oblige me . ” Fanny still resisted , and from her heart . ","You must forgive the liberty , and oblige me . ” Fanny still resisted , and from her heart . "
mansfield_13,1,89,The gift was too valuable . ,The gift was too valuable . 
mansfield_13,1,90,"But Miss Crawford persevered , and argued the case with so much affectionate earnestness through all the heads of William and the cross , and the ball , and herself , as to be finally successful . ","But Miss Crawford persevered , and argued the case with so much affectionate earnestness through all the heads of William and the cross , and the ball , and herself , as to be finally successful . "
mansfield_13,1,91,Fanny ,Fanny 
mansfield_13,1,92,"found herself obliged to yield , that she might not be accused of pride or indifference , or some other littleness ; and having with modest reluctance given her consent , proceeded to make the selection . ","found herself obliged to yield , that she might not be accused of pride or indifference , or some other littleness ; and having with modest reluctance given her consent , proceeded to make the selection . "
mansfield_13,1,93,"She looked and looked , longing to know which might be least valuable ; and was determined in her choice at last , by fancying there was one necklace more frequently placed before her eyes than the rest . ","She looked and looked , longing to know which might be least valuable ; and was determined in her choice at last , by fancying there was one necklace more frequently placed before her eyes than the rest . "
mansfield_13,1,94,"It was of gold , prettily worked ; and though Fanny would have preferred a longer and a plainer chain as more adapted for her purpose , she hoped , in fixing on this , to be chusing what Miss Crawford least wished to keep . ","It was of gold , prettily worked ; and though Fanny would have preferred a longer and a plainer chain as more adapted for her purpose , she hoped , in fixing on this , to be chusing what Miss Crawford least wished to keep . "
mansfield_13,1,95,"Miss Crawford smiled her perfect approbation ; and hastened to complete the gift by putting the necklace round her , and making her see how well it looked . Fanny had not a word to say against its becomingness , and , excepting what remained of her scruples , was exceedingly pleased with an acquisition so very apropos . ","Miss Crawford smiled her perfect approbation ; and hastened to complete the gift by putting the necklace round her , and making her see how well it looked . Fanny had not a word to say against its becomingness , and , excepting what remained of her scruples , was exceedingly pleased with an acquisition so very apropos . "
mansfield_13,1,96,"She would rather , perhaps , have been obliged to some other person . ","She would rather , perhaps , have been obliged to some other person . "
mansfield_13,1,97,But this was an unworthy feeling . ,But this was an unworthy feeling . 
mansfield_13,1,98,Miss Crawford had anticipated her wants with a kindness which proved her a real friend . ,Miss Crawford had anticipated her wants with a kindness which proved her a real friend . 
mansfield_13,1,99,"“ When I wear this necklace I shall always think of you , ” said she , “ and feel how very kind you were . ” ","“ When I wear this necklace I shall always think of you , ” said she , “ and feel how very kind you were . ” "
mansfield_13,1,100,"“ You must think of somebody else too , when you wear that necklace , ” replied Miss Crawford . ","“ You must think of somebody else too , when you wear that necklace , ” replied Miss Crawford . "
mansfield_13,1,101,"“ You must think of Henry , for it was his choice in the first place . ","“ You must think of Henry , for it was his choice in the first place . "
mansfield_13,1,102,"He gave it to me , and with the necklace I make over to you all the duty of remembering the original giver . ","He gave it to me , and with the necklace I make over to you all the duty of remembering the original giver . "
mansfield_13,1,103,It is to be a ,It is to be a 
mansfield_13,1,104,family ,family 
mansfield_13,1,105,remembrancer ,remembrancer 
mansfield_13,1,106,. ,. 
mansfield_13,1,107,The sister is not to be in your mind without bringing the brother too . ,The sister is not to be in your mind without bringing the brother too . 
mansfield_13,1,108,” ,” 
mansfield_13,1,109,"Fanny , in great astonishment and confusion , would have returned the present instantly . ","Fanny , in great astonishment and confusion , would have returned the present instantly . "
mansfield_13,1,110,"To take what had been the gift of another person , of a brother too , impossible ! ","To take what had been the gift of another person , of a brother too , impossible ! "
mansfield_13,1,111,it must not be ! ,it must not be ! 
mansfield_13,1,112,"and with an eagerness and embarrassment quite diverting to her companion , she laid down the necklace again on its cotton , and seemed resolved either to take another or none at all . ","and with an eagerness and embarrassment quite diverting to her companion , she laid down the necklace again on its cotton , and seemed resolved either to take another or none at all . "
mansfield_13,1,113,Miss Crawford thought she had never seen a prettier consciousness . ,Miss Crawford thought she had never seen a prettier consciousness . 
mansfield_13,1,114,"“ My dear child , ” said she , laughing , “ what are you afraid of ? ","“ My dear child , ” said she , laughing , “ what are you afraid of ? "
mansfield_13,1,115,"Do you think Henry will claim the necklace as mine , and fancy you did not come honestly by it ? ","Do you think Henry will claim the necklace as mine , and fancy you did not come honestly by it ? "
mansfield_13,1,116,"or are you imagining he would be too much flattered by seeing round your lovely throat an ornament which his money purchased three years ago , before he knew there was such a throat in the world ? ","or are you imagining he would be too much flattered by seeing round your lovely throat an ornament which his money purchased three years ago , before he knew there was such a throat in the world ? "
mansfield_13,1,117,"or perhaps”—looking archly—“you suspect a confederacy between us , and that what I am now doing is with his knowledge and at his desire ? ” With the deepest blushes Fanny protested against such a thought . ","or perhaps”—looking archly—“you suspect a confederacy between us , and that what I am now doing is with his knowledge and at his desire ? ” With the deepest blushes Fanny protested against such a thought . "
mansfield_13,1,118,"“ Well , then , ” replied Miss Crawford more seriously , but without at all believing her , “ to convince me that you suspect no trick , and are as unsuspicious of compliment as I have always found you , take the necklace and say no more about it . ","“ Well , then , ” replied Miss Crawford more seriously , but without at all believing her , “ to convince me that you suspect no trick , and are as unsuspicious of compliment as I have always found you , take the necklace and say no more about it . "
mansfield_13,1,119,"Its being a gift of my brother ’s need not make the smallest difference in your accepting it , as I assure you it makes none in my willingness to part with it . ","Its being a gift of my brother ’s need not make the smallest difference in your accepting it , as I assure you it makes none in my willingness to part with it . "
mansfield_13,1,120,He is always giving me something or other . ,He is always giving me something or other . 
mansfield_13,1,121,I have such innumerable presents from him that it is quite impossible for me to value or for him to remember half . ,I have such innumerable presents from him that it is quite impossible for me to value or for him to remember half . 
mansfield_13,1,122,"And as for this necklace , I do not suppose I have worn it six times : it is very pretty , but I never think of it ; and though you would be most heartily welcome to any other in my trinket - box , you have happened to fix on the very one which , if I have a choice , I would rather part with and see in your possession than any other ","And as for this necklace , I do not suppose I have worn it six times : it is very pretty , but I never think of it ; and though you would be most heartily welcome to any other in my trinket - box , you have happened to fix on the very one which , if I have a choice , I would rather part with and see in your possession than any other "
mansfield_13,1,123,. ,. 
mansfield_13,1,124,"Say no more against it , I entreat you . ","Say no more against it , I entreat you . "
mansfield_13,1,125,Such a trifle is not worth half so many words . ,Such a trifle is not worth half so many words . 
mansfield_13,1,126,” ,” 
mansfield_13,1,127,"Fanny dared not make any farther opposition ; and with renewed but less happy thanks accepted the necklace again , for there was an expression in Miss Crawford ’s eyes which she could not be satisfied with . ","Fanny dared not make any farther opposition ; and with renewed but less happy thanks accepted the necklace again , for there was an expression in Miss Crawford ’s eyes which she could not be satisfied with . "
mansfield_13,1,128,It was impossible for her to be insensible of Mr. Crawford ’s change of manners . ,It was impossible for her to be insensible of Mr. Crawford ’s change of manners . 
mansfield_13,1,129,She had long seen it . ,She had long seen it . 
mansfield_13,1,130,"He evidently tried to please her : he was gallant , he was attentive , he was something like what he had been to her cousins : he wanted , she supposed , to cheat her of her tranquillity as he had cheated them ; and whether he might not have some concern in this necklace — she could not be convinced that he had not , for Miss Crawford , complaisant as a sister , was careless as a woman and a friend . ","He evidently tried to please her : he was gallant , he was attentive , he was something like what he had been to her cousins : he wanted , she supposed , to cheat her of her tranquillity as he had cheated them ; and whether he might not have some concern in this necklace — she could not be convinced that he had not , for Miss Crawford , complaisant as a sister , was careless as a woman and a friend . "
mansfield_13,1,131,"Reflecting and doubting , and feeling that the possession of what she had so much wished for did not bring much satisfaction , she now walked home again , with a change rather than a diminution of cares since her treading that path before . ","Reflecting and doubting , and feeling that the possession of what she had so much wished for did not bring much satisfaction , she now walked home again , with a change rather than a diminution of cares since her treading that path before . "
mansfield_13,2,1, XXVII , XXVII 
mansfield_13,2,2,"On reaching home Fanny went immediately upstairs to deposit this unexpected acquisition , this doubtful good of a necklace , in some favourite box in the East room , which held all her smaller treasures ; but on opening the door , what was her surprise to find her cousin Edmund there writing at the table ! ","On reaching home Fanny went immediately upstairs to deposit this unexpected acquisition , this doubtful good of a necklace , in some favourite box in the East room , which held all her smaller treasures ; but on opening the door , what was her surprise to find her cousin Edmund there writing at the table ! "
mansfield_13,2,3,"Such a sight having never occurred before , was almost as wonderful as it was welcome . ","Such a sight having never occurred before , was almost as wonderful as it was welcome . "
mansfield_13,2,4,"“ Fanny , ” said he directly , leaving his seat and his pen , and meeting her with something in his hand , “ I beg your pardon for being here . ","“ Fanny , ” said he directly , leaving his seat and his pen , and meeting her with something in his hand , “ I beg your pardon for being here . "
mansfield_13,2,5,"I came to look for you , and after waiting a little while in hope of your coming in , was making use of your inkstand to explain my errand . ","I came to look for you , and after waiting a little while in hope of your coming in , was making use of your inkstand to explain my errand . "
mansfield_13,2,6,"You will find the beginning of a note to yourself ; but I can now speak my business , which is merely to beg your acceptance of this little trifle — a chain for William ’s cross . ","You will find the beginning of a note to yourself ; but I can now speak my business , which is merely to beg your acceptance of this little trifle — a chain for William ’s cross . "
mansfield_13,2,7,"You ought to have had it a week ago , but there has been a delay from my brother ’s not being in town by several days so soon as I expected ; and I have only just now received it at Northampton . ","You ought to have had it a week ago , but there has been a delay from my brother ’s not being in town by several days so soon as I expected ; and I have only just now received it at Northampton . "
mansfield_13,2,8,"I hope you will like the chain itself , Fanny . ","I hope you will like the chain itself , Fanny . "
mansfield_13,2,9,"I endeavoured to consult the simplicity of your taste ; but , at any rate , I know you will be kind to my intentions , and consider it , as it really is , a token of the love of one of your oldest friends . ","I endeavoured to consult the simplicity of your taste ; but , at any rate , I know you will be kind to my intentions , and consider it , as it really is , a token of the love of one of your oldest friends . "
mansfield_13,2,10,” ,” 
mansfield_13,2,11,"And so saying , he was hurrying away , before Fanny , overpowered by a thousand feelings of pain and pleasure , could attempt to speak ; but quickened by one sovereign wish , she then called out , “ Oh ! ","And so saying , he was hurrying away , before Fanny , overpowered by a thousand feelings of pain and pleasure , could attempt to speak ; but quickened by one sovereign wish , she then called out , “ Oh ! "
mansfield_13,2,12,cousin ,cousin 
mansfield_13,2,13,", stop a moment , pray stop ! ” ",", stop a moment , pray stop ! ” "
mansfield_13,2,14,He turned back . ,He turned back . 
mansfield_13,2,15,"“ I can not attempt to thank you , ” she continued , in a very agitated manner ; “ thanks are out of the question . ","“ I can not attempt to thank you , ” she continued , in a very agitated manner ; “ thanks are out of the question . "
mansfield_13,2,16,I feel much more than I can possibly express . ,I feel much more than I can possibly express . 
mansfield_13,2,17,"Your goodness in thinking of me in such a way is beyond — ” “ If that is all you have to say , Fanny ” smiling and turning away again . ","Your goodness in thinking of me in such a way is beyond — ” “ If that is all you have to say , Fanny ” smiling and turning away again . "
mansfield_13,2,18,"“ No , no , it is not . ","“ No , no , it is not . "
mansfield_13,2,19,I want to consult you . ” ,I want to consult you . ” 
mansfield_13,2,20,"Almost unconsciously she had now undone the parcel he had just put into her hand , and seeing before her , in all the niceness of jewellers ’ packing , a plain gold chain , perfectly simple and neat , she could not help bursting forth again , “ Oh , this is beautiful indeed ! ","Almost unconsciously she had now undone the parcel he had just put into her hand , and seeing before her , in all the niceness of jewellers ’ packing , a plain gold chain , perfectly simple and neat , she could not help bursting forth again , “ Oh , this is beautiful indeed ! "
mansfield_13,2,21,"This is the very thing , precisely what I wished for ! ","This is the very thing , precisely what I wished for ! "
mansfield_13,2,22,This is the only ornament I have ever had a desire to possess . ,This is the only ornament I have ever had a desire to possess . 
mansfield_13,2,23,It will exactly suit my cross . ,It will exactly suit my cross . 
mansfield_13,2,24,They must and shall be worn together . ,They must and shall be worn together . 
mansfield_13,2,25,"It comes , too , in such an acceptable moment . ","It comes , too , in such an acceptable moment . "
mansfield_13,2,26,"Oh , cousin , you do not know how acceptable it is . ” ","Oh , cousin , you do not know how acceptable it is . ” "
mansfield_13,2,27,"“ My dear Fanny , you feel these things a great deal too much . ","“ My dear Fanny , you feel these things a great deal too much . "
mansfield_13,2,28,"I am most happy that you like the chain , and that it should be here in time for to - morrow ; but your thanks are far beyond the occasion . ","I am most happy that you like the chain , and that it should be here in time for to - morrow ; but your thanks are far beyond the occasion . "
mansfield_13,2,29,"Believe me , I have no pleasure in the world superior to that of contributing to yours . ","Believe me , I have no pleasure in the world superior to that of contributing to yours . "
mansfield_13,2,30,"No , I can safely say , I have no pleasure so complete , so unalloyed . ","No , I can safely say , I have no pleasure so complete , so unalloyed . "
mansfield_13,2,31,It is without a drawback . ,It is without a drawback . 
mansfield_13,2,32,” ,” 
mansfield_13,2,33,"Upon such expressions of affection Fanny could have lived an hour without saying another word ; but Edmund , after waiting a moment , obliged her to bring down her mind from its heavenly flight by saying , “ But what is it that you want to consult me about ? ","Upon such expressions of affection Fanny could have lived an hour without saying another word ; but Edmund , after waiting a moment , obliged her to bring down her mind from its heavenly flight by saying , “ But what is it that you want to consult me about ? "
mansfield_13,2,34,” ,” 
mansfield_13,2,35,"It was about the necklace , which she was now most earnestly longing to return , and hoped to obtain his approbation of her doing . ","It was about the necklace , which she was now most earnestly longing to return , and hoped to obtain his approbation of her doing . "
mansfield_13,2,36,"She gave the history of her recent visit , and now her raptures might well be over ; ","She gave the history of her recent visit , and now her raptures might well be over ; "
mansfield_13,2,37,"for Edmund was so struck with the circumstance , so delighted with what Miss Crawford had done , so gratified by such a coincidence of conduct between them , that Fanny could not but admit the superior power of one pleasure over his own mind , though it might have its drawback . ","for Edmund was so struck with the circumstance , so delighted with what Miss Crawford had done , so gratified by such a coincidence of conduct between them , that Fanny could not but admit the superior power of one pleasure over his own mind , though it might have its drawback . "
mansfield_13,2,38,"It was some time before she could get his attention to her plan , or any answer to her demand of his opinion : he was in a reverie of fond reflection , uttering only now and then a few half - sentences of praise ; but when he did awake and understand , he was very decided in opposing what she wished . ","It was some time before she could get his attention to her plan , or any answer to her demand of his opinion : he was in a reverie of fond reflection , uttering only now and then a few half - sentences of praise ; but when he did awake and understand , he was very decided in opposing what she wished . "
mansfield_13,2,39,“ Return the necklace ! ,“ Return the necklace ! 
mansfield_13,2,40,"No , my dear Fanny , upon no account . ","No , my dear Fanny , upon no account . "
mansfield_13,2,41,It would be ,It would be 
mansfield_13,2,42,mortifying her severely . ,mortifying her severely . 
mansfield_13,2,43,There can hardly be a more unpleasant sensation than the having anything returned on our hands which we have given with a reasonable hope of its contributing to the comfort of a friend . ,There can hardly be a more unpleasant sensation than the having anything returned on our hands which we have given with a reasonable hope of its contributing to the comfort of a friend . 
mansfield_13,2,44,Why should she lose a pleasure which she has shewn herself so deserving of ? ” ,Why should she lose a pleasure which she has shewn herself so deserving of ? ” 
mansfield_13,2,45,"“ If it had been given to me in the first instance , ” said Fanny , “ I should not have thought of returning it ; but being her brother ’s present , is not it fair to suppose that she would rather not part with it , when it is not wanted ? ” ","“ If it had been given to me in the first instance , ” said Fanny , “ I should not have thought of returning it ; but being her brother ’s present , is not it fair to suppose that she would rather not part with it , when it is not wanted ? ” "
mansfield_13,2,46,"“ She must not suppose it not wanted , not acceptable , at least : and its having been originally her brother ’s gift makes no difference ; for as she was not prevented from offering , nor you from taking it on that account , it ought not to prevent you from keeping it . ","“ She must not suppose it not wanted , not acceptable , at least : and its having been originally her brother ’s gift makes no difference ; for as she was not prevented from offering , nor you from taking it on that account , it ought not to prevent you from keeping it . "
mansfield_13,2,47,"No doubt it is handsomer than mine , and fitter for a ballroom . ” ","No doubt it is handsomer than mine , and fitter for a ballroom . ” "
mansfield_13,2,48,"“ No , it is not handsomer , not at all handsomer in its way , and , for my purpose , not half so fit . ","“ No , it is not handsomer , not at all handsomer in its way , and , for my purpose , not half so fit . "
mansfield_13,2,49,The chain will agree with William ’s cross beyond all comparison better than the necklace . ” ,The chain will agree with William ’s cross beyond all comparison better than the necklace . ” 
mansfield_13,2,50,"“ For one night , Fanny , for only one night , if it _ be _ a sacrifice ; I am sure you will , upon consideration , make that sacrifice rather than give pain to one who has been so studious of your comfort . ","“ For one night , Fanny , for only one night , if it _ be _ a sacrifice ; I am sure you will , upon consideration , make that sacrifice rather than give pain to one who has been so studious of your comfort . "
mansfield_13,2,51,"Miss Crawford ’s attentions to you have been — not more than you were justly entitled to — I am the last person to think that _ could _ _ be _ , but they have been invariable ; and to be returning them with what must have something the _ air _ of ingratitude , though I know it could never have the _ meaning _ , is not in your nature , I am sure . ","Miss Crawford ’s attentions to you have been — not more than you were justly entitled to — I am the last person to think that _ could _ _ be _ , but they have been invariable ; and to be returning them with what must have something the _ air _ of ingratitude , though I know it could never have the _ meaning _ , is not in your nature , I am sure . "
